अब तक	గతంలో
- हम पीछे हटने का संकेत दें? - नहीं।	- మనం వెనుదిరుగుదామా? - వద్దు.
सौरॉन हाथ से निकलना नहीं चाहिए।	సౌరోన్ తప్పించుకోకూడదు.
वह दीवार गिराओ। किसी भी कीमत पर।	ఈ గోడను పడగొట్టండి. ఎలాగైనా.
अदार!	అడార్!
तुमने हमसे कहा था कि... तुम हमसे प्यार करते हो।	మీరు మాకు చెప్పారు... మమ్మల్ని ప్రేమిస్తున్నారని.
जितना मेरा यह दिल कर सकता है।	నా మనస్ఫూర్తిగా.
इतना कि तुम लोगों को सौरॉन का ग़ुलाम बनते हुए नहीं देख सकता।	మిమ్మల్ని సౌరోన్‌కి బానిసలుగా చేయడం కన్నా చాలా ఎక్కువ.
जल्दी करो!	త్వరగా!
वह अब भी शिविर में है। उसे ढूँढो!	ఆమె ఇంకా శిబిరంలోనే ఉంది. ఆమెను వెతకండి!
यह जा चुका है।	అతను వెళ్ళిపోయాడు.
ए। तुम! यहाँ आकर मदद करो।	ఏయ్! నిన్నే! ఇక్కడికి వచ్చి సాయం చెయ్.
यह मर चुका है।	అతను చనిపోయాడు.
आग की लपटों में वे अंधेरे में लौटेंगे।	మంటల్లో చీకటిలోకి తిరిగి చేరుకుంటారు.
आग की लपटों में वे अंधेरे में लौटेंगे।	మంటల్లో చీకటిలోకి తిరిగి చేరుకుంటారు.
ज़रा इन ख़ूबसूरत ज़ुल्फ़ों को देखो।	ఆ చక్కని జుట్టును చూడు.
तुम्हें यहाँ जो भी शक्ति लेकर आई, सैनिक,	నిన్నిక్కడికి తీసుకొచ్చిన శక్తి ఏదైనా, సైనికుడా,
मैं उसकी आभारी हूँ।	దానికి నేను కృతజ్ఞురాలిని.
आओ, मुझे शहर में जाने का एक गुप्त रास्ता पता है। हमें सौरॉन को ढूँढना होगा।	రా, నాకు ఒక నగరంలోకి ఒక రహస్య మార్గం తెలుసు. మనం సౌరోన్‌ను కనుగొనాలి.
मैं यहाँ उसके लिए आया हूँ।	నేను అతనికోసం వచ్చాను.
अगर अभी उस पर हमला किया, तो अपनी ज़िंदगी से हाथ धो बैठोगे।	ఇప్పుడు అతనిని వ్యతిరేకించావంటే, నీ ప్రాణం పోతుంది.
वह मेरी जान ले सकता है।	దాన్ని అతను తీసుకోవచ్చు.
उसने मुझसे बाकी सब कुछ भी तो छीन लिया है।	నానుండి అతను అన్నీ తీసుకున్నాడు.
अरोंडीर।	అరోండీర్.
आज रात एल्वन शूरवीरों की बहुत कमी है।	ఈ రాత్రికి ఎల్ఫ్ వీరుల కొరత ఉన్నది.
एक और शूरवीर को खोना बहुत दुख की बात होगी।	మరొకరిని కోల్పోవడం దయనీయం.
और अदार के साथ असली लड़ाई तो बाद में होगी।	అడార్‌తో అసలైన యుద్ధం ముందు ఉంది.
सेना पश्चिमी द्वार पर खड़ी है, राजकुमार डुरिन	సైన్యం పశ్చిమ ద్వారం దగ్గర సమావేశమయింది.
बहुत ख़ूब।	మంచిది.
डुरिन!	డ్యూరిన్!
राजकुमार डुरिन!	డ్యూరిన్ రాకుమారా!
रुक जाओ!	ఆగండి!
तुम्हारे पिता ने मेरे आदमियों के खिलाफ़ कुल्हाड़ी उठाई।	మీ తండ్రిగారు, మా వాళ్ళ మీద గొడ్డలితో దాడి చేశారు.
उन्हें गेहूँ की फसल की तरह काटते हुए चले गए।	వాళ్ళను గోధుమ మొక్కలను నరికినట్టు, నరికారు.
पर वह खुदाई करके रहेंगे।	ఆయన తవ్వబోతున్నారు.
वह उस राक्षस को खुला छोड़ देंगे!	ఆ రాక్షసుడిని విడుదల చేయబోతున్నారు!
- डिसा, क्या वह... - मुझे नहीं पता।	- డీసా, ఆమె... - నాకు తెలియదు.
पर उसने मुझे तुम्हें ढूँढने के लिए भेजा।	కానీ మిమ్మల్ని కనుగొనమని నన్ను పంపింది.
वह बोल रही थी कि तुम्हें सेना वापस बुलानी होगी।	మీరు సైన్యాన్ని వెనుకకు పిలవాలని ఆమె చెప్పింది.
और एलरॉन्ड का क्या?	ఎల్రోండ్ సంగతి ఏంటి?
अगर तुम अभी सेना को एरेगियन लेकर गए,	వెంటనే ఆ సైన్యాన్ని ఎరెజియోన్ తీసుకెళ్ళండి,
तो शायद तुम्हारे लौटने तक खाज़ाद-डुम नहीं बचेगा।	మీరు తిరిగొచ్చేసరికి ఖజాద్- దుమ్ ఇక్కడ ఉండకపోవచ్చు.
डरो मत। यह समय भी बीत जाएगा।	భయపడకండి. ఇది కూడా తప్పిపోతుంది.
मैं तुमसे वादा करता हूँ, जब मध्य-धरती ठीक हो जाएगी,	మీకు ప్రమాణం చేస్తున్నాను, మిడిల్ - ఎర్త్ బాగయ్యాక,
और इसके लोग देखेंगे कि तुमने और मैंने क्या किया...	దాని ప్రజలు మీరు, నేనూ ఇక్కడ చేసింది చూశాక...
तो हमारी कुर्बानियाँ सफल हो जाएँगी।	మనం పడ్డ కష్టాలకు ప్రతిఫలం దక్కుతుంది.
"""हमारी कुर्बानियाँ""?"	"""మన కష్టాలా""?"
तुम्हें पता होना चाहिए कि तुमसे इस तरह पेश आकर मुझे दर्द होता है...	నాకు బాధగా ఉందని మీరు తెలుసుకోవాలి, మీతో ఇలా వ్యవహరించడం...
जैसे तुम कइयों के साथ पेश आए हो?	లెక్కలేనంతమందితో వ్యవహరించినట్టుగానా?
जैसे मॉरगौथ मेरे साथ करता।	మోర్గోత్ నన్ను చూసినట్టుగా.
जानते हो एक देवता के हाथों ऐसा ज़ुल्म सहना कैसा होता है?	దేవుడి చేతులో చిత్రహింసకు గురయితే ఎలా ఉంటుందో తెలుసా?
मैं तो सोच भी नहीं सकता।	నేను ఊహించలేను.
मुझे अंत दिख रहा है, कैलेब्रिम्बोर।	నాకు అంతం కనబడుతోంది, కెలెబ్రింబోర్.
बिल्कुल साफ़-साफ़।	చాలా స్పష్టంగా.
मैं जब से जागा हूँ, वह तब से दिख रहा है।	అది నేను మేల్కొన్నప్పటి నుండీ చూస్తున్నాను.
पर उसका अंत मुझसे अलग था।	కానీ అతని అంతం, నాదానికి భిన్నమైనది.
क्योंकि वह जिसे नष्ट करना चाहता था, मैं उसे... उत्तम बनाना चाहता हूँ।	అతను నాశనం చేయాలని అనుకున్నది, నేను... పరిపూర్ణం కావాలని అనుకున్నాను.
कभी-कभी, दर्द एक इनाम बन जाता था।	ఒక్కోసారి, బాధ దాదాపుగా వరంగా మారింది.
एक खेल बन जाता था।	ఆటలా మారింది.
एक मुकाबला, यह देखने के लिए कि कौन ज़्यादा ताक़तवर है।	ఎవరి సంకల్పం శక్తివంతమైనదో తెలుసుకునే పోటీ.
और इस सबके बाद भी तुम मुझे वही दर्द देना चाहते हो?	అంత జరిగాక కూడా, నువ్వు నాకు అదే బాధను కలిగించాలని అనుకుంటున్నావా?
नहीं।	లేదు.
तुमने उसे चुना है।	నువ్వు అది ఎంచుకున్నావు.
मैंने नहीं।	నేను కాదు.
क्या?	ఏంటి?
सब कुछ... अँगूठियों पर निर्भर करता है।	అది అధారపడి ఉన్నది... ఉంగరాలు మీద.
और क्योंकि इन्हें बनाने के लिए	నువ్వు వాటిని ఉనికిలోకి తీసుకురావడానికి
तुमने मुझे तुम्हें तड़पाने के लिए मजबूर किया,	నేను నిన్ను హింసించేలా చేశావు కనుక,
मैं बस तुम्हारी ज़िद का शिकार हूँ।	నేను నీ మొండితనానికి బాధితుడిని.
और तुम, अपनी ही यातना का कारण हो।	ఇంకా నువ్వు, నీ హింసకు నువ్వే కర్తవు.
तुम सच में सबसे बड़े मायावी हो।	నువ్వు నిజంగా ఒక గొప్ప మోసగాడివి.
तुम ख़ुद को भी छल सकते हो।	నిన్ను నువ్వే మోసం చేసుకోగలవు.
उनका काम ख़त्म करो।	వాటిని పూర్తి చెయ్.
छोड़ो!	వదలండి!
जल्दी करो!	త్వరగా!
दागो!	కాల్చండి!
तो कौन है हिम्मतवाला?	ఎవరి సంకల్పం శక్తివంతమైనది?
देखो इन्होंने अपने साथ क्या कर लिया।	అతన్ని అతనే ఏం చేసుకున్నాడో చూడు.
बुढऊ वाकई पागल हो गए हैं।	ముసలోడికి నిజంగా పిచ్చి.
आपको मीनार में ही रहना होगा, ताकि आप अपने लिए ख़तरा न बनें।	మీరు కోటలోనే ఉండాలి, మీకు ఏ ప్రమాదం జరగకూడదంటే.
एरेगियन के राजा, अन्नाटार के आदेश के अनुसार।	ఎరెజియోన్ ప్రభువు, అన్నాటార్ ఆదేశాల మేరకు.
उन्हें छोड़ दो।	అతనిని విడుదల చేయండి.
देवी?	అమ్మా?
यह लॉर्ड कैलेब्रिम्बोर हैं। महानतम ऐल्वन-शिल्पकार।	అతను కెలెబ్రింబోర్ ప్రభువు. ఎల్ఫులలో అత్యుత్తమ నిపుణుడు.
- छोड़ो। - पर एरेगियन के राजा का आदेश...	- వదిలేయండి. - ఎరెజియోన్ ప్రభు ఆదేశం...
ये ही एरेगियन के राजा हैं।	ఈయనే ఎరెజియోన్ ప్రభువు.
कैलेब्रिम्बोर, मैं आई हूँ।	కెలెబ్రింబోర్, నేనే.
कैलेब्रिम्बोर।	కెలెబ్రింబోర్.
जब मैंने तुम्हें देखा,	నేను నిన్ను చూసినప్పుడు,
तो एक पल के लिए, मुझे लगा कि तुम बस मेरे मन का भ्रम हो,	ఒక్క క్షణం పాటు, ఖచ్చితంగా నువ్వు మరో భ్రమవని అనుకున్నాను,
एक और क्रूरता जो मुझे झूठी आशा देकर सताने के लिए बनाई गई थी।	తప్పుడు ఆశలతో హింసించడానికి మరో క్రూరమైన పన్నాగం అనుకున్నాను.
सौरॉन?	సౌరోన్?
और अँगूठियाँ?	మరిన్ని ఉంగరాలా?
नौ।	తొమ్మిది.
इंसानों की दुनिया को गुलाम बनाने के लिए नौ अँगूठियाँ।	మానవ ప్రపంచాన్ని బానిసలుగా మార్చేందుకు తొమ్మిది ఉంగరాలు.
और उसने मुझे... अपने वश में करके अपना गुलाम बनाया।	అతను... నన్ను బానిసగా మార్చినట్టుగా.
यह... यह मेरी ही ग़लती थी।	అది... అది నా తప్పే.
नहीं!	కాదు!
शुरू से ही, मुझे अंदर ही अंदर... एक अंदाज़ा था।	మొదటినుండీ, నాలో ఒక భాగానికి... తెలుసు.
मैंने ग़ौर भी किया था। पर मैं... मैं लालच में डूब गया था।	నాలో ఒక భాగం అది చూసింది. కానీ నాకు... నాకు అతను ఇచ్చినది కావాలి.
तो मैंने उसके असली चेहरे को अनदेखा कर दिया।	దానికోసం, నేను, అతనేంటో, విస్మరించాను.
मैंने भी।	నేను కూడా.
- वह आ गया। - जल्दी करो।	- అది అతనే. - త్వరగా.
पुरानी बौनों वाली सुरंग। मैं उससे बिना किसी की नज़र में आए शहर में आई।	పాత మరుగుజ్జుల సొరంగం. ఎవరికీ తెలియకుండా నగరానికి వెళ్ళేందుకు ఉపయోగించేదాన్ని.
वह तुम्हें और अँगूठियों को यहाँ से ले जाएगी।	అది నిన్ను, ఉంగరాలను దూరంగా తీసుకెళుతుంది.
नहीं।	లేదు. లేదు.
जाओ! इसी वक़्त!	వెళ్ళు! వెంటనే!
मैं नहीं जा सकता। इन्हें तुम ले जाओ।	నేను వెళ్ళలేను. నువ్వు వెళ్ళాలి.
वह समझ जाएगा कि क्या हुआ। वह अँगूठियों के पीछे आएगा।	అతనికి తెలిసిపోతుంది. అతను ఉంగరాల కోసం వస్తాడు.
मैं यह पक्का करूँगा कि ऐसा होने से पहले थोड़ा समय ज़ाया हो।	అది జరగడానికి ఇంకొంచెం సమయం ఉండేలా చూస్తాను.
अँगूठियों को लेकर जाओ, शहर में जिसको बचा सकती हो, उसे बचाओ। जल्दी!	ఉంగరాలు తీసుకో, నగరంలో నువ్వు కాపాడగలిగిన వాళ్ళను కాపాడు. వెళ్ళు!
नहीं।	వెళ్ళను.
तुम्हें उसका अकेले सामना नहीं करने दूँगी!	నిన్ను అతనిని ఒంటరిగా ఎదుర్కోనివ్వను!
मैंने... मैंने यह शहर बनाया था।	నేను... నేను ఈ నగరాన్ని నిర్మించాను.
मेरी सही जगह यहीं पर है।	నేను ఉండాల్సిన చోటు ఇదే.
और यह अकेले नहीं हैं।	అతను ఒంటరిగా ఉండడు.
मुझे माफ़ करना। मैं उसे यहाँ लेकर आई।	నన్ను క్షమించు. అతనిని ఇక్కడికి నేనే తీసుకొచ్చాను.
मुझे माफ़ करना कि मुझमें इतनी ताक़त नहीं थी।	నేను దృఢంగా ఉండలేకపోయినందుకు క్షమించు.
हममें से किसी में भी इतनी ताक़त नहीं थी।	మనిద్దరమూ దృఢంగా లేము.
शायद मध्य-धरती में ऐसा कोई भी नहीं जिसमें इतनी ताक़त हो।	మిడిల్ - ఎర్త్‌లో అలా ఎవరూ ఉండి ఉండరు.
पर शायद, एल्व्स को बस यह याद रखना होगा	కానీ బహుశా, ఎల్వ్స్ ఇది గుర్తుపెట్టుకోవాల్సి౦ది,
कि अंधकार पर ताक़त से जीत नहीं पाई जाती है,	చీకటిని జయించగలిగేది బలం కాదు,
रोशनी से पाई जाती है।	కాంతి అని.
सेनाएँ आक्रमण कर सकती हैं,	సైన్యాలు పెరగవచ్చు,
हिम्मत टूट सकती है,	మనసులు విఫలం కావచ్చు,
फिर भी, रोशनी बरकरार रहती है, और ताक़त को मात दे सकती है।	అయినా కాంతి నిలబడగలదు, అది బలంకంటే శక్తివంతమైనది.
क्योंकि उसकी उपस्थिति में, सारा अंधकार लुप्त हो जाता है।	అది ఉన్న చోట, చీకటి అంతా పారిపోవాలి.
फिर से! हम बस वहाँ पहुँच ही गए!	మళ్ళీ! మనం దాదాపుగా అక్కడికి చేరుకున్నాము!
वे जल्द ही दीवार तोड़ देंगे, कमांडर। है न?	వాళ్ళు త్వరలోనే గోడను పడగొడతారు, దళపతి. కదా?
नहीं, रिआन! हमारा दुश्मन वह दीवार नहीं तोड़ पाएगा!	లేదు, రియాన్! మన శత్రువు ఆ గోడను పడగొట్టలేడు!
तुम्हारा छोड़ा एक तीर शायद अब भी हवा के रुख को बदल दे।	నువ్వు సంధించిన ఒక్క బాణం అలను తిప్పిగొట్టగలదు.
- तुम्हारे पास कितने जलते तीर हैं? - इतने कि मेरा काम हो जाए।	- నీ దగ్గర నిప్పు బాణాలు ఎన్ని ఉన్నాయి? - నా వంతుకు సరిపడా.
बस एक साफ़ दृष्टिपथ चाहिए।	నా దృష్టికి ఏ అడ్డు ఉండకూడద౦తే.
मेरे पीछे आओ।	నాతో రా.
चलो!	వెళ్ళు!
निशाना लगाओ!	ప్రయత్నించు!
नहीं।	వద్దు.
उसे नष्ट कर दो!	దానిని నాశనం చెయండి!
उसे अंदर भेजो।	అతనిని పంపించు.
पितृदेव, वह हमारे लोगों को मार डालेगा।	ప్రభు పితా, అతను మన సొంత వాళ్ళను చంపేస్తాడు.
उसे अंदर भेजो।	అతనిని పంపించు.
ऑर्क्स भाग रहे हैं!	ఓర్క్స్, వాళ్ళు పారిపోతున్నారు!
नहीं। वे एक रास्ता बना रहे हैं।	లేదు. వాళ్ళు మార్గం సుగమం చేసుకుంటున్నారు.
तुम्हें वे यहाँ नहीं मिलेंगे।	నీకు వాళ్ళు ఇక్కడ కనిపించరు.
वे अब तक तुम्हारी पहुँच से बहुत दूर होंगे।	ఈపాటికి వాళ్ళు నీకు అందనంత దూరంగా వెళ్ళుంటారు.
तो फिर तुम उन्हें मेरे पास लाकर मेरे हवाले करोगे।	అయితే నువ్వు వాళ్ళను నా దగ్గరకు తీసుకువచ్చి, నా చేతిలో పెడతావు.
तुम्हारा हाथ फिर कभी किसी अंगूठी को छू नहीं सकेगा।	నీ చేతులు మరో ఉంగరాన్ని ఎప్పటికీ మళ్ళీ తాకలేవు.
एरेगियन के असली राजा के आदेश के अनुसार, सौरॉन, तुम्हें यहाँ से...	ఎరెజియోన్ నిజమైన ప్రభువు ఆదేశాల మేరకు, సౌరోన్, నువ్వు...
तुम्हें लगता है बस तुमने ही ख़ुद को मेरी शक्ति का दास बनाया था?	నా శక్తి బంధంలోకి రాగలిగినవాడివి, నువ్వు ఒక్కడివే అనుకున్నావా?
तुम मुझे वो नौ अँगूठियाँ दोगे।	నువ్వు నాకు తొమ్మిది ఉంగరాలు ఇస్తావు.
वह दीवार तक नहीं पहुँचना चाहिए!	అది గోడవరకు చేరకూడదు!
सेनापति, सावधान!	దళపతి, చూసుకోండి!
