अब तक	గతంలో
तुमने मेरे निर्देश का स्वागत किया। बल्कि उसके लिए विनती की।	నా సూచనను స్వాగతించావు. నిజానికి నువ్వు దానికోసం వేడుకున్నావు.
अब, एक चूहा पास से क्या गुज़र गया, तुम अपने दिमाग़ पर काबू ही खो बैठे।	ఇప్పుడు, ఒక ఎలుక పరిగెత్తుకు రాగానే, బెంబేలెత్తిపోయావు.
ख़ुद को सुनो।	నీ మాటలు విను.
तुमने मेरे साथ क्या किया है?	నన్ను ఏమి చేశావు?
वलार का कोई भी दूत ऐसा नहीं करेगा।	వాలార్ దూత ఎవరూ ఇలా చేయరు.
सच बताओ... तुम कौन हो?	ఎవరు నువ్వు... నిజంగా?
मैं ही वह हूँ जिसने तूफ़ान को रोककर रखा है।	నేను తుఫానును ఆపుతున్న ఏకైక వ్యక్తిని.
तुम्हारे सिर के ऊपर सलामती का साया रखा है।	నీ తలపై సూర్యుడిని సమతుల్యంగా ఉంచుతున్నాను.
वह भी बस तुम्हें अपनी काबिलियत साबित करने का एक मौका देने के लिए!	ఇదంతా నీ సామర్థ్యాన్ని నిరూపించుకునే ఈ ఒక్క అవకాశం నీకు ఇవ్వడానికే!
अब, मुझे वो नौ चाहिए!	ఇప్పుడు, నాకు తొమ్మిది ఉంగరాలు కావాలి!
नहीं!	వద్దూ!
क्या... मिथ्रिल।	ఏంటి... మిత్రిల్.
यह क्या... यह क्या है?	ఇది... ఇదేంటి?
एरेगियन आने के बाद से मैंने तुमसे बहुत कुछ सीखा है।	నేను ఎరెజియోన్ వచ్చిన దగ్గరనుండీ, నీ దగ్గర చాలా నేర్చుకున్నాను.
पर इससे बड़ा कोई सबक नहीं है।	కానీ దీనికి మించిన శాశ్వతమైన పాఠం లేదు.
सच्ची रचना के लिए...	నిజమైన సృష్టికి...
बलिदान की ज़रूरत होती है।	త్యాగం అవసరం.
तुम ही वह हो।	నువ్వు అతనివే.
है न?	కాదా?
- तुम... - मेरे कई नाम हैं।	- నువ్వు... - నాకు చాలా పేర్లు ఉన్నాయి.
मिर्दानिया!	మిర్డానియా!
वलार का शुक्र है कि तुम ज़िंदा हो।	బతికున్నావు, వాలార్‌కు కృతజ్ఞతలు.
हमारे साथ छल हुआ है। हम सबके साथ।	మనం మోసపోయాము. మనందరం.
उसने यह पूरी साज़िश रची, अँगूठियाँ बनाने पर मजबूर करने के लिए।	ఇదంతా అతని పన్నాగం, నేను ఉంగరాలు తయారు చేసివ్వడానికి.
उसने मुझे एक तरह की क़ैद में डाला। मन क़ैद करके। पर मैं बाहर निकल गया।	నన్ను ఏదో చెరశాల లాంటి దానిలో పెట్టాడు. మనసును బంధించేది. కానీ నేను బయటపడ్డాను.
मैं बाहर निकल गया।	నేను బయటపడ్డాను.
आक्रमण की वजह से उसका ध्यान भटक गया होगा, तो वह माणिक भूल गया।	ముట్టడితో అతని దృష్టి మళ్ళినట్టుంది, కెంపు విషయం మర్చిపోయాడు.
और मूषक को भी। वही मूषक जो...	ఇంకా ఎలుక. అదే ఎలుక...
और...	ఇంకా...
तुम्हें मुझ पर विश्वास करना होगा।	నువ్వు... నువ్వు నన్ను నమ్మాలి.
तुम्हें मुझ पर विश्वास करना होगा!	నువ్వు నన్ను నమ్మాలి!
यह दीवार का सबसे पतला हिस्सा है।	ఇది గోడలోని అతి సన్నని భాగం.
चलो!	రండి!
हमें नींव को और बल देना होगा! जल्दी करो!	మనం పునాదులను పటిష్టం చేయాలి! త్వరగా, వెంటనే!
उसे गिरफ़्त में लो।	అతనిని బంధించండి.
वह सौरॉन है।	అతను సౌరోన్.
उसे गिरफ़्त में लो!	అతనిని బంధించండి!
यह तुमसे शुरुआत से झूठ बोलता आया है।	ఇప్పటివరకూ అతను మీకు అబద్ధాలు చెబుతున్నాడు.
नहीं। यह हमारी रक्षा कर रहे थे।	లేదు. అతను మమ్మల్ని రక్షిస్తున్నాడు.
जब आप अपनी मीनार में से ऐसे आदेश दे रहे थे जिनसे हमारा	మీరు కోటలో ఉండి, మన అందరినీ అంతం చేయగల ఆదేశాలు
अंत हो सकता था।	ఇస్తున్నప్పుడు.
नहीं, वह इसकी करतूत थी।	లేదు. లేదు, అది అతనే.
वह सौरॉन है!	అతను సౌరోన్!
अगर मेरी बात का यकीन नहीं है, तो इसे काटकर देख लो।	నన్ను నమ్మకపోతే, అతనిని చీల్చి చూడండి.
इसका हाथ देखो, इसका ख़ून देखो।	అతని చేతిని చూడండి, అతని రక్తం చూడండి.
बिल्कुल काला होगा।	కారు నలుపు రంగులో ఉంటుంది.
चलिए, प्रभु। मैं आपको आपकी जगह पर वापस ले चलती हूँ।	రండి, ప్రభు. మిమ్మల్ని మీరు ఉండాల్సిన చోటుకు తిరిగి చేరుస్తాము.
मुझसे दूर रहो! नहीं!	నామీద నీ చేతులు తియ్! అయ్యో!
यह ख़त्म हो सकता है।	ఇదంతా ముగియవచ్చు.
वो नौ अँगूठियाँ तैयार कर दो, और मैं तुम्हारे शहर को बख्श दूँगा।	తొమ్మిది ఉంగరాలు పూర్తి చెయ్, మీ నగరాన్ని వదిలేస్తాను.
तुम अँगूठियों का क्या करोगे?	వాటితో ఏమి చేస్తావు?
एक संपूर्ण और चिरस्थायी शांति स्थापित करूँगा।	పరిపూర్ణమైన, శాశ్వతమైన శాంతిని నెలకోల్పుతాను.
चलो भी!	రండి!
हमारे दुश्मनों को मौत के घाट उतारो!	మన శత్రువులకు మరణమే!
थम जाओ!	ఆగండి!
स्वागत है, सेनापति एलरॉन्ड।	స్వాగతం, దళపతి ఎల్రోండ్.
जो अंगूठी साथ लाए हो।	నువ్వు తెచ్చిన ఉంగరం.
वह मुझे दिखाओ।	అది నాకు చూపించు.
उसे यहाँ लाना तो बेवकूफ़ी होती।	అది ఇక్కడికి తెస్తే, నా మూర్ఖత్వమే.
तुम एक राजनेता हो।	నువ్వు రాజసేవకుడివి.
तुम पर भाषण ज़्यादा जँचते हैं तलवार नहीं।	నువ్వు కత్తి కంటే కాగితపు చుట్టలను బాగా తిప్పగలవు.
मुझे तलवार चलाते देखा नहीं है।	నేనా రెండూ తిప్పడం చూడలేదు నువ్వు.
तुम्हें धावा बोल देना चाहिए, एलरॉन्ड।	దాడి చేస్తూ ఉండాల్సింది, ఎల్రోండ్.
अगर यह दोबारा बोले, तो इसकी ज़ुबान काट देना।	ఆమె మళ్ళీ మాట్లాడితే, ఆమె నాలుక కత్తిరించండి.
सौरॉन मेरा उतना ही बड़ा दुश्मन है, जितना कि तुम्हारा।	సౌరోన్ నాకెంత శత్రువో నీకూ అంతే శత్రువు.
उसे हराने के लिए जो चाहिए, वह मुझे दो ताकि हम सब उससे छुटकारा पा सकें।	అతనిని ఒడించేందుకు నాక్కావాల్సినవి ఇవ్వండి, అతనిని వదిలించుకుందాము.
वह तुम ही तो थे जिसने एरेगियन पर हमला करके उसकी मर्ज़ी पूरी की।	ఎరెజియోన్‌ను ముట్టడించి అతని కోరికను తీర్చింది నువ్వు కాదా?
एरेगियन बुराई की चपेट में आ गया है।	ఎరెజియోన్‌ను ఛాయ స్వాధీనపరుచుకుంది.
वह अब मायावी के कब्ज़े में है, उसकी चारदीवारी में बसने वाले हर एल्फ़ के साथ।	అది ఇప్పుడు మోసగాడికి చెందినది, అలాగే ఆ గోడల్లో ఉన్న ప్రతి ఎల్ఫ్ కూడా.
लॉर्ड कैलेब्रिम्बोर नहीं।	కెలెబ్రింబోర్ ప్రభువు కాదు.
ख़ुद कैलेब्रिम्बोर ने ही सौरॉन का स्वागत किया था।	కెలెబ్రింబోర్‌యే స్వయంగా సౌరోన్‌ను స్వాగతించాడు.
तुम उसे बचा नहीं सकते।	అతనిని రక్షించలేవు.
तुम गैलाड्रिएल को बचा सकते हो।	గాలాడ్రియెల్‌ను రక్షించగలవు.
यह एक सच्चा प्रस्ताव है।	అది మనఃపూర్వక ప్రతిపాదన.
मेरी मानो, इसे स्वीकार कर लो।	అది స్వీకరించాలని నా సలహా.
और सौरॉन को मुझ पर छोड़ दो।	ఇంకా సౌరోన్‌ను నాకు వదిలిపెట్టు.
तुममें अपनी पितामही की सुंदरता झलकती है, वलार की मेलियन की।	వాలార్ యొక్క మెలియన్ అయిన మీ జేజమ్మ అందం నీలో ఉంది.
अगर तुम्हारे रगों में उनके विवेक का अंश भी होगा,	ఆమె జ్ఞానంలో రవ్వంతయినా నీ రక్తంలో ఉండిఉంటే,
तो तुम जानते होगे कि तुम मुझे जंग में हरा नहीं सकते।	యుద్ధంలో నువ్వు నన్ను ఓడించలేవని నీకు తెలుసుండేది.
मैं तुम्हें आसानी से मात दे दूँगा,	నేను నిన్ను అధిగమించుతాను,
मेरी सेना तुम्हारी सेना से बेहतर लड़ेगी और तुम चित हो जाओगे।	నా బలగాలు మీ వాళ్ళను ఓడిస్తారు, నువ్వు పతనమవుతావు.
उससे पहले ग्लान्डुइन की रेत तुम्हारे अपनों के ख़ून से	నువ్వు నీ సంబంధీకుల రక్తంతో గ్లాండ్యూయిన్ నేలను
काली रंग दी जाएगी।	నల్లబార్చకుండా కాదు.
मेरी संतानों ने ऐसी-ऐसी क्रूरता सही है	మీ ధైర్యవంతులు కనీసం
जिनका वर्णन तुम्हारे वीर सुनने तक की हिम्मत नहीं रखने।	గట్టిగా మాట్లాడుకున్నా భరించలేని క్రూరత్వాన్ని మా పిల్లలు భరించారు.
तुम उनकी जान इतनी आसानी से ज़ाया करने के लिए तैयार हो, अदार?	అడార్, వాళ్ళ జీవితాలను అంత సులభంగా వదులుకునేందుకు సిద్ధంగా ఉన్నావా?
क्या वे तैयार हैं?	వాళ్ళు సిద్ధమేనా?
गैलाड्रिएल की ज़िंदगी के बदले में अंगूठी। तुम्हारा क्या फ़ैसला होगा?	గాలాడ్రియెల్ ప్రాణానికి ఒక ఉంగరం. ఏ౦ అ౦టావు?
मुझसे यह रणभूमि में पूछना,	యుద్ధ క్షేత్రంలో,
जब तुम्हारी गर्दन पर तलवार रखी होगी।	నీ మెడపైన కత్తి ఉండగా అడుగు.
बहुत ख़ूब।	మంచిది.
मैं तुमसे वहाँ मिलूँगा...	నిన్ను అక్కడ కలుస్తాను...
एक भाले की नोंक पर उसकी खोपड़ी के साथ।	శూలం మీద ఆమె తలతో.
अगर यही बात है, तो मैं उससे विदा लेना चाहूँगा।	పరిస్థితులు అలా ఉండాలని ఉంటే, నేను ఆమెకు వీడ్కోలు చెబుతాను.
यह निहत्था है।	అతను నిరాయుధుడు.
मुझे माफ़ कर दो।	నన్ను క్షమించు.
विजयी भव।	సాధి౦చు.
वोरोहिल।	వోరోహిల్.
हमारे एक सैनिक पर दुश्मन के दस सैनिक हैं। तो इतना आत्मविश्वास कैसे?	శత్రువులు మనకంటే పది రెట్లు ఎక్కువున్నారు. మరి ఎందుకంత నమ్మకం?
क्योंकि मुझे वह पता है जो ऑर्क्स के पिता नहीं जानते।	ఎందుకంటే ఓర్క్స్ తండ్రికి తెలియనిది ఒకటి నాకు తెలుసు.
और वह क्या है?	అది ఏంటి?
इस पल राजकुमार डुरिन हमारी मदद के लिए बौनों की सेना इकट्ठी कर रहे हैं।	ఇప్పుడు కూడా రాకుమారుడు డ్యూరిన్ మన సహాయానికై మరుగుజ్జుల దళాన్ని పంపుతున్నారు.
और सूरज की पहली किरण के साथ...	తొలి పొద్దు పొడవగానే...
तुम उन्हें सीधे अदार की फ़ौज की ओर ले जाओगे।	నువ్వు వాళ్ళను నేరుగా అడార్ వైపుకు పంపుతావు.
अति उत्तम।	అద్భుతం.
तुम उनके पास जाओ।	వాళ్ళ దగ్గరకెళ్ళు.
तब तक, मैं देखता हूँ कि एरेगियन की दीवारें	ఈలోపు, ఎరెజియోన్ గోడలు ఇంకొక్క రాత్రి
एक और रात टिकी रहें।	నిలిచి ఉండేలా చూస్తాను.
खाज़ाद-डुम के शूरवीरो।	ఖజాద్- దుమ్ యోధులారా.
इस क्षण,	ఈ సమయంలో,
हमारे युग की महान गाथा लिखी जा रही है।	మన యుగపు గొప్ప కథ లిఖించబడుతోంది.
और यह तय करना हमारे हाथों में है कि उसका अंत	దాని ముగింపు మనపై ఆధారపడి ఉంటుంది
एक त्रासदी के साथ होगा...	విషాదమా...
या फिर जीत के साथ।	లేదా విజయమా అనేది.
संगदिल सौरॉन,	సౌరోన్ శిలా హృదయుడు,
जिसने हमारे पूर्वजों से वे सात शिल्पकला के रहस्य चुराए थे, लौट आया है।	మన పూర్వికుల నుండి ఏడు ఆభరణ తయారీ రహస్యాలను దొంగిలించినవాడు, తిరిగి వచ్చాడు.
हमें और पूरी मध्य-धरती को दास बनाने के लिए अँगूठियाँ की रचना करके।	మిడిల్ -ఎర్త్‌ని, మనందరినీ బానిసలుగా చేయగల ఉంగరాలను తయారు చేస్తున్నాడు.
एल्व्स उसे हरा नहीं पाएँगे।	ఎల్వ్స్ అతనిని ఓడించలేరు.
हमारे बिना नहीं।	మనం లేకుండా కాదు.
और सौरॉन यह जानता है।	సౌరోన్‌కు ఇది తెలుసు.
वह सोचता है कि हमारे लालच को बढ़ावा देकर,	అతని ఆలోచన ఏమిటంటే, మనలో దురాశను రెచ్చగొట్టడం ద్వారా,
वह हमारे दिलों से इंसानियत मिटा देगा	మన మనసులను బూడిద చేసి,
और बिना किसी लड़ाई के हमें तबाह कर देगा।	యుద్ధం చేయకుండానే మనల్ని తుడిచేయవచ్చని.
पर हम उसके अंदाज़े से ज़्यादा मज़बूत हैं।	కానీ అతనికి తెలిసిన దానికంటే మనం బలవంతులం.
हाँ!	అవును!
क्योंकि एक चीज़ है जो हर बौने को बेहद अज़ीज़ है,	మరుగుజ్జులు కోరుకునేది,
किसी भी धन-दौलत से ज़्यादा।	సంపదలకు మించినది ఒకటి ఉంది.
हमारे इस चहेते पहाड़ से भी बढ़कर।	మనం అత్యంత ప్రియంగా చూసుకునే ఈ పర్వతాన్ని కూడా మించినది.
मेरे साथ लड़ो, ताकि पूरी दुनिया देख सके	నాతో పోరాడండి, ప్రపంచం అంతా చూసేలా,
कि बौनों की वफ़ादारी	మరుగుజ్జుల విధేయత
किसी भी जादू-टोने से ज़्यादा ताक़तवर है!	అన్ని ఇంద్రజాలాల కంటే కూడా బలవంతమైనదని!
हाँ!	అవును!
किसी भी सेना से ज़्यादा ताक़तवर है!	అన్ని సైన్యాల కంటే శక్తివంతమైనదని!
हाँ!	అవును!
इस धरती से ज़्यादा अडिग है!	భూమి పునాదుల కంటే లోతైనదని!
हाँ!	అవును!
क्या तुम हमारे दोस्तों के साथ मिलकर लड़ोगे?	మన స్నేహితులతో మీరు పోరాడతారా?
हाँ!	అవును!
क्या तुम खाज़ाद-डुम के लिए लड़ोगे?	మీరు ఖజాద్- దుమ్ కోసం పోరాడతారా?
खाज़ाद...	ఖజాద్...
डुम!	దుమ్!
हम एरेगियन की ओर कूच करेंगे!	మనం ఎరెజియోన్‌కు వెళతాము!
शहर की रक्षा करो!	నగరాన్ని రక్షించండి!
दीवार की ओर!	గోడ వైపుకు!
दीवार की ओर!	గోడ వైపుకు!
मैं तेरे टुकड़े-टुकड़े करूँगा, एल्फ़।	నీ పేగులు బయటకు తీస్తా, ఎల్ఫ్.
मर जाओ।	చావు.
नहीं!	వద్దు! వద్దు! వద్దు, అయ్యో! వద్దు!
बहुत हुआ!	ఇక చాలు!
दोबारा! रैवेजर को फिर से तैयार करो!	మళ్ళీ! విధ్వంసక యంత్రం!
चलो!	పదండి!
पितृदेव।	ప్రభు పితా.
दीवार हमारे अंदाज़े से ज़्यादा मज़बूत है।	గోడ మనం అనుకున్నదానికంటే బలంగా ఉంది.
हम इसे कल सुबह से पहले नहीं तोड़ पाएँगे।	మనం దాన్ని ఉదయానికి ముందు పడగొట్టలేమేమో.
एल्फ़ आपकी उम्मीद से बेहतर प्रदर्शन कर रहा है।	ఎల్ఫ్ మీరు అనుకున్న దానికంటే బాగా పోరాడుతున్నాడు.
उसके सैन्य दलों ने हमारे पाँच प्रक्षेपक नष्ट कर दिए।	అతని బలగాలు ఇప్పటికే మనవి ఐదు ముట్టడి యంత్రాలను ధ్వంసం చేశాయి.
कई उरूक शहीद हो रहे हैं।	ఉరుక్ చాలా మంది చనిపోతున్నారు.
आपके क्या आदेश हैं, पितृदेव?	మీ ఆదేశాలు ఏమిటి, ప్రభు పితా?
