Hindi	Telugu	Similarity_Score
त ब तक , कोई जरू री ख र चा हो तो बो न स से काम हो जाएगा .	అ పపటి దా కా బో నస ఏ వె నా అ ర జ ంట ఖ రచ ు లు ంటే ప నికి వ సతుంది .	0.6360
इसलिए बा जार से पै सा उ धा र लेकर मे ड इन हे वे न शुरू किया ,	కాబటటి నేను డబబు అ పపు చేసి మే డ ఇ న హె వెన మొద లె టట ా ను ,	0.6630
- हाँ . - कर न : हे लो , सुनो .	- చెపపు . - హాయ , చూడు .	0.5942
ये स प नों से ब नी है .	ఇ దే క లల ని పు టటి ంచే ది .	0.5874
सर , वो मैं आप की म म मी के बारे में सोच रही थी .	సర , నేను మీ మమ మీ గురించి ఆలోచి సతుననాను .	0.5471
सब बु क हो चु का है . सब तैयार है .	అంతా బు కక యి ంది . అంతా రె డీ .	0.5929
कया . . . न ो ब ल गरे पस कया हो ते हैं ? मतलब , बि ना सक ॉ च के शादी कौन करता है , यार ?	ఏంటి . . . ఈ నో బు ల గరే ప సే ంటి ? స కా చ లే కుండా పె ళళ ి ఎవరు చే స కుంటా రు ?	0.6944
सब अचछा है . हाँ .	అన నీ మంచి వే . ఇంకా .	0.5034
व ॉ य स मे ल : माफ करना . आप का फोन नहीं ले सकती . अपना सं देश छोड द ें .	కషమి ంచండి , ఇపపుడు మాటలాడ లేను . దయచేసి మె సే జ పెటట ండి .	0.5889
कोई मु श कि ल नहीं है .	ఇది పని చే సతుంది .	0.4619
इसका ज वा ब तुमहें देना है .	నువ వి ది పరి ష కరి ంచు కుంటా న ననా వు .	0.4895
एक बार मैंने उन से कहा कि बि ला ल ने मुझे मा रा , और उनहोंने कहा ,	ఒక సారి ఆ యన కి చెపపా ను బి ల ాల ననను కొ టట ా డ ని ఆ యన ననా రు ,	0.6311
आप लोगों को ऐ सी जग हें मिल कहाँ से जा ती हैं ?	మీ కి లా ంటి మంచి ప లే స లు ఎలా దొ రు కు తుననా యి ?	0.6059
इ ंड िया , भ ले ही आपके परिवार कि तने भी अ जी ब कयों ना हों ,	ఇది ఇ ండి యా మీ కుటుం బ ాలు ఎంత వి చి తర మెన వె నా . . .	0.6339
इसे जलदी से खतम की जिए .	ఇ వి చాలా త వర గా అయి పో వాలి .	0.4679
पर कम से कम , परिवार में किसी ने उनकी चु ग ली नहीं की , है ना ?	కానీ క నీ సం కుటుం బ ంలో ఎవర ూ ఆమె గురించి చె డ డ గా చెపపు కో లేదు , సరేనా ?	0.6219
थोडा आगे जाने पर एक और परा र थ ना स भा हो रही है .	వి న ండి . . . అ కక డా ప కక న ఇం కో పరే య ర మీ టి ంగ జరుగు తోంది .	0.6124
- माँ , माँ ! - तो कया का ट ने से होगा ?	ననను నేను కో సు కు ంటే అవు తు ందా ?	0.5439
यह दु ल ह न हैं . उस दिन तो इ नहीं की पसंद देख ी जाए गी .	తను పె ళళ ి కూ తు రు , అది తన కి ఇష ట మెన రోజు కావాలి జీవి త ౦ లో .	0.6335
मि सट र ख न ना के द फ तर ने ति मा ही का हि सा ब माँ गा है .	మి సట ర ఖ ననా గా రి ఆ ఫీ సు వాళళు క వా ర టర లీ ఎ క ౌ ంట స అ డు గు తుననా రు .	0.6518
ज हाँ ध ू म धा म और दिखा वा कोई मा य ने नहीं रख ता , और बस पयार की ही जरूरत होती है .	ఎపపుడూ ఆ డం బ రం ఇంకా డా బు ప నికి రా వు . మీకు కా వల సింది పరే మ ఒకక ట ే .	0.6643
अ ग ले साल वही प ला न है .	వచ చే ఏ డా ది నా ప లా న అదే .	0.5864
पलीज , कर न . मैं नहीं जा सकती .	ప లీ జ , క రణ . నేను రాల ే ను .	0.6029
देख िए , अगर बच चे उनके साथ हों गे , तो बा की सब भी हों गे .	చూడ ండి , పిలల లు త నని స పో ర ట చే సతే , అంద రూ చేసతా రు .	0.6851
तुमहारे अ ती त का सब ूत . और . . .	మీ గ తా నికి గ రం థ ం లా . ఇంకా . . .	0.6506
हर व कत एक बे च ै नी सी रह ती है , समझ रही हैं आप ?	ఎపపుడూ ఆ తరు త గా ఉంటుంది , మీకు తెలుసా .	0.5225
पलीज किसी से मत कह ना .	దయచేసి ఎవ రికీ చెపప కు .	0.4985
तुम बच चे के लिए कोशिश कर रहे हो ?	మీరు బి డ దని క నా లను కుంటుననా రా ?	0.5639
अगर ये सब ट ू ट कर हमारे सिर पर ना ग िर पडे .	ఈ మొ తత ం మన మీద కు పప కూ లి తే తపప చెపప లే ౦ .	0.6210
वह पि ं क ट ॉ प वाली , उ ध र . वह मेरी है .	ఆ పి ంక టా ప వే స కు నన ది నా కూ తు రు .	0.6642
उनहें लगता है त ला क से अचछा है मैं तक ली फ में र हूँ ?	బా ధ భ రి ంచ మ నే వారు . వి డా కు లు తీ స కో వడం క ననా ,	0.6586
हाँ , तुमहारी शादी की तै या री में थोडा उ ल झ ा हुआ था .	అవును కానీ . నీ పె ళళ ి ని ప లా న చే సత ూ కొ ద ది గా బి జీ గా ఉననా ను .	0.5642
मतलब , पि छ ले साल तुमहें बो न स नहीं दिया , तो . . .	అంటే నీకు గ త ఏ డా ది బో నస ఇవ వ లేదు కాబటటి . . .	0.6746
तुमहें लगता है ये झ ू ठ बोल ने की व ज ह से है , फै जा ?	దీ నికి అబ దధ ం చెపప డ ంతో సం బం ధ ం ఉంది అనుకుంటుననా వా , ఫ ె జా ?	0.6393
ये श हर सा ला बहुत मह ं गा है और मेरी जि म मे दा रि या ँ हैं . मुझे बस . . .	ఈ న గ రం చాలా ఖ రచ ు ల తో కూ డి న ది నాకు బా ధ యత లు ననా యి . నేను అలా . . .	0.7370
मुझे नहीं पता . मुझे नहीं पता मैं कया कर रहा हूँ .	నాకు తె లీ దు . నాకు తె లీ దు ఏం చేసతుననా నో .	0.5453
हाँ , पर उनहोंने कहा कि मि सट र ख न ना माँ ग रहे हैं .	అవును , కానీ వాళలు అ ౦ టు ననా రు మి సట ర ఖ ననా గా రు అ డు గు తుననా ర ట .	0.5986
फिर से चला ना .	మ ళళ ీ ప లే చె య యి .	0.4409
नहीं . पर वे आ एँ तो अचछा ल गे गा .	కాదు . . . కానీ వాళళు వ సతే బాగు ౦ టు ంది .	0.5785
और फिर हमा रा जो भी मु ना फा हुआ , इस आ ली शान द फ तर को बना ने में लग गया .	ఆ తర వాత మనం ఏం సం పా ది ంచా మో అద ంతా ఈ ఆ ఫీ సు మీద ఖ రచ యి పోయింది .	0.6634
मैंने किसी भी लड की के साथ उसे ऐसे कभी नहीं देखा है .	నేను ఏ అమమా యి తో టీ ఆ యన ఇలా ఉండ ట ౦ ఎపపుడూ చూడ లేదు .	0.6238
बता ने ला य क कुछ है ही नहीं .	చెపప ాల సింది ఏమీ లేదు .	0.4868
" माँ खुश हैं . उनके साथ काम कर रही हूँ . " अपने ख या लों पर मेरा पू रा ध यान है .	అమమ ఆ న ంద ంగా ఉంది . తన తో పని చేసతుననా . నా ఆలో చ న ల పె ద ృ ష టి పె డు తుననాను .	0.6892
पर कल से मैं बच ने की कोशिश कर रही हूँ .	కానీ ని నన టి ను ంచి పర మా ద చి కి త స తీసు కుంటుననా ను .	0.5442
- कर न के पिता : अरे . . . - बो लो .	- కానీ ఇది మా ది . - చెపపు .	0.5846
देखो , मेरी त न ख वाह बढ ा ओ .	చూడ ండి , నాకు జీ తం పె ంచాలి .	0.5398
के टर र : बिलकुल . ये हमारी एक खा सि य त है .	తపప కుండా . అది మా పర త యే క త లలో ఒకటి .	0.6278
मैं कॉ ले ज में उसके साथ था . ये सब . . .	. . . తన తో కాల ే జి లో చ ది వా ను . ఇది . . .	0.7139
और मुझे लगा बं गा ली र स में नि भा नी ही चाहिए .	మా బె ంగ ాల ీ సం పర దా యం పా టి ంచ ాలను కుననాను .	0.6109
और खुद से भी बे ई मा नी कर रही हो .	నీ తో నువ వే సరి గ గా ఉండ ట లేదు .	0.6031
ड रा मा नहीं है ये .	ఇది నా ట కం కాదు .	0.5571
ये जान ना हमा रा काम नहीं है .	అది మాకు సం బ ంది ంచిన విష య ౦ కాదు .	0.4949
इससे बे च ै नी होगी ही .	అది ఆ త ృ త ని కలు గ చే సతుంది .	0.5160
माफ करना . मैं अभी आया . हाँ ? बस . . .	కషమి ంచండి , ఇ పపుడ ే వ సతాను . కొ ద ది సే ప ట లో .	0.5751
मतलब , ऐसा है तो इसका ख र च कैसे झ े ल सकते हैं ?	అంటే . . . దీ నికి మన కు డబబు ఎలా వ సతుంది ?	0.6072
देखो , ये सब बहुत अ जी ब है , यार . मैं . . .	చూడు , ఇది అద ో ర క ంగా అనిపి సతోంది . నేను . . .	0.6838
मुझे माफ कर दो , ब ब ल स . मुझे अं दा जा भी नहीं था कि उसकी तुमहारे साथ म ंग नी हुई है .	నిజంగా కషమి ంచు బ బు ల స . నాకు తె లీ దు అతనికి నీ తో ని శ చి తా రథ ం అయి ందని .	0.6608
और अब बस सभी का पै सा ब या ज स मे त लौ टा रहा हूँ ,	ఇ పు డు కే వల ం అంద రికీ వ డ డీ తో పా టు తిరిగి ఇ సతుననాను ,	0.6193
और तुमहारे " ऐ ति हा सि क " वि चार के बारे में , तुमहारे म ं गे तर का कया कह ना है ?	మరి నీకు కా బో యే వాడు నీ చా రి త రాత మ క ఐ డి యా గురించి ఏ మ ను కుంటుననా డు .	0.6340
म म मी को पह न ने हों , तो भी नहीं ?	అమమ వే సు కుంటా న ంటే అ పపుడు కూడా నా ?	0.5590
मुझे अ परा ध बो ध नहीं होना चाहिए , है ना ?	నేను త పపు గా ఫీ ల అవ కూడ దు , కదా ?	0.6133
हमारे लिए , वह अपने काम में वि श वास करने का ए ह सा स है .	మాకు అది మా ఉద యో గ ాలని న మ మే ఒక అ రు ద ె న ఫీ లి ంగ .	0.6564
तुमने फोन करने को कहा था .	నువ వే కాల చె యయ మ ననా వు కదా .	0.5322
अस ली दु निया ? तो फिर ये कया है ?	అస లె న లో క మా ? అయితే ఇ దే ంటి మరి ?	0.5723
तुमहें हुआ कया है , यार ?	నీకు ఏ మ యి ంది గు రూ ?	0.5214
मेरे पिता मुझे ऐसे देख ते हैं जैसे . . . मैं ना काम रह गई .	మీకు తెలుసా , మా నానన ననను ఓ డి పోయి న టటు గా చూ సతా రు .	0.6238
सक ूल से अगर किसी को फा य दा हुआ है , तो त ु झ े .	స కూ లు వ లల ఎవ రి కె నా లా భ ం కలి గి ంద ంటే . . . అది నీ కే .	0.6325
मुझे लगा तुमहें मि ंट पसंद नहीं है .	నీకు మి ంట ఇష టం లే ద ను కుననాను .	0.5414
कया बात है , शि बा नी ? थोडा वय सत हूँ . . .	ఏంటి , షి బా నీ ? నాకు చాలా ప ను ంది ఈ . . .	0.6383
" तुमने कया किया ? "	నువ వే ం చే సా వు ?	0.4989
उससे अचछा च ू हे मार ने की द वा पी जा ऊँ .	దాని క ననా ఎ ల కల మ ందు తా గు తాను .	0.5934
इन दि यों पर न जर रख ना .	ఈ ల యా ం ప స మీద ఓ క న నే సి ఉ ంచు .	0.5307
ठ ं डी हो जाए गी .	చ ల లా రి పో తుంది .	0.4625
बहुत कुछ बना ना पडे गा उस शादी में .	పె ళళ ి లో చాలా ప ను లు చేయ ాల సి ఉంది .	0.5719
अचछा , अब जाओ . जलदी करो .	సరే , ఇక వెళళ ు త వర గా .	0.5422
ध यान रहे , थी म हा थी दा ंत है , वर ना बे कार हो जाएगा . ठीक है ?	ద ృ ష టి లో పె టటు కో థ ీ మ ఐ వర ీ ఉంది . లే ద ంటే అది వే సట యి పో తుంది . సరేనా ?	0.6144
कया ख ू बस ू रत जगह है , यार .	ఎంత అంద మెన చ ో టో కదా ఇది .	0.5830
वि श वास हो रहा है मैं शादी कर रही हूँ ?	నువవు న మమ గల వా ? నాకు పె ళ లి అవు తుంది అంతే .	0.5841
अपने पिता के पि छ डे हुए न ज रि ये को तुम दिल से नहीं लगा सकती .	మీ నానన గా రి చినన చూ పు ని నని లా బా ధి ంచే లా చే స కో కూడ దు .	0.6456
" मैं इस इं सान को स दि यों से जान ता हूँ . "	. . . నా కీ మని షి ఎ నన ో యు గ ాలు గా తెలుసు అని .	0.6234
आ सान नहीं है , हाँ .	అద ంత సి ం పు ల కాదు .	0.4917
और स िया को भी पसंद है .	సి యా కి కూడా ఇష టం .	0.4817
तुम मेरी आ जा दी हो .	నువవు నా స వే చ ఛ వి .	0.5151
नहीं . पीछे कौन ह ट रहा है ?	లేదు . ఎవరు వెన క కి త గ గు తుననా రు ?	0.5565
कया आप पह ली बार किसी कर िया कर म में बि न बु ला ए आई हैं ?	మీకు తెలియ ని వారి అంత య కరి య లకు రా వడం ఇ దే మొద టి సా రా ?	0.6092
मै ड म , हम बाहर वाले हैं , और हमें ये बहुत ही पया री बात लग ती है .	మే డ మ , మేము బయ టి వాళల ం , మా కి ది చాలా చ కక గా అనిపి సతోంది .	0.6457
चे ह रा और ज वा नी , बस यही दो चीज ें हैं तुम लोगों के पास .	ముఖ ం ఇంకా య వ వ నం , ఇ వి రె ండ ే ఉననా యి మీ దగగర .	0.6536
उसके बाद ना उनहोंने ही रे भी लिए अपनी भा ं जी के लिए .	ఆ తర వాత వారు తన అ కక కూ తు రు కి డె మ ండ స కొ ననా రు .	0.6197
नहीं .	లేదు .	0.3291
आ दिल . . .	ఆ ది ల . . .	0.6974
मै ड म .	మే డ మ .	0.6181
आ ं टी .	ఆ ంట ీ .	0.4434
गो वि ंद !	గో వి ంద .	0.3437
इट ली की टी म कुछ ग रा ह को ं से मिल रही है .	ఆ ఇ ట ాలి యన టీ ం కొ ంత మంది కొ ను గో లు దా రు లని కలు సతోంది .	0.6004
लगा एँ गी नहीं . पक ड ो .	" రా సు కో ను . " ఇది గో తీ స కో .	0.5480
परिवार में आप का सवा ग त है .	కుటుం బ ంలో కి స వా గ తం .	0.5538
न मस ते .	న మ సతే .	0.5688
नहीं .	లేదు .	0.3291
- आओ . - आओ .	- రా . - రా .	0.4743
अब मा थ ु र शादी की बात करते हैं . के टर र का कया हुआ ?	మా థ ు ర పె ళళ ి య ొ కక కే టర ర స సం గ తి ఏ మ య యి ంది ?	0.6712
कं प नी को सच में तुमहारी जरूरत है , शि बा नी . तुमहें ये पता है .	కం పె నీ కి నువవు చాలా ముఖ యం షి బా నీ . అది నీకు తెలుసు .	0.6154
हमने बस एक - दूस रे को देखा और हम एक - दूस रे के हो गए .	మేము ఒక రి న ొ క రం చూ సు కుననా ం అంతే ఒక రి కోసం ఒక రం ఉననా ం అనిపి ంచి ంది .	0.5599
कह रही हैं कि तुमहें मेरा अचछ े से ख या ल रख ना होगा .	నువవు ననను చాలా బాగా చూ స కో వాల ని చెబు తోంది .	0.5818
- मेरे लिए ? - नहीं , डै ड के लिए .	- నా కో సమా ? - నీ కోసం కాదు , నానన కోసం .	0.5791
तुम बच चे के बारे में सोच रही हो ?	మీరు బి డ డ కోసం పర యత ని సతుననా రా ?	0.5904
हाँ . तुमहारे घर वाले ब डे खुश हों गे ना !	నాకు తెలుసు . మీ కుటుం బం ఆ చ ర య పోయి ఉంటా రు కదా .	0.5794
होना भी चाहिए . इस की पह ली शादी जो है .	అది ఉండ ాలి . ఇది తన మొద టి పె ళళ ి .	0.4918
और मैं दु ल ह न हूँ . और इस के साम ने बह स नहीं करेंगे .	నేను పె ళళ ి కూ తు రు ని . మనం తన ముందు వా ది ంచుకో వదదు ?	0.5740
- ओ ह . - आपको पसंद ना हो , तो हम इसे बद ल सकते हैं .	- అలా ఏం లే ద ండ ీ . . . - సరే మీకు న చచ కపో తే దీ నని మా రు సతా ం .	0.6589
म म मी , देखो , कि तनी सु ंदर ड रे स है .	అమమ చూడు ఎంత అంద మెన డ రె స సో కదా .	0.6098
जज बा ती करने की कोशिश कहाँ कर रहे हैं , मै ड म ?	సె ంటి మె ంట ల బ లా క మె యి ల చేయ డం లేదు మే డం .	0.6057
हम सिर फ श ै ं पे न और फा इ व न ो ब ल गरे पस रख ेंगे , बस .	మనం కే వల ం ష ా ం పే న ఇంకా 5 నో బు ల గరే ప స సర వ చేసతుననా ం , అంతే .	0.6765
स जा व ट , ड री मस कर ा फ ट ना ?	అ ల ంక రణ . . . డ రీ మ స క రా ఫ ట కదా ?	0.6156
तो मुझे जज बा ती करने की कोशिश कयों कर रहे हो ?	మరి ఈ సె ంటి మె ంట ల బ లా క మె యి ల ఏంటి ?	0.5294
नहीं , हम इस सब में नहीं पड ेंगे . पलीज .	వదదు మనం ఇ ందు లో కల పి ంచుకో వదదు . ప లీ జ	0.5510
और त ू ? बच चे नहीं चाहिए ?	మరి నువవు ? నీకు పిలల లు వ ద దా ?	0.5398
मेरे बच च ों को शादी में ले आओ .	నా పిలల లు వచ చే లా చూడ ండి .	0.5796
और अगर आप मुझसे मिल ना चा हें , तो शा म के लग भ ग 5 : 00 ब जे तक य हीं हूँ .	మీరు ననను కల వాల ను కు ంటే నే ని కకడ 5 గ ంట ల దా కా ఉంటా ను .	0.6349
और मेरी माँ जि ं दा है .	ఇంకా మా అమమ బ తి కే ఉంది .	0.5161
लड कि यों से बात कर . कुछ सि खा .	అమమా యి ల తో మాటలాడు , ఏద ెనా నే ర పి ంచు .	0.5438
मुझे पता है तुम कया करने की कोशिश कर रहे हो .	మీ రే ం చే ద దా మ ను కుంటుననా రో నాకు తెలుసు .	0.5847
और उसका दिल भी बहुत ब डा है .	ఇంకా తన మన సు పెదద ది .	0.5507
देखो , बस इस साल के अ ंत तक का व कत दो और मैं वा दा करता हूँ . . .	చూడ ండి , మాకు ఈ ఏ డా ది చి వ రి దా కా సమయం ఇవ వు నేను పరా మి స చేసతుననా ను .	0.6326
मुझे पता है मेरी " म म मी " कै सा मह सू स करती हैं .	నాకు తెలుసు మా అమమ ఎలా ఫీ ల వు తు ందో .	0.5678
