Hindi	Telugu	Similarity_Score
जी तने के लिए किसी को तो ड ने की जरूरत नहीं .	నేను గె ల వ డానికి ద ె బబ తీ య కక ర లేదు , బ ంగా రం .	0.5833
- धत ते री . - ए . रुको .	- అబ బా ఛ . - హే . ఆ గా గు .	0.7118
यह बो झ लेकर चल ना उ तना आ सान नहीं होगा .	వాళళు అలా ంటి భా రా నని మో య టం సు లు వు కాదు .	0.5543
" साल ों पहले ल डी ज ंग ों से ख जाने ब टो र ने	" ఏ ళళ కరి తం యు దధ ాల భ విష యత ని ధ ు లు పొ ంద ాలి	0.6501
यह तो सबसे ह ट कर है ,	అంటే , అది పరా కా ష ఠ .	0.5590
हाँ , हे दर के यहाँ .	అవును , హే థ ర దగగర కు .	0.4954
अचछा , चलो करते हैं .	సరే , పద ండి చే దదాం .	0.5293
साल ों तक , मुझे लगा कोई अ ंत रि कष या तरी	ఎ నన ో ఏ ళళు , చ ండ రు డి లో ఎవర ో వ యో మ గా మి	0.6290
उनहें नहीं पता था . कि सम त ख रा ब निक ली .	వాళళ కు తెలియదు . అది దు ర ద ృ ష టం అంతే .	0.6374
नहीं पूछ ा कि ला मा का ट ते हैं कि नहीं .	లా మ ాలు కొ ర కు తా యా అని కూడా అ డ గ లేదు .	0.5861
तुमहें भ ू ख ल गी है ?	నీకు ఆ కలి గా ఉ ందా ?	0.5802
जैसा मैंने पि छ ले साल शे रि फ को बताया ,	నేను గ త ఏ డా ది ష ె రీ ఫ కు చెపపి న టటు గా ,	0.6264
तुमहारा फोन . देख ूँ ज रा अगर मुझे . . .	నీ ఫోన . ననను చూడ నీ ఒక వే ళ నాకు . . .	0.6763
बी मा कं प नी ने दि वा लिया प न का आ वे द न दे ने को कहा और . . .	బీ మా సం సథ ది వ ాలా తీ సిన టటు ఫ ె ల చేయ మని ంది , ఇంకా . . .	0.6730
र च ना त म क पर य वे कष क र वी न दर श ं कर शु कल	కరి యే టి వ సూ పర వె జర : రా జ ే శ వర రా వు వల వల	0.6515
चार ों में से एक को पक ड ना है , बा की खुद मिल जाएँ गे .	ఆ న లు గు రు పిలల లలో ఒక రి ని ప టటు కు ంటే అంద రూ దొ రు కు తా రు .	0.6470
देख ना पडे गा . बे स पर जो होगा , वह कि तना ह सी न होगा ?	బా స వా యి ంచే వాడు ఎంత ఆ కర ష ణ ీ య ంగా ఉంటా డు ? అ నన దాని బటటి .	0.6229
चलो भी , वे रा इ जन .	సి గ న ల రా , వె రె జ న .	0.5375
पुलिस की नौ करी में का ग जी कार य वा ही जयादा होती है .	పోలీ సు ల పని అంటే ఎకకువ గా ప తర ాల ప నని నీకు చెపపు ండ రు .	0.5833
कोई अनु वाद करे गा ?	అను వాద ం చేసతా వా ?	0.4734
नहीं . हम तो बस बी च के हैं . ए ज ें ट ही सं पर क करता है ,	కాదు . మనం చేసతా మ ంత ే . బ యా గ మ యా న మన ను సం పర ది సతా డు ,	0.6967
ज ंग ल से घर अचछ े से न जर आ ना चाहिए ,	చె ట ల నుండి ఇ ల లు బాగా కనిపి ంచాలి ,	0.5792
उनहें क सर त की जरूरत होती है . तुमहें सि खा ना पडे गा .	వాటి కి చాలా సా ధన కావాలి . నేను నీకు నే ర పి సతాను .	0.5665
त भी झ ट का दे कर गा डी ने उसे कि ना रे पर ले जा कर प ट का .	వర ద లో కొ టటు కొ చచి న కా రు తన ను ఒ డ డు కు న ొ కక ే సింది .	0.6845
तुमहारी पक की दोसत है न ? उसकी मदद नहीं कर नी चाहिए ?	తను నీ పరా ణ స నే హి తు ర ాలు కా దా ? తన కు సా యం చేయ వా ?	0.5856
रात 1 0 : 00 ब जे .	రాతరి 1 0 గ ంట లకు .	0.5650
कि तना बे व कू फ है .	ఎంత పి చచి వె ధ వ .	0.5748
पता नहीं था कि यहाँ कोई घर है .	ఇకకడ వె ను క ఒక ఇ ల లు ఉ ందని తె లీ దు .	0.5474
मेरा माल सही है .	నా డ రగ స మంచి వి .	0.4711
यो ज ना याद रख ना .	ప లా న గుర తు ంచుకో .	0.5165
- घर म कई के खे त ों के द कष ि ण में पड ता है . - पक का द कष ि ण को जा रही हो ?	- ఇ ల లు కం కి చే ను కు ద కష ి ణ ా న ఉంది . - నువవు వెళ ు తు నన ది ద కష ి ణ మే నా ?	0.7257
मान ना पडे गा , पै निक जी तने के लिए लोगों ने कई अ जी ब हर कत ें की हैं ,	పా ని క గె ల వ డానికి జ నం చాలా వి చి తర మెన ప ను లు చేసతా రని చెపప ాలి ,	0.6380
वि लि य मस , तुम च र च जाओ और रे वर ें ड रे ड से बात करो .	వి లి య మ స , చ రచ కు వెళళ ి , రె వర ె ండ రె డ తో మాటలాడు .	0.7055
हमें पता है कि दो जज खेल की तै या री करते हैं .	జ త నయా య ని రణ ే తల చే త ఆ టలు ని ర వ హి ంచ బ డ తా య ని తెలుసు .	0.5588
कयोंकि हर जगह जा ल बि छे हुए हैं .	ఎందుకంటే అంత టా ఉ చచు లు ఉననా యి .	0.5512
यह कया ? छोड ो ! सा ला ! छोड ो . सा ला !	ఏంటి ది ? వ ద ల ండి ! ఛ ! వ ద ల ండి . ఛ !	0.5345
- हैलो . - लड कि यो .	- హాయ . - మ హి ళ లు .	0.6475
सच में ? कई ह फ त ों बाद हमें पह ला सु रा ग मि ला है ,	నిజంగా నా ? ఎ నన ో వా రాల కు మొద టి సూ చ న అ ంది ంది ,	0.6624
तो सै रा मिल र से कया पता चला ?	సా రా మి లల ర నుండి ఏం తెలి సింది ?	0.5196
मैंने कुछ - एक बार ही देखा था .	నేను కొనని సా రలు మా తర మే చూశా ను .	0.5507
वह कुछ अ जी ब सी पे श आ रही थी .	తను సా ధా రణ ంగా వయ వ హ రి ంచడం లేదు .	0.5937
स पर ल ॉ क का खे त .	ఇది స పర లా క ఫ ా మ .	0.6288
सा रे रा सत ों का पता होना चाहिए .	అ నని పర వే శ ాలను పరి శ ీ లి ంచాలి .	0.4940
तुमहें इस बात की जल न है कि मैं क मा ता हूँ !	నేను బాగా సం పా ది సతుననా నని , నీకు ఈ ర ష య గా ఉంది !	0.5886
कया पता ? शायद बद ले में तुम कुछ देना चा हो .	ఎవ రికి తెలుసు ? నువవు నా రు ణం తీ రచ ు కుంటా వే మో .	0.5947
जब मुझे उनकी जरूरत नहीं थी .	నాకు తో డు కా వాల ను కో న పపటి మాట .	0.5072
मैं उन 5 0 अं को ं से ना राज हूँ .	నాకు ఆ 5 0 పా యి ంట ల మీద కో పం .	0.6522
मेरे पास और कोई चा रा नहीं है .	నాకు మ రో మా రగ ం ఉనన టటు లేదు .	0.5793
तो , हमें घर के अंदर घ ु स ना है ?	అయితే , ఇంటి లో ప లకు వెళళ ాలా ?	0.6086
इस दु निया में कुछ बद ल ना है तो सही कि सम के दोसत जरू री हैं .	ఈ పర ప ంచ ంలో ఏద ెనా మా రచ ాల ంటే , మన కు స రె న మి తరు లు ఉండ ాలి .	0.6567
साम ने के दर वा जे पर न जर रख ूँगी . तुमने न क शे की त स वी र ें ली ं ?	నేను ముందు త లు పు చూ సతు ంటా ను . మ యా ప ఫో టో లు తీసు కుననా వా ?	0.6312
अगर स पर ल ॉ क ने पै सा कहीं छ ु पा कर र खा है . . .	స పర లా క నిజంగా డబబు ప ూ డ చి పె టటి ఉ ంటే . . .	0.7048
हाँ . चा ली स घ ं टे और ह थ क डि यों से ऐसा हो जा ता है , सा ले .	అవును . నువవు న ల భ ె గ ంట లు సం కె ళళ తో ఉ ంటే జ రి గే ది అదే , వె ధ వ .	0.6951
वह ऊ पर ी और नि चला मै दा न है .	అది పె న పొ ల ం ఇంకా కి ంద పొ ల ం .	0.5724
तो , कयों लिया ?	బ ది లీ ఎందుకు ?	0.4929
जो लड को ं ने निका ली ं जि न हें लगा कि उन से पयार था . अ के ली लड कि यों की ,	వాళళ ను పరే మి ంచా ర ను కు నన అబ బా యి లు లీ క చేసిన ఫో టో లు . . . ఒ ంట రి అమమా యి ల వి ,	0.6608
जैसा ऐ बी क ला र क के साथ हुआ .	ఆ బీ క లా ర క విషయం లో జరిగి న టట ే .	0.5894
पहले सा रे रे च क और बच च ों का पा उ डर और र ंग ों वाले कार ड .	వి రే చ న కా రి మ ందు లు , పిలల ల ప ౌ డ రు , పె యి ంట చి ప స కంటే మంచి వే .	0.6445
हमा रा घर 1 00 ग ज की दू री पर एक ढ े र बना हुआ पा या गया ,	మా ఇ ల లు దా దా పు 1 0 0 గ జ ాలు పు నా దు ల నుండి కు పప కూ లి పోయింది ,	0.6369
उनहें लगता है इन गर मि यों में , मैं घ ं टे पू रे कर रहा हूँ .	నేను ఈ వే స వి లో సే వా సమయం గ డు పు తుననా నని అను కు ంటుంది .	0.6294
अभी भी बात नहीं करना चाहती .	నా తో మ ౌ న పో రా టం చే సతుంది .	0.4494
कुछ चि ट ठ िया ँ , ध म किया ँ मि ली ,	బె ది రి ం పు ఉ తత ర ాలు వచ చే వి ,	0.5968
अगर हमें मिल कर खेल ना है , तो हमें यो ज ना तो बना नी पडे गी .	నువవు భా గ స వా మి వి అయితే , మనం ఒక పర ణ ా ళ ి క వే సు కో వాలి .	0.6468
इसलिए पू रा द म लगा कर खे लो .	అందు కని శ కతి మే ర క ృ షి చేయ ండి .	0.5731
आ धा खेल तो उन से बच ना है .	స గం ఆట వాళళ ను ని వారి ంచ డ మే .	0.6208
त स वी र ें थी ं .	అవ న నీ ఫో టో లే .	0.5034
सा त , छ ह . . .	ఏ డు , ఆ రు . . .	0.7056
पा इ प च ू रहा है और रि सा व से पा गल हुई जा रही हूँ .	పె పు లీ క అవు తుంది , కా రు తు నన నీ ళళు పి చ చె క కి సతుననా యి .	0.6230
- मुझे यह सब स जा कर रख ना है ? - हाँ , मै ड म .	- ఇవ న నీ సరి గా పెటట ాలా ? - అవును , మే డం .	0.6906
अगर हम अ लग हो कर खो ज ें तो जलदी होगा .	మనం వి డి పోయి వె తి కి తే త వర గా కను గొ న గల ం .	0.5168
पुलिस ने हमें पक ड लिया , इसलिए ऐसा था .	మన లని రె ండ ో స వ ాలు లో అ రె సట చేశా రని .	0.5766
चलो , समय निक ला जा रहा है . चलो . आओ .	ర ండి . సమయం మి ంచి పో తోంది . పద ండి . ర ండి .	0.5211
जि मी उस पर द बा व डा ल रहा था , बो ला कि उसे अ फ सो स नहीं होगा .	అ ందుకు తను ప శ చా త తా పం చె ంద దని చెపపి , జి మ మీ తన ను ఒ త తి డి చేశా డు .	0.6369
अ व ै ध तरी के से घ ु स ना . हर साल होता है .	చ ొ ర బా టు . అది పరతి ఏ డు జరుగు తుంది .	0.6569
भा ड में जाओ .	వెళళ ు చా వు .	0.4746
दिन भर तुमहारा मि जा ज एक द म बि ग डा था .	నువవు రో జ ంతా పి చచి మూ డ లో ఉంటా వు .	0.5474
पि छ ले ह फ ते एक लड के को स जा सुना ई .	గ త వా రం ఒక అబ బా యి కి శి కష వి ధి ంచా ను .	0.6428
- तुमहें कुछ चु रा ना है . - शुकरिया .	- మీరు ఏదో దొ ం గి లి ంచాలి . - ధనయవాదాలు .	0.6020
जब मैंने ऐ बी से पूछ ा , तो उसने कहा कि वह खेल में भा ग ले गी .	నేను తన ను ని ల దీ సిన పపుడు , అబ ీ ఆట ఆ డ ను నన టటు ఒ పపు కు ంది .	0.6598
- ए ज ें ट ? - पैसे की सु र कष ा करने वाला .	- బ యా గ మ యా న ? - డబబు ఉ ంచు కు నే వాడు .	0.7092
- छो टी - छो टी ग ें द ें . . . - पि ंग प ॉ न ग .	- ఆ చినన బం తు లు . . . - పి ంగ పా ంగ .	0.6585
- हैलो ! - हैलो ! मैं अंदर आ सकती हूँ ?	- హాయ ! - హే ! నేను లో ప లి కి రా వచచా ?	0.6363
अचछा , चलो . समय बर बाद हो रहा है .	సరే , రా . మనం సమయం వ ృ థా చేసతుననా ము .	0.5908
नहीं , रुको , रु क जाओ .	వదదు , ఆ గా గు , ఆ గు , ఆ గు .	0.5580
जो भी हो . बस जान ना है कि किस ने उसे मा रा .	నాకు అన వ సరం . నాకు తన ను ఎవరు చం పా రో తెలియ ాలి .	0.5936
दूस रे साल न ै शन ल रो डि यो के फा इन ल में पहु ँच चु के हो ,	నువవు రె ండ ో ఏ డు నే షన ల రో డి యో ఫ ె న ల స కు వచచా వ ని తెలి సింది ,	0.6826
अब तुम स टी व ज ॉ बस हो ?	సట ీ వ జా బ స వి అయి పోయా వా ?	0.5109
" और त स वी र ों के रू प में रात तक त स वी र ें भे ज ना "	" సా కష య ంగా అ ర ధ రాతరి కల లా నా కో ఫో టో పం ప ండి "	0.6748
अचछी कोशिश है , स पर ल ॉ क .	మంచి పర యత నం , స పర లా క .	0.6269
यह सही है ?	ఇది స రె న దా ?	0.4323
सट े शन पर , हमने पैसे इ क ट ठा कि ए . हमने 1 00 टि क ट ें ख री दी ं ,	సట ే షన లో , మేము అంద రం జ త కలి శా ం . 1 0 0 టి కె టలు కొ ననా ం ,	0.7276
कम रे में हर कोई चु प चा प बैठ ा था . अपनी सा ँ स ें रो के .	ఆ గ ది లో అంద రూ ని శ శ బ ద ంగా ఉననా రు . వాళళు ఊ పి రి బి గ బ టట ా రు .	0.6825
कि सी नि यर लोगों ने चु नौ ती त य कर रख ी थी .	సీ ని య రలు స వ ాలు రూ పొ ంది ంచా రని తెలుసు కుననా రు .	0.5934
मुझे अपने माँ - बा प के सो ने तक रु क ना प डा .	అమమా నా ననా పడు కు నే దా కా వే చి ఉండ ాల సి వచచి ంది .	0.6009
- यह कोई मजा क नहीं . - घ ब रा ओ मत .	- అది సర దా విషయం కాదు . - శా ం తి ంచు .	0.5818
तुम जो चा हो मुझे बता सकते हो .	నా తో ఏద ెనా చెపప ాలను ంటే చెపప వచచు .	0.4846
उसने क सम खा ई कि कभी नहीं खे ले गी .	తను ఎపపుడూ ఆ డ నని మాట ఇ చచి ంది .	0.5910
बा रह म ही ने की कै द , और उसके बाद और 1 2 म ही ने पै रो ल पर .	ప నన ె ండు నె లల ఖ ె దు , మ రో ప నన ె ండు నె ల లు పె రో ల మీద .	0.6857
परे ड वाले बै ंड में एक सं गी त वाली गा डी है . शायद उस ी से पता च ले .	క వా తు బ ృ ంద ం సం గ ీ తం మా రు త ూ ఉంది . బహు శా అది తా ళ ం అను కుంటా .	0.6969
याद है , उनहोंने कहा कि चा ँ द वाला आदमी	ఒక అబ బా యి త డి సి మె ంటు లో పడి పో తే అతని ముఖ ం	0.5318
जयादा समय नहीं ल गे गा . बस एक फि ल म देख ूँगा .	ఎ ంతో సే పు ఉండ ను . సి ని మా చూ సతా ము అంతే .	0.6007
मुझे दु ग नी प गा र मिल ती , द स गु ना भ ि ड ने को मिल ता .	వాళళు నాకు ప ది ంత ల ప నికి రె టటి ం పు జీ తం చె ల లి ంచే వారు .	0.6596
कौन सी ऊँ ग ली दिखा ऊँ ?	ఏ వే లు ఉ ప యో గి ంచ ను ?	0.5968
" स पर ल ॉ क खे त . जब र द स ती घ ु स ने के बाद . कल . "	" స పర లా క ఫ ా మ . చ ొ ర బ డి వెళళ ాలి . రే పు . "	0.7578
मेरे पास 3 5 न ं बर था .	నా దాని లో 3 5 ఉంది .	0.5628
पर गर ै जु ए ट होने के बाद , दो बा रा सक ूल में भर ती होना ,	కానీ డి గర ీ పూర తి చేసి కూడా , మ ళళ ీ స కూ లలో చే ర డం ,	0.6801
तुम कयों खेल रहे हो ?	ఎందుకు ఆ డు తుననా వు ?	0.4462
वहाँ सब तरफ जा ल बि छ ा या गया है ,	ఆ పరా ంత ం అంతా ఉ చచు ఉంటుంది ,	0.5331
अगर तुम ही हमा रा सा मान उ ठा ती रही हो , तो आ शा है मा उ थ व ॉ श पसंद आया होगा .	నువవు మా ప యా కె ట లను తీసుకు ంటు ంటే , ఉ చి త మ ౌ త వా ష లు బాగు ండి ఉంటా యి .	0.6433
ऑ न ला इन दोसत ों के साथ , बाद में उनहें ब लै क मे ल करना .	ఆ న లె న లో ప ంచు కు నన వి , వాటి తో బ లా క మె యి ల చేశా రు .	0.6731
बर ॉ न क पर ति यो गि ता ? मुझे नहीं पता था .	సా డి ల బ రో ంక ? నువవు ప ాల గొ ననా వ ని తెలియదు .	0.6103
चाहिए तो , ता ला खो ल ने वाले के पीछे और भी है .	మీకు కా వాల ంటే తా ళ ాలు చేసే అతని దగగర చాలా ఉననా యి .	0.5480
त स वी र लो और आ ध ी रात तक डि गि न स को सब ूत भे जो .	ఫో టో తీ సి , అ ర ధ రాతరి కల లా డి గ గి నస కు సా కష యం పం ప ండి .	0.6486
. . . ज ॉ न डे वि स पसंद ी दा वि जे ता था .	. . . జా న డే వి స గె లు సతా డ ని అను కుననా రు .	0.6706
ज ॉ न डे वि स का बच प न	జా న డే వి స ఓ మా రు మూ ల	0.6270
टर ॉ य , का श तुमहारी मदद कर पा ता . पर यह पह े ली . . .	ట రా య , నీకు స హాయ పడ ాల నే ఉంది . కానీ ప జి ల . . .	0.6693
श ॉ ना को खो ज ने जा रही हूँ .	నేను వెళళ ి ష ా నను వె తు కు తాను .	0.5603
और हम अचछी टी म बन पा एँ गे .	మనం మంచి జ టటు అవు తా మ ను కుంటా .	0.5682
मा य रा ने जज ों के बारे जो बताया , उसने पु ष टि की ?	నయా య ని రణ ే తల పె మె రా చెపపి ంది నిజ మే అని ందా ?	0.5928
द स मिन ट ों में अ ग ली खा ली जगह पर मिल ते हैं ?	తరు వా తి స ందు వ దద 1 0 ని మి ష ాల లో తిరిగి కలు ద దా మా ?	0.6053
ली ला को देखो . ख ू बस ू रत लग रही है .	లీ లా ను చూడు . తను అంద ంగా కనిపి సతుంది .	0.5774
कोई बच चा था , जो मु ँ ह के ब ल सी में ट में जा कर गि रा .	అ చ చే మన కు చ ంద రు డి లో కనిపి ంచే అతను అని చెపప డం గుర తుంది .	0.6409
कुछ जान वर ज ंग ली ही ब ने रह ते हैं .	కొనని క రూ ర జ ం తు వు లు దానని దా టి రా వు .	0.5913
उनहें ल ॉ टो ब ॉल कह ते हैं .	వాటి ని ల ొ టట ో బం తు లు అ ంటా రు .	0.5601
और मेरी बह न . . .	ఇంకా మా సో ద రి . . .	0.5385
