Hindi	Telugu	Similarity_Score
सी आई ए की बात किस ने की ?	అస లు సీ ఐ ఏ మాట ఎవర ె త తా రు ?	0.5704
- बच च ों का इस ते माल करना उन में से एक है . - अचछा ?	- పిలల లను ఎ ర గా వా డ డం వాటి లో ఒకటి . - నిజంగా నా ?	0.6663
मैंने उसकी गल ति यों से सी ख ली है .	నేను అతని త పపు ల నుండి నే రచ ు కుననాను .	0.5617
- पक का ? - कोई बात नहीं .	- ఖ చచితంగా నా ? - ఫ ర లేదు .	0.5779
आप ने मुझे कैसे ढूँढ ा ?	మీరు నన నె లా కను గొ ననా రు ?	0.5017
ज रा ये आ ँ क डे देख ली जिए .	మీరు ఈ సం ఖ య లు చూడ ాలి .	0.6057
सुना है अगर आप की अ ंग रे जी उ तनी अचछी न हो तो वह अ म री का के अचछ े श हर ों में से एक है .	నీ ఇం గ లీ ష అంత గా బ ాల ే కు ంటే , యు ఎ స లో ఉండ డానికి అది మె రు గె న న గ రం అని వి ననా ను .	0.7108
मैं बता रहा हूँ , मुझे यहाँ कुछ ठीक नहीं लग रहा , यार .	నిజంగా చె ప తుననాను , నాకు ఏదో చె డు జరుగు తుంది అనిపి సతు ందో య .	0.5692
खा ते का सा रा ं श परा र ं भ ि क ज मा रा शि 4 8 1 , 2 6 8 . 5 1	ఖ ా తా సా రా ం శం ఓ పె ని ంగ బయ ాల ె నస 4 8 1 , 2 6 8 . 5 1	0.7370
- ए ना बे ल , पलीज . - मैं कोई मदद नहीं कर सकती , ठीक है ?	- అ నన బె ల లె , దయచేసి చెపపు . - నేను మీకు సా యం చేయ లేను , సరేనా ?	0.6211
और ऊँ चे रा स ते से हाथ ध ो बैठ ें ?	అ ందుకు ఎ త తె న నే లను త యా గం చే ద దా మా ?	0.6397
बै ंड - ऐ ड निका ल ने जैसा दर द होता है .	అది బ యా ండ ఎ యి డ ప ీ కే య డం లా ంటి ది .	0.6387
बाहर निक लो .	బె టి కి రా .	0.3475
पर उसके पास कुछ जान का री है जो हमारे काम आ सकती है , ता कि मैं उसकी मदद कर सक ूँ .	కానీ అతని వ దద మాకు ఉ ప యో గ పడ ే సమా చా రం ఉంది , కాబటటి నేను తన కు స హాయ పడ గల ను .	0.6752
वह रे य स था .	తను రే యే స .	0.4947
अ परा ध ों के कार ण हम डर के सा ए में जी ते हैं .	నే ర ాలు మనం భ య ంతో జీవి ంచే లా చేసతుననా యి .	0.6019
ता कि मुझे यकीन हो जाए कि तुम उसे छोड दो गे .	అలా అయితే , తన ను వది లే సా వ ని తెలు సతుంది .	0.5869
वह मु सी ब त में है , ए ना बे ल . मुझे उसे ढूँढ ना होगा .	అతను సమ సయ లో ఉననా డు , అ నన బె ల లె . నేను అత నని కను క కో వాలి .	0.6426
वहाँ जो गो लिया ँ च ली थी ं , जिस में एक आदमी मा रा गया था ?	అ కకడి కాల పు ల గురించి , అకకడ చని పోయి న త ని గురించి ?	0.5519
वह जर म नी का एक बी ए न डी ऑ फि सर है .	అతను జె ర మన బి ఎ న డి అ ధి కా రి .	0.6010
और अब मेरे म सी हा बन ने आए हो .	ఇపపుడు ననను కా పా డ డానికి వచచా వు .	0.5358
कि चु ना व लड ने के मेरे फै स ले के कार ण उनहें कुछ न हो जाए .	పో టీ చేయ ాలను కు నే నా ని రణ యం వ లల వా రికి ఏ మెనా జరుగు తు ందే మో అని .	0.6467
अब वापस इस पर जाओ .	దీ నికి తిరిగి వెళళ ు .	0.3238
यह कया है ?	ఇది ఏంటి ?	0.4184
ऊ पर च लिए .	పె కి ర ండి .	0.3747
वह मै कस श ै ं कल का है .	ఇది మా కస ష ె ం కె ల ది .	0.6367
बस तुम चि ल ला ना मत .	కానీ నువవు అ ర వ కూడ దు .	0.5504
या मैं रे य स को बता सकता हूँ	లేదా సీ ఐ ఏ ననను సం పర ది సతుననా రని	0.5325
आपके लोगों को आप जै सी ने ता की जरूरत है .	మీ పర జ ల కి మీ లా ంటి నా య కు ర ాలు కావాలి .	0.5978
हाँ , और वह उसकी ओ र जा रहा है .	అవును , ఆ ది శ గా వెళ తుననా డు .	0.5639
इस खा ते में एक बडी र कम किस ने डा ली ?	అ తి పెదద మొ తత ం జ మ చేసి ంది ఎవర ో ఊ హి ంచు ?	0.6004
वह आ त म सम मान बना ए रख ना मु श कि ल है जो मेरे मा ता - पिता में हुआ करता था .	ఒక పపుడు మా అమమా నానన లకు ఉనన అదే గ ౌ ర వ ంతో ఇపపుడు ఉండ డం అ సం భ వం .	0.6559
आप ने मुझे कयों बु ला या था ?	మీరు నాకు ఎందుకు కాల చే సా రు ?	0.5476
शे ष रा शि 7 2 9 , 4 4 5 . 3 0 ओ वर ड रा फ ट की सी मा 2 , 5 00 . 00	క లో జి ంగ బయ ాల ె నస 7 2 9 , 4 4 5 . 3 0 ఓ వర డ రా ఫ ట పరి మి త 2 , 5 0 0 . 0 0	0.8006
पर शायद आपके यह चु ना व लड ने का एक कार ण भी वही हैं .	కానీ మీరు పో టీ పడ డానికి వాళళు కూడా ఒక కా రణ ం అను కుంటా ను .	0.5763
मुझे लगा हमारे पास ह वा ई मदद नहीं है .	మన కు వె మా ని క మ దద తు లే ద ను కుననాను .	0.5972
जै क रा यन .	జా క రె న .	0.5375
शायद तुमहारे लिए यह समझ ना मु श कि ल हो ,	నీకు అరథం చేసు కో వడం కష టం కా వచచు ,	0.5574
हम अ मी र नहीं थे ,	మేము ధ ని కు ల ం కాదు ,	0.4957
ए ना बे ल को ढूँढ ो .	అ నన బె ల లె ని కను క కో .	0.5426
हा ला त बद ल रहे हैं .	ఒ ర వ డి మా రు తుంది .	0.5832
उ म मी द का य म रख ना ,	ఆ శ తో ఎ దు రు చూడ డ మా ,	0.6302
ऑ परे शन कर रहे हैं .	విమా నా లు ఉననా యి .	0.4887
मैं उससे कभी नहीं मि ला . सब ई - मे ल के ज रि ए त य हुआ .	ఎపపుడూ వయకతి గ తంగా కల వ లేదు . అంతా ఎ ల క ట రా ని కల గా జరిగి ంది .	0.6556
थो र न ने झ ू ठ बो ला था , जब उसने कहा कि वह बस लोगों को मिल वा ता है .	తను కే వల ం పరి చ య ాలు మా తర మే చేసతుననా నని థా ర న అ నన ది అబ దధ ం .	0.6705
और तुम और है री कब से साथ काम कर रहे हो ?	నువవు , హా రీ ఎంత కాల ంగా కలి సి పని చేసతుననా రు ?	0.5445
कल ग लो रि या ने मुझे बताया कि रे य स के एक आदमी ने	రే యే స మని షి ఒక డు తన కూ తు రికి ఒక తు పా కి గు ండు ఇ చచా డ ని	0.6267
- हैलो , तुम कहाँ हो ? - मुझे अपनी बे टी से बात कर नी है .	- హే , ఎకకడ ఉననా వు ? - నేను నా కూ తు రి తో మాటలాడ ాలి .	0.6830
ए ना बे ल को फोन दो . मुझे जान ना है कि वह ठीक है कि नहीं .	అ నన బె ల లె తో ఫోన లో మాటలా డి ంచు . తను బాగా నే ఉ ందని నాకు తెలియ ాలి .	0.5908
मैं गु जा रा भ त ते के 1 2 चे क एक ही बार में बना कर हर म ही ने की ता री ख डा ल दे ता हूँ .	నేను మొ తత ం 1 2 మన ో వర తి చె కకు ల పె ఒక ే సారి స ంత కం చేసి , పో సట డే ట వే సతాను .	0.6935
सब ठीक तो है न ?	అంతా బాగా నే ఉ ందా ?	0.4358
आ व क क ॉल - नाम : थो र न , रू पर ट जगह : ल ंद न , इ ंग लै ंड	కాల వ సతుంది - కాల ర : థా ర న , రూ పర ట సథ ల ం : ల ండ న , ఇం గ లా ండ	0.7449
का त िया , मैं आपको सुन सकती हूँ !	కా టి యా , నాకు మీ స వ రం వి ని పి సతుంది !	0.5236
मुझे गो ली मा रो गे ?	ననను క ాలు సతా వా ?	0.4840
तुमहें कया चाहिए ?	నీకు ఏం కావాలి ?	0.4104
वह एक जर मन ना गर ि क है और पै स ों के लिए लोगों की ह त या करता है .	అతను జర మన ప ౌ రు డు , అతను జ నా లని డబబు కోసం హ త య చేసతా డు .	0.6664
एक बात क हूँ , यार ? मुझे अभी तक व कत नहीं मि ला .	నీ కొ క విషయం చెపప నా ? నా క ది చూడ డానికి సమయం దొ ర క లేదు .	0.6109
- लगता है उसने कहीं ध ु आ ँ देखा है . - ध ु आ ँ ?	- అతను ఏదో పొ గ చూ సిన టటు ననా డు . - పొ గ నా ?	0.6533
आज , खा ने और द वा ई की भा री कमी के कार ण	ఇ వాళ , ఆ హా రం , మ ందు లకు ఉనన తీ వర మెన కొ ర త వ లల	0.6245
- आप की मदद का शुकरिया . - चु ना व के लिए शु भ काम ना एँ .	- మీ స హా యా నికి ధనయవాదాలు . - దీ న ంత టి కీ గు డ ల క .	0.6738
मैं कोई बे व कू फ नहीं हूँ . मुझे पता है वह कया काम करते हैं .	నేను పి చచి దానని కా ను . తన ఉద యో గం ఏమి టో నాకు తెలుసు .	0.6192
और फिर भी , न जाने कयों , हमारे पास अपने बच च ों के लिए खा ना नहीं है .	అయి నా , ఎలా గో , మన కు మన పిలల ల క డు పు ని ం ప డానికి సరి ప డా లేదు .	0.6553
तो , वह कौन है ?	అయితే , తను ఎవరు ?	0.4569
यहाँ आओ .	ఇలా రా .	0.3703
- अंदर आ जाओ . - एक मिन ट बात कर सकते हैं ?	- లో ప లి కి రా . - ఒక ని మి ష ం మాటలాడ వచచా ?	0.6305
उसका नाम फ लै श ला इ डा र है .	దాని పేరు ఫ లా ష లె డా ర .	0.5533
पर उनहोंने कभी खा ने की कमी नहीं होने दी ,	కానీ ఎపపుడూ తి న డానికి తి ండి ఉండే ది ,	0.5160
मैंने कहा था कि द ख ल मत देना .	నినను జో క యం చేసు కో వ దద ని చెపపా ను .	0.5658
अगर वह मु सी ब त में हैं , तो बी ए न डी वाले उनकी मदद कयों नहीं कर रहे ?	తను సమ సయ లో ఉ ంటే , మరి బి ఎ న డి తన కు ఎందుకు సా యం చేయ ట లేదు ?	0.6701
बता ओ तुमहें किस ने काम पर र खा है .	నినను ఎవరు ని య మి ంచా రో చెపపు .	0.5627
इस ी व कत .	వె ంట నే .	0.3686
पर अगर कोई और स रो त मिल जाए , तो ?	కానీ ఒక వే ళ ఇం కొ క వ న రు ఉ ంటే ?	0.5938
जा ह िर है , अचछी तरह नहीं सि खा या .	నిజంగా , సరి గ గా నే ర పి ంచ లేదు .	0.5449
मतलब , हम उसे ढूँढ ेंगे कैसे ?	అంటే , అస లు త నని ఎలా కను క కో వాలి ?	0.5225
उन में से जयादा तर लोग व ॉ ले न टि यर हैं , कि सान , ट ै क सी चा ल क .	వాళళు వాల ంట ీ రలు , చాలా వర కు రె తు లు , క యా బ డ రె వర లు .	0.6739
सा रे भ ु ग ता न एक जा ली खा ते के ज रि ए कि ए जा ते हैं .	చె ల లి ం పు ల న నీ ఒక అ కర మ ఖ ా తా నుండి వెళ తా యి .	0.6753
यहाँ तुमहारी मर जी नहीं च ले गी . मेरी मर जी च ले गी .	ఇది ఎలా జ రగ ాలో చెపప ే ది నువవు కాదు . నేను .	0.5751
कि मेरे यहाँ न होने पर भी तुमहारे पास जरूरत का सा रा सा मान हो .	నీకు కా వల సిన వ న నీ ఉండే లా ని ర ధా రి ంచుకో వాల ని అను కుననాను .	0.5958
वह कई चीज ों के उ त पा द न में काफी अ हम है .	అ నని ర కాల త యా రీ లలో ఇది కీ ల క మె ంది .	0.6349
आपको ए त राज न हो , से न यो रा बो ना ल डे ,	సె న యో రా బ ొ ండ ే ల , మీరు అన య ధా భా వి ంచ కపో తే ,	0.6037
कोई इं सा नी मदद नहीं है . के व ल यू ए स ए स पे रा ल टा के नि ह त थे ड रो न ,	మ ను ష ు లు నన వి లే వు . వె నె జు లా తీ రం నుండి దా దా పు 1 7 నా టి కల మె ళళ ద ూ రం లో ని	0.6927
तुम रा यन के साथ काम कर रही हो .	ను వు రె న తో పని చేసతుననా వు .	0.5553
मुझे लगा था कि तुम मुझे बेह तर समझ ती हो .	నీకు నా గురించి ఇంకా ఎకకువ తెలుసు అను కుననాను .	0.5054
मुझे जाना होगा .	నేను వెళళ ాలి .	0.4236
उसने मेरे पा पा के बारे में	మా నానన గురించి అతను చెపపి ంది ,	0.4884
हमने अभी उ बा री को अपनी प तनी से फोन पर बात करते सुना .	మేము ఇ పపుడ ే ఉ బర రి తన భా ర య కు చేసిన కాల వి ననా ం .	0.6328
दोसत ों , या तो दर रे से चल कर जा सकते हैं या तीन दिन झ ा डि यों से जू झ सकते हैं .	మనం వా గు నుండి వెళల వచచు లేదా మూ డు రోజు లు తు పప లలో నుండి వెళళ వచచు .	0.5971
यहाँ मैं सु र कष ि त मह सू स करता हूँ .	అంటే , నా కి కకడ సు ర కష ి తంగా అనిపి సతుంది .	0.5739
मेरे रा स ते में मत आ ना .	నా దా రికి అ డ డు రా కు .	0.6047
और मेरी माँ पास ही के एक सक ूल में प ढ ा ती थी ं .	మా అమమ అ కకడి బ డి లో టీ చ రు గా పని చేసే ది .	0.6098
बो ना ल डे चु ना व मु ख या ल य कर ा कस , वे ने जु ए ला	బ ొ ండ ే ల ఎ నని కల పర ధా న కార య ాల యం క రా కస , వె నె జు లా	0.6911
और कि उसका उस अ म री की सा ं स द की ह त या से कया सं बं ध है .	దా నికి , యు ఎ స సె నె టర మ రణ ా నికి మ ధయ ఉనన సం బం ధ ం .	0.6829
मुझे एक काम पू रा करना है .	నేను పూర తి చేయ వల సిన పని ఉంది .	0.5513
यह तुमहारी इ कल ौ ती चे ता व नी है .	ఇది నీ కి చ చే ఏ కె క హె చచ రిక .	0.5375
लगता है आपके भी बच चे हैं .	మీకు కూడా పిలల లు ఉనన టటు ననా రు .	0.5299
मुझे इसे डे टा से मि ला ने में एक से क ंड ल गे गा .	మనం స క రే ప చేసిన డే టా ను చూడ డానికి ఒకక ని మి ష ం ఆ గ ాలి .	0.6211
किसी से मदद ले ली .	స హా యం చేయ మని అ డి గా ను .	0.5173
यह कहाँ से है ?	ఇది ఎ కకడి ది ?	0.5350
यह बहुत ख ू बस ू रत है . शुकरिया .	చాలా బాగు ంది . ధనయవాదాలు .	0.4628
कया तुम लै ंड ला इन से मेरे दूस रे न ं बर पर फोन करो गे ?	నా క వర నం బర కు ల యా ండ లె న నుండి కాల చేయ గల వా ?	0.6523
बहुत ल ं बी सू ची है .	చా ంతా డ ంత జా బి తా ఉంది .	0.5026
उसे जाने दो .	అత నని వది లే యి .	0.4424
वह कॉ ले ज में प ढ ती है .	ఆమె చ దు వు కు ంటుంది .	0.5336
मैंने उसे मेरे रा स ते में न आ ने का एक मौ का दिया था , उसने बात नहीं मा नी .	తన కు వెళళ ి పో వ డానికి అవ కా శం ఇ చచా ను , కానీ తను ఉ ప యో గి ంచుకో లేదు .	0.6655
मैं बस तुमहें उसे फोन करने को कह रहा हूँ .	నినను కే వల ం ఆ యన కి కాల చేయ మ ంటుననా ను .	0.5803
कया तुम अब तक यही सोच रहे थे ?	ఇంత కాల ం , నువవు ఆలోచి ంచి ంది అదే నా ?	0.5080
बस यह पक का कर ले ना चाहता था	అంటే , నేను వెళళ ి న పపుడు ,	0.5172
मैंने तुमहें चे ता व नी दी थी .	నేను నినను హె చచ రి ంచా ను .	0.5440
आप की आ ँ ख को कया हुआ ?	నీ క ంటి కి ఏ మె ంది ?	0.4545
यह तो बहुत सु ंदर है .	ఇది చాలా బాగు ంది .	0.4385
सि ने मा के सि वा य . कोई बे व कू फ भी वह आ रा म से कर सकता है .	ఒకక సి ని మా తపప . అది ఎంత వె ధ వె నా బాగా చేయ గల డు .	0.6381
तो तुमहें लगता है कि किसी को यहाँ इसका भ ं डा र मि ला है ?	అయితే ఈ ని కష ే ప ణం ఇకకడ ఎవ రి కె నా దొ రికి ంద ంటా వా ?	0.5931
ब ल कि हमारे पास दु निया का सबसे ब डा ते ल का भ ं डा र भी है .	మన కు పర ప ంచ ంలో నే అ తి పెదద చ ము రు ని ల వ లు ఉననా యి .	0.6744
नाम , खा ता न ं बर , पै स ों का ले न - दे न .	పే రలు , ఖ ా తా నం బర లు , అతను చేసిన బ ది లీ లు .	0.6544
पलीज , मै कस .	దయచేసి , మా కస .	0.5232
घर लौ ट जाओ .	ఇంటి కి వెళళ ు .	0.3857
कि ंग ए ड वर ड .	కి ంగ ఎ డ వర డ లో .	0.5630
वह कहाँ है ?	తను ఎ కక డు ంది ?	0.4280
हा ला ँ कि तुमहारा दर द देख कर मुझे खुश ी जरूर हो रही है .	నీ బా ధ చూడ డం అ నే ది సంతో ష కర మెన పర మా ద ం అను కో .	0.6507
मैं आ ग ज ला ने के लिए ल क डी का ट रहा था और एक ट ु क डा उ ड कर आया ,	వ ంట చె రు కు కోసం క టట ె లు కొ డు తు ంటే , చినన తు న క వచచి	0.6504
वो गल र नाम की एक कं प नी ने ल ॉ न च किया था .	వ ో గ లే ర అ నే సం సథ అని రె న చెపపా డు .	0.6420
बता ओ कि तुमहें मो रे न ो की ह त या करने का काम किस ने दिया था ,	మో రె నో ని చం ప డానికి నినను ఎవరు ని య మి ంచా రో చెపపు ,	0.5758
बस अपने पा पा को फोन कर दो .	నువవు మీ నానన కు కాల చె య యి చ ాలు .	0.5210
जैसे , सर कि ट बो र ड , जी पी ए स सि सट म , जे ट इं जन .	అంటే , సర క యూ ట బో ర డు లు , జి పి ఎ స వయ వ సథ లు , జె ట ఇం జ న లు .	0.7236
है री वही करती है जो उसके लिए अचछा होता है .	హ యా రీ తన కు ఏ ది మంచి ద ో అదే చే సతుంది .	0.5811
और सी धा आ ँ ख में जा लगा . ला पर वा ही थी .	సరి గ గా క ంట లో పడి ంది . వె ర రి త నం .	0.5727
मेरे ख या ल से , द कष ि ण अ म री की है .	ద కష ి ణ అ మె రి కా అను కుంటా ను .	0.6216
ल ंद न ?	ల ండ నా ?	0.4214
