Hindi	Telugu	Similarity_Score
ल ंद न , इ ंग लै ंड	ల ండ న , ఇం గ లా ండ	0.5170
आओ .	పద .	0.6010
और तुमहारा काम खतम . वह अ ग ले ह वा ई ज हा ज से जर म नी जा रही है .	నీ పని అయి పోయింది . అ మె తరు వా తి విమా నం లో జర మ నీ కి వెళ తుంది .	0.6126
ल गे गा कि वह तुमहारा साथ दे रही है , पर यकीन मान ो ,	ఆమె నీ వె పు ఉ ందని నువవు న మమ వచచు , కానీ ననను న మ ము ,	0.6224
यह वी डि यो आज सु बह का है , पर स ें ट कॉ म ने इसे अभी भे जा है .	ఈ వీ డి యో ఇ వాళ పొ దదు న ది , కానీ సె ంట కో మ ఇ పపుడ ే పం పి ంచి ంది .	0.6778
दे शान तर 2 5 4 7 .	రే ఖ ా ం శం 2 5 4 7 .	0.6984
हाँ .	సరే .	0.3574
कि ंग ए ड वर ड यू नि वर सि टी ए ग है म , इ ंग लै ंड	కి ంగ ఎ డ వర డ వి శ వ వి దయ ాల యం ఎ గం , ఇం గ లా ండ	0.7138
- प ढ ा ई कै सी चल रही है ? - मु श कि ल है .	- క లా సు లు ఎలా జరుగు తుననా యి ? - కష ట ంగా .	0.6777
थो र न	థా ర న	0.4211
यार , मैंने ल ंद न में छ ह म ही ने प ढ ा ई की थी .	నేను నా సె మి సట ర వి దేశం లో , ల ండ న లో చే సా ను .	0.6612
नहीं .	లేదు .	0.3291
1 9 म ई 1 3 : 4 0 ल ंद न 2 0 म ई 0 9 : 5 6 ल ंद न	1 9 మే 1 3 : 4 0 ల ండ న 2 0 మే 0 9 : 5 6 ల ండ న	0.8260
तुमने कहा कि यह की म ती है . कि तना की म ती है ?	అది వి లు వెన దని అ ననా వు . అది ఎంత వి లు వెన ది ?	0.5741
अगर वो गल र ने वह ए का धि कार तो ड दिया , तो ?	ఒక వే ళ వ ో గ లే ర ఆ గు త తా ధి ప త యా నని ఛ ే ది సతే ?	0.6103
कया बात है ?	ఏంటి విషయం ?	0.4612
ठीक है . हो जे को ले जाओ . वह मा ह िर है .	సరే . జో సట ని తీసు కె ళళు . అతను సమ ర ధ ు డు .	0.6385
यहाँ आ ने का शुकरिया , से न यो र ग री यर .	వచచి న ందుకు ధనయవాదాలు , సె న యో ర గర ీ ర .	0.6259
हो जे आपके आद मि यों के साथ कुछ दिन बि ता ए गा ,	జో సట కొనని రోజు లు మీ భ దర త సి బబ ంది తో ఉ ండి ,	0.6352
सच में , है रि य ट .	నిజంగా , హా రి య ట .	0.5991
नहीं .	లేదు .	0.3291
मै कस ? मै कस !	మా కస ? మా కస !	0.6079
सि ं को पा मा स .	సి ం కో ప ాల మ స .	0.4779
उसकी एक बे टी भी है ?	అతనికి కూ తు రు ఉ ందా ?	0.5587
का त िया जि ला कर ा कस , वे ने जु ए ला	కా టి యా జి ల లా క రా కస , వె నె జు లా	0.6114
रा ष टर प ति रे य स ने हम सब को ध ो खा दिया है !	పర ె సి డె ంట రే యే స మన ంద రికీ ద రో హ ం చే సా డు !	0.6473
लि वर पू ल सट री ट सट े शन	లి వర ప ూ ల సట రీ ట సట ే షన	0.6377
मै कस .	మా కస .	0.5891
ख ै र , यह थोडा पे ची दा है .	అంటే , అది సం కలి ష ట మెన ది .	0.6177
मुझे नहीं पता कि वह कहाँ हैं . मैं कई म ही नों से उन से नहीं मि ली .	అంటే , నాకు తను ఎకకడ ఉననా డ ో తె లీ దు . తన ను చూ సి కొనని నె లల య యి ంది .	0.6328
ए ना बे ल , वह व ै सा नहीं है , जैसा तुम उसे समझ ती हो .	అ నన బె ల లె , తన గురించి నువవు అను కు నే ది నిజ ం కాదు .	0.6672
एक मिन ट , व ै ले न टी ना .	ఒకక కష ణం , వాల ే ంట ె న .	0.6244
तुम अपने परिवार को सम ंदर कि ना रे घ ुम ा ने ले जाओ गे .	నీ కుటుం బా నని సె ల వు లకు స ము దర తీ రా నికి తీసు కె ళళు .	0.6264
सब ठीक हो जाएगा .	అంతా బాగు ంటుంది .	0.3977
बात सही लग ती भी है .	అది అరథ వ ంత ంగా ఉంది .	0.4576
नहीं .	కాదు .	0.3291
यहाँ की राज नी ति को देख ते हुए , मैं इससे जयादा कुछ नहीं कर पा ऊँ गा .	దీ నికి సం బం ధి ంచిన రా జ కీ య లకు వ సతే , నేను మీకు చేయ గ లి గి న స హా యం ఇంత ే .	0.6560
हमें मो का रा ओ , ए ल वाले और लि बर टे ड ो र में जयादा काम करना होगा .	మన క ృ ష ంతా మా క రా వ , ఎ ల వే ల ఇంకా లి బర టె డా ర పె న కే ంద రీ కరి దదాం .	0.6394
मैंने अपनी व ं शा व ली की जा ँच कर वा ई थी . मैं आ धा इं डि यन हूँ .	నేను జ న యు పర ీ కష చే యి ంచు కుననాను . నా లో రె డ ఇ ండి యన ర క తం ఉంది .	0.6820
यार , वह बहुत ही अ जी ब है . पता है न लोग कया कह ते हैं ?	బ రో , అది భ యం కర ంగా ఉంటుంది . జ నం ఏ మ ంటా రో తెలుసు కదా ?	0.6564
तुमने मेरा बि ज ने स प ला न देखा ? कोई अचछी ख बर सुना ओ .	ఆ వ యా పా ర పర ణ ా ళ ి క చూ సా వా ? ఏద ెనా మంచి వా ర త చెపపు .	0.6525
पहले नाम से बु ला ने ल गे हो . सुन ने में म जे दार है .	మొద టి పేరు వాడు తుననా వు . అది చాలా త మా ష ా గా ఉంది .	0.6507
वह मुझे फोन करते हैं . हमेशा से ऐसा ही हुआ है .	త నే నా తో మాటలాడ తా డు . ఎ పపటి ను ండ ో అలాగే ఉంది .	0.6092
मह ँ गा ई के कार ण पै स ों की कोई की मत नहीं रह गई .	దర వ యో ల బ ణం మన డబబు కు వి లు వ లే కుండా చే సతుంది .	0.6571
तुमहारी रू म मे ट ने बताया कि तुम कहाँ प ढ ती हो .	నువవు ఎకకడ చ దు వు కుంటా వ ో నీ రూ మ మే ట చెపపి ంది .	0.6428
मैं यह सवा ल हर रो ज अपने आप से पूछ ता हूँ .	అది పరతి రోజు ననను నేను అ డు గు త ూ ఉంటా ను .	0.5935
सा मान बा ँ ध ने में भी मेरी मदद करो गे कया ?	నా సా మా న లు సర ద డానికి కూడా స హా యం చేసతా వా ?	0.5886
ज हाँ तक मुझे इन हा ला त ों का अनु भ व है . . .	ఇలా ంటి పరి సథి తు లలో నా అను భ వం అయితే . . .	0.6680
इस व कत , ट ै न ट ल म पर ची न का ए का धि कार है .	పర సతు తం , టా ంట ల ం పె చె నా దే గు త తా ధి ప త యం .	0.6655
ठीक है , देखो , कोई द बा व नहीं डा ल रहा ,	సరే , చూడు , నినను బ ల వ ంత పెటట ాలని కాదు ,	0.6525
तुमने मुझे ऐ सी गल ती न करना सि खा या है .	నువవు నాకు అంత కంటే ఎకకువ నే ర పి ంచా వు .	0.5830
कया मैं आप का परि च य प तर देख सकती हूँ ?	నాకు ఏద ెనా గుర తి ం పు లా ంటి ది చూ పి సతా రా ?	0.5464
उसने दो साल पहले बी ए न डी छोड दिया था ,	తను రె ండ ే ళళ కరి తం బి ఎ న డి వది లే సా డు ,	0.5939
हम ट रे न से वहाँ फ टा फ ट पहु ँच जाएँ गे .	అ కకడికి రె లు లో అయితే త వర గా వెళళ వచచు .	0.6242
माफ करना , मैं समय पर नहीं पहु ँच पा ई .	నేను ము ందే రాల ే క పోయి న ందుకు కషమి ంచు .	0.5301
जिस से मैं पि छ ले अ पर ै ल में मि ली थी .	నేను బాగా తా గి ఉండ వచచు , ఉండ కపో వచచు .	0.5827
हम सु बह तक उनके पास पहु ँच जाएँ गे .	పొ దదు న కల లా , వాళళ ను చే రు కో గ లు గు తా ం .	0.5533
समझ सकता हूँ . सुनो , यह कै सा रहे गा ? मैं कल उसे देख ल ूँगा . वा दा रहा .	అరథం చేసు కో గల ను . వి ను , ఒక పని చే ద దా మా ? నే న ది రే పు చూ సతాను . ఒ టటు .	0.6916
ज हाँ रह ने का मौ का भी नहीं मिल ता .	అది వా డే అవ కా శం నా కె పపుడ ూ రా దు .	0.5900
ए ल ह टी यो और सू करे को मत भ ू लिए गा .	ఎ ల హ టి లో ఇంకా సు కర ని వది లే య దదు .	0.6789
और उनहें इसका ज वा ब देना होगा !	దీ నికి అత నని బా ధ యు డి ని చేయ ాలి !	0.4843
परे ष क : म ॉ नि टर @ न ॉर थ ले क अ ला इ ड . कॉ म न ं बर 1 पू र ण , न ं बर 2 बा की	టు : మా ని టర @ నా ర త లే క ఆ లీ డ . కా ం # 1 పరి ష కరి ంచ బ డి ంది , # 2 పె ండి ంగ	0.7282
कर ा कस फा इ ल खा ता : रू पर ट थो र न	క రా కస ఫ ె ల ఖ ా తా : రు పె ర ట తో ర నే	0.6535
यह बात किसी रि क ॉर ड में न आए .	ఇది అన ధి కా రిక ంగా చేసతుననా ం .	0.5129
इस व कत , मैं एक ऑ परे टि ंग सि सट म भे द ने की कोशिश में हूँ .	సరే , ఇపపుడు , నేను ఒక ఓ ఎ స ని చే ధి ంచ డానికి పర యత ని సతుననాను .	0.6509
अब मैं तुमहें छोड रहा हूँ ,	ఇపపుడు , నినను వ దు లు తుననాను ,	0.4450
इ मत ि हा न के बाद छोड द ूँगी .	మి డ టర మ స తరువాత వది లే సతాను .	0.5784
मैं बाद में फोन करता हूँ .	నేను తిరిగి కాల చే సతాను .	0.4410
तो दु निया भर का सा रा तक नी की का रो बार खतम हो जाएगा .	పర ప ంచ మ ంత టా , మొ తత ం సా ం కే తి క వ యా పా రం కూ లి పో తుంది .	0.5654
जयादा दू र नहीं गया होगा .	ఎకకువ ద ూ రం వెళళ ి ఉండ డు .	0.5356
उसका नाम मै कस श ै ं कल है .	అతని పేరు మా కస ష ె ం కె ల .	0.6246
डि जि ट ल इन ो वे शन नि दे शा ल य सी . आई . ए . मु ख या ल य	డి జి ట ల ఆ విష క రణ డె రె క ట రే ట సీ ఐ ఏ పర ధా న కార య ాల యం	0.6796
यह ट ै न ट ल म कया ब ला है ?	అస లు టా ంట ల ం అంటే ఏంటి ?	0.5497
मेरे ख या ल से तुमहें पता है कि मैं कहाँ हूँ .	సరే , నేను ఎ కక డు ననా నో నీకు తెలు స ను కుంటా ను .	0.5729
जाओ , खा ने का मजा लो .	మీ భ ో జ నం ఎ ం జా య చె య యి .	0.4921
तो आप अ म री की सर कार के लिए काम करते हैं ?	అయితే మీరు యు . ఎ స . పర భ ు త వ ంలో పని చేసతా రా ?	0.5904
अब वह पै स ों के लिए लोगों की ह त या करता है .	ఇపపుడు డబబు కోసం జ నా లని హ త య చేసతుననా డు .	0.6169
ट ॉ म कल ै न सी ज जै क रा यन	టా మ క లా నస ీ స జా క రె న	0.6158
नहीं , उसके हाथ पर गो ली मार ेंगे . जिस से वह ह सत मै थ ु न करता होगा .	లేదు వాడి చే తి ని క ాలు దదాం . వాడు స వయ ంత ృ ప తి చేసు కు నే చె య యి .	0.6532
हम यहाँ से न यो रा बो ना ल डे से मिल ने आए हैं .	మేము సె న యో రా బ ొ ండ ే లని కల వ డానికి వచచా ం .	0.6322
- आप से मिल कर अचछा लगा . - मिल कर अचछा लगा .	- మి మమ లని కల వడం సంతో ష ంగా ఉంది . - నా కక ూ డా .	0.5925
मि सट र रा यन , मैं यहाँ तुमहारे दिल का बो झ ह ल का करने नहीं आया .	మి సట ర రె న , నేను ఇ కకడికి నీ భా రా నని త ొ ల గి ంచ డానికి రాల ేదు .	0.6203
मि सट र मार जान हमारे एक स था नी य ऑ फि सर हैं .	మి సట ర మార ట జా న మా సథ ా ని క బ ల గ ాల లో ఒక రు .	0.6396
- शुकरिया . - ग री यर .	- ధనయవాదాలు . - గర ీ ర .	0.5987
पता है मो रे न ो की ह त या से एक दिन पहले	మో రె నో హ త య జ రి గే ముందు రోజు ఈ ఖ ా త ాలో కి	0.6173
मैंने म टी स से बात की , उसे वहाँ के नि र दे शा ं क दि ए हैं .	నేను మా టి స ని సం పర ది ంచా ను , అతనికి గ రి డ అ కష ా ం శ ాలు ఇ చచా ను .	0.6702
- यह देखो . - वाह .	- చూ సు కో . - బాగు ంది .	0.5546
गो ली बस छ ू कर निक ले गी . शायद पै र पर .	ఊ రి కే పె పె న గా య పడ ే టటు . బహు శా పి కక లో .	0.6464
यह हो जे मार जान है .	తను జో సట మార ట జా న .	0.5523
मेरे ख या ल से क सान ड रा और म रि या को वहाँ अचछा ल गे गा .	బహు శా కా సా ండ రా కి , మరి యా కి అకకడ న చచు తుంది అను కుంటా ను .	0.6087
मैं डॉ . रा यन को करी ब सा ढ े तीन साल से जान ती हूँ .	నాకు డా . రె న గురించి దా దా పు మూ డు నన ర ఏ ళళు గా తెలుసు .	0.6392
श वा इ जर लै ंड सब ै ं क ऑ फ स वि ट जर लै ंड मि सट र मै कस श ै ं कल	స వి ట జర ల యా ండ ష వె ట జర ల యా ండ ె స బ యా ంక మి సట ర మా కస ష ె ం కె ల	0.7046
कि मुझे इं सा नों की अचछी पह चा न है .	సరి గ గా అ ంచ నా వే య గల నని నా న మమ కం .	0.5830
मैं उसके बारे में पता कर रहा हूँ .	నేను తన గురించి కను కకు ంటుననా ను .	0.5183
पर जब वह ग धा मिले गा , तो मुझे उसे गो ली मार ने देना .	కానీ ఆ వె ధ వ క న పడ గా నే , ననను వాడి ని కాల చని వ వాలి .	0.6194
अचछा ? यह तो . . .	అవు నా ? అది . . .	0.6567
कर ा कस , वे ने जु ए ला	క రా కస , వె నె జు లా	0.6321
अ म री की कै ं प के पास जा रहे हैं .	అ మె రిక న లు శి బి రం వె పు వ సతుననా రు .	0.6338
2 3 म ई 1 0 : 3 3 फि ला डे ल फ िया अ म री का	2 3 మే 1 0 : 3 3 ఫి ల డె ల ఫి యా యు ఎ స ఎ	0.7533
ठीक है , तो . . .	సరే , అంటే . . .	0.6756
और यह करने वाला इं सान इस ी जगह का बा शि ं दा है .	ఇ దే పరా ంత ంలో పు టటి పె రిగి న ఒక పెదద మని షి .	0.6121
मैं आप की स थ ि ति में होने की सोच भी नहीं सकता .	మీరు నన పరి సథి తి లో ననను నేను ఊ హి ంచుకో లేను .	0.5813
मैं किसी को वहाँ ले जा कर उसके सु र कष ा कर मि यों को पर शि कष ण देना चा हूँ गा .	నేను ఎవ రి నె నా తీసు కె ళళ ి ఆమె భ దర తా ద ళ ా నికి శి కష ణ అ ంది ంచ ాలని అనుకుంటుననా ను .	0.6295
जे रे मी से पहले , थो र न से पहले ?	జె రె మీ కి ముందు , థా ర న ముందు ?	0.5669
मेरा एक बे टा है , जे जे , जो दो म ही ने में 1 6 साल का हो जाएगा ,	నాకు ఒక కొ డు కుననా డు , జె జె , రెండు నె లల లో 1 6 ని ండు తుంది ,	0.6817
- है री . . . - मेरे पास और कोई चा रा नहीं था .	- హ యా రీ . . . - నాకు ఇం కో మా రగ ం లే క పోయింది .	0.7001
एक ह फ ते पहले .	ఒక వా రం కరి తం .	0.5110
हैलो , ए ना बे ल .	హ లో , అ నన బె ల లె .	0.5448
ठीक है , अ ग ला .	సరే , తరువాత ది .	0.5224
कुछ दे र मैं अ गु वा ई करता हूँ .	కొ ద ది సే పు నేను ముందు ంటా ను .	0.5781
तुमहें पता है कि मैं झ ू ठ नहीं बोल रहा है .	నేను అబ దధ ం ఆ డ ట లే దని నీకు తెలు స ను కుంటా .	0.5982
मैं ए ना बे ल को छोड द ूँगा और तुमहारे पीछे भी नहीं आ ऊँ गा .	నేను అ నన బె ల లె ను వది లే సతాను , నినను కూడా వది లే సతాను .	0.6262
जो वे ने जु ए ला के त ट से करी ब 1 7 न ॉ टि कल मी ल दू र है .	యు ఎ స ఎ స పె ర ల తా కి చె ంది న ని రా యు ధ డ రో నస మా త రం ఉననా యి .	0.7204
मैं उनहें इतना का बिल बना ना चा हूँ गा कि कम से कम चु ना व ों तक उसकी सु र कष ा कर सक ें .	ఎ నని కల వర కు ఆమె ను కా పా డ డానికి పో రా డే అవ కా శా నని వా రికి ఇ ద దా మ ను కుంటుననా ను .	0.6239
यह अपने काम में मा ह िर हैं .	తన పని బాగా తెలి సిన వాడు .	0.4866
है रि य ट मो बा इ ल	హా రి య ట మొ బె ల	0.5209
और आप की प तनी ?	మరి మీ భా ర య ?	0.4293
तुमने आ कर मेरा सा रा काम बि गा ड दिया .	నువవు వచచి , నా పర ణ ా ళ ి కలు నా శ నం చే సా వు .	0.5622
ज ंग ल में रे य स के ख न न के काम की जान का री	అ డ వి లో రే యే స గ ను ల త వ వ కాల ప ను లు ఇంకా	0.6874
वह करी ब एक घ ं टे पहले उस च ट टा न से नीचे उ त रा था .	ఒక గ ంట కరి తం తను ఆ రా తి ముఖ ం నుండి కి ంది కి ది గా డు .	0.6364
अभी कयों नहीं देख ले ते ?	దానని ఇ పపుడ ే చూడ వచచు కదా ?	0.5104
रा यन ने कहा था कि द कष ि ण ची न सा गर वाला सै टे ला इट	ఇక , ద కష ి ణ చె నా స ము ద రం నుండి ఉ ప గర హా నని పర యో గి ంచి ంది	0.6248
पर तुमहारे पास उससे बात करने का कोई रा सता तो होगा .	కానీ తన ను సం పర ది ంచ డానికి నీ కే ద ో మా రగ ం ఉంటుంది .	0.5685
तुमहारे ब ॉ स को तुमहारी व फा दा री पर शक होने लगा है .	నీ బా స కు నీ వి శ వ స నీ యత పె న అను మా నం మొద ల య యి ంది .	0.6221
समझ सकता हूँ कि अगर यह सच होता तो कि तना अ सर पड ता .	అదే నిజ మె తే ఎంత అరథం ఉ ంటు ందో నాకు తెలు సతుంది .	0.5508
यह क ॉल म बा इट - ट ै न ट ला इट है .	ఇది కలు మ బి ట ే తత న త లి తే .	0.6150
- मि सट र ग री यर . - से न यो रा .	- మి సట ర గర ీ ర . - సె న యో రా .	0.6489
उसने लि फ ट में तुमहें कयों नहीं मा रा ?	అతను నినను లి ఫ ట లో ఎందుకు చం ప లేదు ?	0.5664
रि क ॉर डि ंग से काम बन गया .	రి కార డి ంగ పని చేసి ంది .	0.4913
