Hindi	Telugu	Similarity_Score
- हे लो , जान ! - हे लो , जान !	- హాయ , బ ే బీ . - హాయ , బ ే బీ .	0.5330
मतलब , मैं इससे उ बर नहीं पा ती .	అంటే , అది మర చి పో లే కపో తుననాను .	0.5609
हे लो , प ति दे व .	హ లో భ ర త గా రు .	0.6072
पलीज , पलीज , बैठ ो .	ప లీ జ , ప లీ జ కూ రచ ో .	0.4629
अब वो भी हमा रा काम है कया ?	అది ఇపపుడు మన జా బ లో భా గ మా ?	0.5415
मुझे इसका दा म पता करना है .	దీ నని బ ే రీ జు వే సి చెపప ండి .	0.5034
अगर मुझे ये दो बा रा करना होता , तो मैं फिर से कर ूँगी .	నే ని ది మ ళళ ీ తిరిగి అంతా చె యయ ాల ీ అంటే , నేను చే సతాను .	0.6060
ते रे को पता है , कर न सर ने मेरे को खुद बु ला या है .	నీకు తెలుసా , క రణ సర ననను పర త యే క ంగా ఇ న వె ట చే సా రు .	0.6533
वह अचछी है .	తను మంచిది .	0.4514
तो , करना तो पडे गा .	నువవు చె యయ ాల సి ందే .	0.4889
इससे तुमहारा कोई मतलब नहीं है .	ఇది మీకు సం బం ధి ంచ న విషయం కాదు .	0.5056
हाँ , बिलकुल . कुछ भी . जो भी क हो .	సరే తపప కుండా . ఏద ెనా సరే . చెపపు .	0.5621
अ ंत में , वही मा य ने रख ते हैं .	. . . చి వ రికి , వాళళ ే అంతా న ూ .	0.6183
हाँ , हमने उनहें प ला न भे ज दि ए हैं . उनकी म ं जू री का इं त जार है .	అవును , వాళల కి ప లా నస పం పి ంచా ం . అ ంగ ీ కా రం కోసం వె యి ట చేసతుననా ం .	0.6772
चि ं ता मत करो . सब ठीक ही होगा .	ఖ ంగా రు పడ కు . అంతా బాగు ౦ టు ంది .	0.5926
हाँ . वो कुछ सै ं प ल आया है वहाँ से .	అవును . వాళళు కొనని సా ం పు ల స పం పా రు .	0.6047
ख ै र , अभी वापस फोन मत करना , ठीक है ?	సరే , మ ళళ ీ వె ంట నే కాల చె యయ కు , సరే ?	0.6504
कया मतलब मेरी पह ली शादी है ?	మొద టి పె ళళ ంటే నీ ఉద దే శ మే ంటి ?	0.4506
मुझे ये सब कयों बता रहे हो ?	నా కి ద ంతా ఎందుకు చెబు తుననా వు ?	0.4925
- ये ह वे ली के लिए ? - हाँ .	- ఇ వి మ హ లు కో సమా ? - అవును .	0.6487
जब माँ की बात होती है ना , तो भा व ना एँ ही काम आ ती हैं .	ఎపపుడూ తల లు ల విషయం లో , సె ంటి మె ంటే బాగా పని కొ సతుంది .	0.5975
चलो , अचछी बात है . इस बार वा इन सिर फ ब ॉ बी से , हाँ ?	సరే మంచిది . ఈ సారి వెన కే వల ం బా బీ వ దద ను ంచే , సరేనా ?	0.6194
नहीं , मतलब . . . मैं उन का अचछा नहीं चाहती .	చెపప ాల ౦ ట ే . . . నేను ఆ యన గురించి మంచి కో ర ను .	0.5815
ये ही रे तुमहारे लिए हैं . उ ता र ना मत . ठीक है ?	ఈ వ జర ాలు నీ కోసం . వాటి ని తీ సె యయ కు . సరేనా ?	0.6597
तुमहें नहीं पता यह करना कि तना मु श कि ल था .	ఇది తే ల చ డానికి ఎంత కష ట మ య యి ందో నీకు తె లీ దు .	0.5637
मी रा का जन म दिन है ना ?	మీ రా పు టటి న రోజు కదా .	0.5547
और मैं वो कर सकता हूँ जो मैं चाहता हूँ .	నాకు కా వల సిన ది చె యయ డానికి వీ ల వు తుంది .	0.5136
एक उ ल टे हाथ का द ूँगी मेरे पास आया तो .	నా దగగర గా కనిపి ంచా వ ంటే చె ం ప వా య గొ డ తాను .	0.5817
कौन करता है ये सब ?	ఎవరు చేసతా రు అవ న నీ ?	0.5355
- कया ? - मुझे . . .	- ఏంటి ? - నేను . . .	0.7212
वह मुझे ह ँ सा ता है .	తను ననను న వ వి సతా డు .	0.5321
पा गल हो गई हो कया ?	నీకు పి చచి ప టటి ందా ?	0.4254
कर न , तुमने पि छ ले साल भी यही कहा था .	క రణ , నువవు గ త ఏ డా ది కూడా ఇ దే చెపపా వు .	0.6424
ता रा , पलीज . मैं अ के ले ये नहीं कर सकता . गा य तरी की बे टी मुझसे न फ रत करती है .	తా రా , ప లీ జ . నే న ొ కకడి నే చె యయ లేను . గా యత రి కూ తు రు ననను అస హ యి ంచు కు ంటుంది .	0.7055
पूरी जिंदगी इस ी ग टर में बि ता ए गी .	తన జీవి త మ ంతా ఈ చెతత లో నే బర త క ాలి .	0.5329
पलीज उसे मत बता ना .	ప లీ జ తన కి చెపప కు .	0.5170
वाह .	వా వ .	0.3262
चलो अचछा है , दोनों य हीं हो .	మంచిది , ఇ దద రూ ఇకకడ ే ఉననా రు .	0.5611
अचछा , वहाँ तो बहुत ठ ंड होगी ना ?	సరే , అకకడ చాలా చ లి గా ఉంటుంది కదా ?	0.5225
र ं जन : ओ ए न जी सी में अ का उ ंट ें ट हूँ .	ఓ . ఎ న . జి . సి . లో ఎ క ౌ ంట ె ంటు ని .	0.6189
नहीं . बस काम और बाहर आ ना - जाना , हमें कभी - कभी व कत नहीं मिल पा ता .	లేదు . పని ఇంకా పర యా ణ ాలు కొనని సా రలు మా వి ండ ో ని మి స స వు తుననా ం .	0.6042
अभी के लिए इसे वो दे सकते हैं .	పర సతు తా నికి అది తన కి ఇవ వచచు .	0.5686
" काम सू तर " टा इ म टे ब ल का आ खि री दिन है .	. . . కా మ సూ తర టె ం ట ే బు లలో ఆ ఖ రి రో జ ని .	0.7101
- मैं और कि से . . . मैं कया . . . - जै ज को ले जाओ .	- నేను ఏం - నేను ఏం చె యయ ాలి , - జా జ ని తీసు కె ళళు .	0.6265
कया ये गल त है ?	అది త పపు కదా ?	0.5517
हाँ , पर मैं कल नहीं जा सकती .	సరే కానీ నేను రే పు రాల ే ను .	0.4922
कल मिल ती हूँ .	నేను కలు సతాను .	0.3948
चे ह रे का र ंग ही बद ल जा ता था . एक द म गो री .	మొ హ ాలు మె రు సత ూ ఉంటా యి . బాగా తె లల గా అవు తా ం .	0.6397
आप जो भी चा हें . हम दु ल ह न की से वा में हा जि र हैं .	మీకు ఏం కా వాల ననా మేము పె ళళ ి కూ తు రు సే వ లో ఉననా ం .	0.6627
- न जर ना ल गे . - ब ब ल स : हाँ . सच में , है ना ?	- దేవు డి దయ . - నాకు తెలుసు . అవును కదా ?	0.5472
तुम मेरी छ ु प ने की जगह हो .	నువవు నా ర హ సయ పర దే శా ని వి	0.5960
अगर वह तुमहारी माँ होती ं तो तुम . . .	ఆ వి డ మీ అమమ అయితే , మీరు కూడా ఇలా గే . . .	0.5886
तुमहारे 2 1 व ें जन म दिन पर , चि ड िया घर में पार टी हुई थी .	నువవు జ ూ పా ర టీ చేసు కుననా వు . నీ 2 1 వ పు టటి న రోజు కి	0.6594
देखा बं गा लि यों को मन मर जी करने दो , तो कया होता है ?	బె ంగ ాల ీ లని వాళల పని ము ట ల కి వది లే సతే ఏ మ వు తు ందో చూడు .	0.6062
आ गई हमारी प ं जा बी पे सट री .	ఇది గో మన పం జా బీ పే సట రీ .	0.5838
मुझसे शादी करना चाहते हो ?	ననను పె ళళ ి చేసు కుంటా వా ?	0.5307
कुछ भी करो . तुम घर बे च दो . तुम ए फ . डी . तो ड दो !	కా వాల ంటే ఏద ెనా చె య యి . ఇ ల లు అమ మె య , డి పా జి టలు తీ సె య .	0.6226
तो मेरी रख ै ल की तरह पे श आ ना बंद करो . यहाँ आओ .	అయితే నా తో ఉ ం పు డు గ త తె లా పర వర తి ంచడం మా నె య . ఇలా రా .	0.6407
मै ड म , मैं कुछ करने की कोशिश नहीं कर रहा . मैं . . .	మే డ మ , నేను ఏమి చె యయ డానికి చూడ ట లేదు , నేను . . .	0.6584
आप की माँ बहुत दु ख ी हैं कि आप लोग उनकी शादी में नहीं आ एँ गे .	సరే కానీ మీ అమమ గా రు చాలా బా ధ పడు తుననా రు మీరు పె ళళ ి కి రా వ ట లే దని .	0.6286
1 2 , 1 3 , 1 4 , 1 5 . . .	1 2 , 1 3 , 1 4 , 1 5 . . .	1.0000
मु श कि ल था . मैं अ के ली थी .	ఒ ంట రి గా అది చాలా కష టం .	0.5721
हाँ , पर हम तो हर छ ह म ही ने बाद भे ज ते हैं ना ?	సరే . . . కానీ మనం పర తీ 6 నె లల కీ పం పు తా ం , అవు నా ?	0.6297
हम तो बस आपको बता रहे हैं कि आप की म म मी कै सा मह सू स . . .	మేము మీకు కే వల ం చెబు తుననా ం మీ మమ మీ ఎలా ఫీ ల వు తుననా రో	0.6123
तो तुम काफी व कत से कोशिश कर रही हो ?	అంటే కొ ంత కాల ంగా పర యత ని సతుననా రా ?	0.5461
तुम मेरे इ ंदर धन ु ष हो .	నువవు నా ఇ ంద ర ధ ను స సు వి .	0.5317
अचछा . बैठ ो .	సరే కూ రచ ో .	0.4535
तुम इसे बहुत खुश रख ना .	ఆమె ని జా గర త గా చూ స కో .	0.5292
और जब हम अपने आ स - पास के दिखा वे से हो कर गु जर ते हैं ,	మన చు టట ూ ఆ వ రి ంచు కు ని ఉనన ఆ డం బ రా నని న డి పి సతు నన పపుడు . . .	0.6418
पर लोगों को समझ में नहीं आए गा ना ? उनहें ल गे गा हम ख र च नहीं कर रहे .	కానీ జ నా ల కి అ ర ధ ం కాదు , కదా ? మేము డబబు ఖ రచ ు పెటట ట లే ద ను కుంటా రు .	0.6506
मैं फ री हो के फोन करती हूँ ? ठीक है ?	నేను ఫ రీ అయ యి ఫోన చే సతాను . సరేనా ?	0.5636
पता है मैं सिर फ एक बार ना , सिर फ वो करना चाहता हूँ जो हमा रा काम है .	ఒకటి చెపప నా . . . ఒక కో సారి మన పని మనం చే స కు ంటే నే బాగు ంటు ందని పి సతుంది .	0.5751
अब , बं गा ली से शादी करो गे तो यही होगा .	బె ంగ ాల ీ ని పె ళళ ి చేసు కు ంటే ఇ దే అవు తుంది .	0.5745
ये कोई ठ ो स उ पा य नहीं है . तुमहें . . . तुमहें कुछ तो सोच ना होगा .	ఇది పర మన ె ంట పరి ష కా రం కాదు . మీరు దీ నని ఎలా గో లా పరి ష కరి ంచాలి .	0.6356
तुम ता रा से झ ू ठ बोल रही हो .	నువవు తా ర కి అబ దధ ం చెబు తుననా వు .	0.5904
तुमहें जाना चाहिए .	నువవు ఇక వెళ ి పో వచచు .	0.4297
तुम कर कया रहे हो ?	నువవు ఏం చేసతుననా వు ?	0.4586
शादी तो मैं र ं जन से ही कर ूँगी .	నేను రం జ న నే పె ళ లి చేసు కుంటా ను .	0.5798
बहुत ही ख ू बस ू रत है !	చాలా అంద ంగా ఉంది .	0.3890
नहीं , पर देख ूँगा .	లేదు , కానీ చూ సతాను .	0.4963
अचछा , शुकरिया . ओ ह , कॉ क टे ल !	ఓ కే , థా ంక యు . కా క టె యి ల స .	0.6440
अरे , हमारी जिंदगी भर की क मा ई है वो . कया करेंगे हम ?	మనం జీవి తా ంత ం ఆ దా చేసిన డబబు అది , మేము ఏం చె యయ ాలి ఇ పు డు ?	0.6207
फै जा मा सी .	ఫ ె జా ఆ ంట ీ .	0.3864
लेकिन मेरा बे टा जे ल नहीं जाएगा !	నా కొ డు కు జె లు కి వెళల కుండా చూడు .	0.5529
मुझे पता है आपको स द मा लगा होगा , पर वे बहुत खुश हैं .	మీకు ఆ శ చ ర యం గా ఉ ందే మో కానీ వాళళు చాలా సంతో ష ంగా ఉననా రు .	0.6156
आप का ख या ल र खा . आप की जरूरत ों को पू रा किया .	మీ య ొ కక ఆ ల నా - ప ాల నా చూ సు కుననా రు , మీ క న నీ ఇ చచా రు .	0.6116
नहीं . देखो , बात बो न स की नहीं है .	కాదు . చూడ ండి ఇది బో నస గురించి కాదు .	0.5483
अचछा , समझ गया . तो , थो डी और शान ो - श ौ कत हो नी चाहिए .	సరే అ ర ధ మె ంది . అంటే , ఇది ఇంకా కొ ంచ ం గ రా ండ గా ఉండ ాలి .	0.5813
ये कया ड रा मा है ? चा कू छोड ो .	ఏ ంట ీ నా ట కం ? క త తి పడ ె య యి .	0.6018
शि बा नी : अचछा , का टो . अचछा .	సరే బాగు ంది ఇక క ట చే సె యి .	0.4587
हाँ , वे इसे पा य ल की तरह पह न ेंगे तो अचछ े लग ेंगे .	అవును , అతని క ాలి కి ఈ న గ లు చూడ టా నికి బాగు ౦ టు ంద ను కుంటా .	0.5942
ब ब ल स : कैसे हो ? गो वि ंद : मैं ठीक हूँ .	- ఎలా ఉననా వు ? - నేను బాగు ననా ను .	0.5118
ये बहुत सु ंदर है !	నాకు చాలా న చచి ంది .	0.4993
कोई परे शा नी है ?	ఏ మెనా పరా బ ల మా ?	0.4990
कुछ तो कर सकते हैं ना ?	మన మే ఏదో ఒకటి ఆలోచి ంచాలి .	0.4858
साथ में कि रा या , गा डी , जिंदगी . . .	దా ంతో అ దద ె ఒక కార ఇక లె ఫ . . .	0.5188
उनके कष े तर में उनकी बडी इ जज त है . वह न यू ए रा सक ूल ों की सं स था पक हैं .	తన ఫీ ల డు లో ఆమె ని ఎ ంతో గ ౌ ర వి సతా రు . ఆమె న యూ ఎ రా స కూ ల స ని సథ ా పి ంచి ంది .	0.7037
वह चा हें तो अ के ले में उससे मिल सकती हैं , है ना ?	తను కా వాల ంటే అత నని వి డి గా కలు సత ూ ఉండ వచచు , కదా ?	0.6332
शुकरिया .	థా ంక యు .	0.3723
मुझे वि श वास नहीं हो रहा .	నేను న మమ లే కపో తుననాను .	0.5552
अरे ! गो वि ंद . यही नाम है ना ?	ఓహ , హేయ . గో వి ంద . పేరు అదే క ద ూ ?	0.6034
हाँ . मैं मि स पि गी ब नी थी . और बहुत मजा आया था !	అవును . నేను మి స పి గ గ ీ ని . అది గొ పప గా ఉ ండి ంది .	0.5932
कया ? उनहें पा ँच ह फ त ों में शादी चाहिए . पक का कर देना चाहिए ना ?	ఏంటి ? వాళల కి పె ళళ ి 5 వా రాల లో జ రగ ాలి . క న ఫ ర మ చె యయ ాలి , కదా ?	0.6092
- सा ला " इ ंदर धन ु ष " का कया मतलब है ? - कया ?	- " ఇ ంద ర ధ ను స సు " అంటే అస లు నువ వ నే దే ంటి ? - ఏంటి ?	0.6311
अचछा , दो स तो . गा य तरी मा थ ु र के बच च ों की कोई ख बर ?	సరే , గె స . గా యత రి మా థ ు ర పిలల ల గురించి ఏ మెనా తెలి సి ందా ?	0.6202
किसी कर िया कर म में जि तने जयादा लोग बि न बु ला ए आ एँ , वह उ तना अचछा होता है .	ఏ అంత య కరి య స ఫ ల తె నా అ కకడికి వచచి న అ పరి చి తు ల సం ఖ య ని బ టట ీ ఉ ంటు ందని .	0.6786
फिर चे ह रे पे लगा दे ती थी , जब सू ख जा ता था , ऐसे घ स - घ स के निका ल ती थी .	. . . దానని మొ హ ాల కి రా సే ది , అది ఆ రి పోయి న తర వాత , బాగా రు ద ది క డి గే ది .	0.6702
अचछी बात है ! तो , श ै ं पे न होगी . और ब ॉर ड ू की रे ड वा इन .	బాగు ౦ ది . . . ఇంకా ష ా ం పే న మరి యు బో ర డ ో రె డ వె నస .	0.7293
बिलकुल कर ूँगा . तुमहारी शादी जो है .	అ ఫ కో ర స నేను చే సతాను . ఇది నీ పె ళళ ి .	0.5363
कया ? हमें अभी - अभी तो बडी - बडी शा दिया ँ मिल ने ल गी हैं !	ఏంటి ? మన కి ఇ పపుడ ే పెదద పెదద పె ళళ ి ళళు రా వడం మొద ల య యా యి .	0.6044
देखो , हमें ये आ ली शान का स टा इ ल पसंद है .	చూడు , మాకు ఇది హు ందా సట ె ల న చచి ంది .	0.6220
उससे मिल कर देखो , है रा न रह जाओ गे .	అత నని కలి సే దా కా ఆ గు , మీరు ష ా క వు తా వు .	0.6112
बहुत पया री हो , हाँ .	నువవు చాలా మంచి దాని వి .	0.4424
तुम लोग वे डि ंग प ला नर हो , अपना काम करो .	మీరు పె ళళ ి ప లా న ర స వారు మీ పని మీరు చూ స కో ండి .	0.5919
मतलब . . . पर कम से कम श रा ब मैं म ंग वा सकता हूँ ?	అంటే . . . క నీ సం నేను లి కక రె నా ఆ ర డ ర చె యయ చచా ?	0.6893
हाँ , और कर न घ ो डा बन कर आया था .	అవును క రణ గుర రం లా వచచా డు .	0.5603
और कुछ नहीं है अपनी जिंदगी बना ने के लिए .	ఇం కే ం లే వు జీవి తా నని సరి ది దదు కో డానికి .	0.5608
माफ की जिए , पर आज का दिन बहुत ही शु भ है ,	అ యా ం సో సా రీ , కానీ ఇ వాళ చాలా మంచి రోజు ,	0.5956
अचछा हुआ जो तुम भी आ गए .	మా దగగర కి రా వడం బాగు ంది .	0.5078
अचछा . शुकरिया .	ఓ కే . థా ంక యూ .	0.4458
हम सु बह ठीक 7 : 00 ब जे निकल ेंगे , हम म ?	మనం సరి గ గా పొ దదు నన 7 కి బయ లు దే ర ాలి , సరేనా ?	0.6119
ऐसा प ल ज हाँ जिंदगी एक द म सही होती है और जिस में एक जा दू होता है .	ఒకక కష ణం ఎకకడ జీవి తం సరి గ గా ఉ ండి అకకడ మ యా జి క ఉంటుంది .	0.6150
आप ने आपके जन म दिन पे सू अ र का ड रे स पह ना था ?	మీరు మీ బర త డే కి పి గ డ రె స వే స కుననా రా ?	0.6652
ख ू बस ू रत ? ये सब ग ंद गी , ट ू टा - फ ू टा तुम को सु ंदर लगता है ?	అంద మా ? ఈ చెతత ంతా నీకు అంద ంగా ఎలా అనిపి సతోంది ?	0.5508
अचछा , अचछा . अ . . .	సరే , సరే మంచిది .	0.3906
मेरी जो भी जरूरत थी , वो उनकी जरूरत ों के साम ने फी की न जर आ ती .	ఏద ెనా నాకు అవ సరం ఉననా వాళల అవ సరం ముందు తే లి పో యే ది .	0.6021
मैं सु बह तुमहें ले ने आ ऊँ गा . अचछा , बा य .	నేను నినను పొ దదు నన పి క ప చేసు కుంటా ను . సరే , బె .	0.6156
तुम मेरे उस छो टे से चु रा ए हुए प ल जै सी हो .	నువవు నా చినన దొ ం గి లి ంచిన కష ణం లా ంటి దాని వి .	0.6078
नहीं , जै ज .	వదదు జా జ .	0.4550
