पुलिस !	పోలీ స !
तो जो भी सु रा ग सि ल कॉ कस को ए डा ले इ ड या ए र ॉल से जो ड ता है , कोई भी सु रा ग . . .	కాబటటి , అ డి లె డ తో లేదా ఎ ర ర ొ ల తో సి ల కా కస కి లి ంక ఉండే ది ఏం దొ రికి నా కానీ . . .
यह गो प नी य रि पो र ट है	ఇది గో ప య మెన రి పో ర ట
हाँ , मुझे याद है .	హా , నాకు గుర తుంది .
- किस ने ? - है गर टी .	- ఎవరు ? - హె గర టీ .
ऐसा कुछ नहीं मि ला .	నాకు తెలి సి లేదు .
उसके अ ला वा , तुम पूछ ता छ कर सकती हो .	అద ొ కక టి గుర తు పె టటు కొ ని ఇ ంట ర వయ ూ చేయ .
- माफ करना . . . - यह सब जानते हैं .	- సా రీ . . . - అది అంద రికీ తెలి సి ందే .
" क ला इ व सि ल कॉ कस . "	" క లె వ సి ల కా కస . "
उससे कह ना मेरी तरफ से उससे कह ना ,	కానీ మీరు అతనికి నా మాట గా చెపప ండి ,
कयोंकि मुझे पता था तुम कया कह ते .	నువ వే ం చె ప తా వ ో నాకు తెలుసు కాబటటి .
हाँ ? तो , अ ग . . . वि व , कया तुमने वह डी ए स ल ें कर के साथ सा झ ा की थी ?	హా ? అలా ంట పపుడు . . . వి వ , నువ వే మెనా డి టె క టి వ సా ర జె ంట లె ం కర కి పం పా వా ?
हम श रा ब पी ने में काफी मा ह िर हैं .	దీ నని నీ ళ లు తా గి న టటు తా గు తా ం మేము .
आ पा त का ली न हैं ड ल र को हे ज ले न क ॉल र के रू प में अपना परि च य दिया था .	అత య వ సర కాల స ఆ పరే ట రు కు , హ య ీ స లే న నుండి కాల చేసి ంది త నే అని చెపపి ంది .
किसी ने अभी - अभी मुझे शान दार बो ला .	ఒక రు ననను ర ౌ డీ రా ణ ీ అని అ ననా రే .
इस की सं भा व ना है कि सि ल कॉ कस के पास	అ డి లె డ హ త య కు సం బం ధి ంచిన సమా చా రం
हे ज ले न 9 9 9 क ॉल	హ య ీ స లే న 9 9 9 కాల
शायद कह ते हैं . शायद . पता नहीं .	ఏ మో . కా వచచు . నాకు సరి గ గా తె లీ దు .
ए र ॉल मै थ ि स . तुम एक साथ स ें ट जो से फ स में प ढ ते थे ?	ఎ ర ర ొ ల మ యా థ ి స . మీ రి దద రూ ఒక ే పా ఠ శ ాల లో చ ది వా రా ?
ठीक है , डि टे क टि व ले . . . कया मैं तुमहें जू न बु ला सकता हूँ ?	సరే , డి టె క టి వ లె ం . . . జ ూ న అని పి లి సతే నీ కే ం అ భ య ంత రం లేదు కదా ?
मैं वहाँ सबसे पहले पहु ँ ची थी .	నే నే కదా అ కకడికి మొద ట వెళలి ంది .
यहाँ जरू री बात यह है कि . . .	ఇకకడ ముఖ య మెన విషయం ఏ ంట ంటే . . .
पर पता है कया ?	ఓ విషయం చెపప నా ?
हाँ , हमने पहले बात की थी . पहले बात की थी . कहाँ नहीं बताया . कब नहीं बताया .	హా , గ తం లో మాటలాడు కుననా మని చెపపి ంద ంత ే . ఎ పపుడు , ఎకకడ అని చెపప లేదు కదా .
- है गर टी . ब ला - ब ला - ब ला . - तुमने कहा कि यह याद ृ चछ ि क जा ँच था .	- హె గర టీ . అబ బా . - అది ర యా ండ మ ఆ డి ట అని ఇ పపుడ ే గా అ ననా వు !
आ ठ बार ? जू न . तुमने मुझे बताया कयों नहीं ?	ఎ ని మి దా ? జ ూ న . ఈ విషయం నాకు ఎందుకు చెపప లేదు ?
अ परा ध के स फा इ ल	క రె మ కే సు ఫ ె ల
हे भगवान , तुम कर रहे हो . मुझे देख ने दो .	బా బో య , నువవు పో సట చేసతుననా వు . ఇలా చూ పి ంచు .
क ला इ व सि ल कॉ कस .	క లె వ సి ల కా కస .
ठीक है , देखो .	సరే , ఇలా చూడు .
वह काफी , काफी शि कष ा पर द था .	అంతా చాలా చాలా వి వర ంగా ఉంది .
जी रो य ै ं की डे ल टा . मैं डी ए स जू न ल ें कर बोल रही हूँ .	జీ రో యా ం కీ డె ల టా . నేను డి టె క టి వ సా ర జె ంట జ ూ న లె ం కర ని .
मार - पि टा ई के कुछ मा म ले , घ रे लू हि ं सा ,	దా డి చేశా డ ని కొనని ఫి ర యా దు లు , గ ృ హ హి ం స ,
नहीं , मैंने उसे लग भ ग पक ड ही लिया था .	లేదు , ఇంకా సత ఉ ంటే అత డి ని ప టటు కొ నే దా న నే .
आप समय बर बाद कर रहे हैं .	మీరు సమయం వ ృ థా చేసతుననా రు .
मैं ठीक हूँ .	నా కే ం కాల ేదు .
- मैं कया मदद कर सकती हूँ ? - वह बेहद ख ू बस ू रत दि खे गी .	- ఏం కా వాల ో చెపప ండి . - తన కి ఆ డ రె స చాలా బాగు ంది .
तो मैं आप से उन आ रो प ों के सं बं ध में उससे पूछ ता छ करने की अन ुम ति चा हूँ गी .	తను చేసిన ఆ రో ప ణ ల విష య మె , అత డి ని నేను వి చా రి ంచ డానికి మీ అను మ తి ని కో రు తుననాను .
सर , मैं दोनों आ पा त का ली न क ॉल की जा ँच करने के लिए फ ॉर ें सि क आ वा ज वि श ले ष ण का अनु रो ध करना चा हूँ गी .	సర , ఈ రెండు అత య వ సర కాల స లో మాటలా డి ంది ఒక రే నా కా దా అని తెలుసు కో వ డానికి ఫ ొ రె న సి క పర ీ కష కి అను మ తి ఇవ వ ండి .
पर मैं इस आदमी का पता लगा ने की कोशिश कर रही हूँ . क ला इ व सि ल कॉ कस .	ఈ క లె వ సి ల కా కస అ నే వయకతి జా డ ని కని పెటట ే పని లో ఉననా ను నేను .
मैं बस उससे पूछ ता छ करना चाहती हूँ .	నేను అతని తో మాటలాడ ాలను కుంటుననా , అంతే .
काफी समय पहले उसकी एक गर ल फर ें ड थी .	అతనికి చాలా కాల ం కరి తం ఒక ల వర ఉండే ది .
धनयवाद , सर .	థ యా ంక యూ , సర .
- और इस की अचछी सं भा व ना है कि . . . - तुम वही देख ती हो जो देख ना चाहती हो .	- ఇం కో విషయం ఏ ంట ంటే . . . - మన కే ం కా వాల ో అదే మన క ళ ల కి కనిపి సతుంది .
यहाँ अभी लग भ ग 8 0 , 00 0 , 9 0 , 00 0 पु रत गा ली बोल ने वाले लोग हैं .	పర సతు తం , ఆ పరా ంత ంలో వాళలు ఎ న భ ె , త ొ ం భ ె వే ల మంది ఉంటా రు .
मार च 2 0 1 1 में , तुम 2 4 बी ले क सट री ट में रह रहे थे . है न ?	మార చి 2 0 1 1 లో , మీరు 2 4 బీ లే క సట రీ ట లో ఉండే వారు . అది నిజ మే నా ?
तुमहारी हे ज ले न क ॉल र म रि या डी सू जा नहीं थी .	హ య ీ స లే న నుండి కాల చేసి ంది , మరి యా డి స ౌ జా కాదు .
- ठीक है . - बता ओ . इसका नाम बता ओ .	- అబ బా . - చెపప ండి . తన పేరు చెపప ండి .
वह एक जा ल था और मैं सी ध े फ ँ स गई .	ఉ చచు ప ననా డు , నేను చ కక గా ఇ రు కుననాను .
पर मैंने क ॉल रि क ॉर डि ंग सु नी और जो तुमने कहा था , समझ ी ?	నేను మీ కాల సం భా ష ణ వి ననా ను , నువవు ఆమె కి కొనని చెపపా వు కదా ?
- सब ठीक होगा . - मैं बस नहीं चाहती कि लोग मुझे घ ू र ें .	- నీకు ఏమీ కాదు . - జ నా లు నన నే చూ సత ూ ఉ ంటే ఇ బబ ంది గా ఉంటుంది .
मैं मि स डी सू जा की च ो ट ों की बात कर रहा था .	నేను మి స డి స ౌ జా గా య ాల గురించి మాటలాడు తుననాను .
नहीं . इस पर जो र डा ल ने के लिए माफ ी चा हूँ गा ,	కాదు , మ ళ లీ దాని గురి ంచే మాటలాడు తు నన ందుకు సా రీ ,
उसने मुझे बे व कू फ बना या .	అతను ననను ఆ డు కుననా డు .
दर अस ल , मैं थो डी मु सी ब त में हूँ .	నిజ ా నికి , కా సత సమ సయ లో ఉననా ను నేను .
रू डि न के यहाँ नौ करी करता था . डि ली व री करता था .	రూ డి నస లో పని చేసే వాడు . డె లి వర ీ చేసే వాడు .
- हाँ . - परे शान करने के लिए माफ ी चा हूँ गी .	- అవును . - మి మమ లని ఇ బబ ంది పె డు తు నన ందుకు సా రీ .
मैं सि ल कॉ कस से पूछ ता छ करने की अन ुम ति चा हूँ गी .	సి ల కా కస తో మాటలాడ టా నికి మీ అను మ తి కావాలి .
पक का तुमहें पता होगा कि यह नि य म ों का उ ल ल ं घ न है . . .	మీకు తెలి సే ఉంటుంది , ఇది ఉ లల ం ఘ న కు ప ాల పడ ట మే అవు తుంది . . .
- हाँ . हैलो . - तुम क ला इ व सि ल कॉ कस के बारे में पूछ रही थी ?	- హా . హాయ . - మీరు క లె వ సి ల కా కస గురించి అ డి గా రు కదా ?
- क ॉल में उसने बिलकुल यही कहा था . - मैं क ॉल की बात नहीं कर रहा हूँ .	- ఇ వి కాల లో తను అ నన మాట లే . - నేను కాల గురించి మాటలాడ టం లేదు .
- तुम ठीक हो ? - हाँ .	- బాగా నే ఉననా వా ? - హా .
सं पर क कर ें	సం పర ది ంచండి
सुनो . काफी समय पहले उसकी एक गर ल फर ें ड थी .	చూడ ండి అతనికి చాలా కాల ం కరి తం ఒక ల వర ఉండే ది .
ल टी शा , हमें कुछ दे र के लिए अ के ला छोड ो गी ?	ల టీ ష ా , ఒకక ని మి ష ం మాకు ఏ కా ంత ం ఇవ వ వా , బ ంగా రం ?
ठीक है . तो फिर हम बस से च ले जाएँ ?	సరే . అయితే మేము బ స సు లో వెళల మా ?
पर मुझे यह जरूर पता है कि मैं किसी बे चा री ए ए ंड ई नर स पर नहीं चि ल ला ऊँ गी	ఆ సు ప త రి లో పా పం న ర సు గా పని చేసే మ హి ళ మీద నేను అలా అ ర వ ను అని మా త రం నాకు తెలుసు ,
मैं फ लै ट 9 4 2 की ओ र जा रही हूँ , सं दि ग ध अभी पक डा नहीं गया है .	నేను ఫ లా ట నం బ రు 9 4 2 లో కి వెళ తుననాను , అను మా ని తు డు ఇంకా కనిపి ంచ లేదు .
और उसने कहा था , " उसने उसे घ ों पा था , " या नी ए डा ले इ ड को ,	ఇంకా అ డి లె డ పర సతా వ న తె సత ూ , " ననను పొ డి చి న క త తి తో నే
एक घ ट ना घ टी है . माफ करना . बस मुझे फोन करना .	ఒక కొతత విషయం తెలి సింది . సా రీ . కాల చేయ .
माफ करना , माफ करना . माफ करना .	సా రీ , ప కక కు జ రగ ండి . దా రి ఇవ వ ండి .
मुझे दि ख रहा है कि तुम ना राज हो .	నువవు ని రా శ గా ఉననా వ ని తెలుసు .
तो या तुम मुझे अभी बता ओ गी कि मेरे क ला इं ट का क ला इ व सि ल कॉ कस से कया सं बं ध है ,	కాబటటి క లె వ సి ల కా కస కి , నా కల యి ంట కి సం బం ధ ం ఏ ంట ో నాకు మీరు చెపప ాలి .
आप ने मुझे और जान का री हा सि ल करने को कहा था .	ననను దాని సం గ తే ంట ో చూడ మని మీ రే అ ననా రు .
स ें ट जो से फ स अ कै ड मी .	సె యి ంట జో సె ఫ స అ కా డ మీ .
और इसका कया ? म रि या ?	మరి ఈ మరి యా సం గ తే ంటి ?
हमारी हि रा सत में वह आदमी है जो इस की ह त या कब ूल कर चु का है .	త నని హ త య చేశా నని అ దు పు లో ఉనన ఒక డు ఒ పపు కో వ డానికి సి దధ ంగా ఉననా డు .
कै दी बाहर आ रहा है .	ఖ ె దీ బయట కు వ సతుననా డు .
वह कभी उसे खुश नहीं रख ती थी .	అత డి ని ఎపపుడూ సంతో ష ంగా ఉ ంచ లేదు .
मुझे बता ओ , जू न , कया तुम " अ चे त न प कष पा त " श बद से परि चि त हो ?	ఒక విషయం చెపపు , " అ సం కల పి త ప కష పా తం " అ నే మాట ని ఎపపుడ ెనా వి ననా వా ?
वह कभी उसे खुश नहीं रख ती थी .	అత డి ని ఎపపుడూ సంతో ష ంగా ఉ ంచ లేదు .
कया इस ी से तुमहें मुझ पर गर व होता है ?	ఇలా జరిగి తే కానీ నువవు ననను చూ సి గర వ పడ వా ?
मुझे बताया गया कि तुमने उसे मर ते देखा था .	తను నీ క ళ ల ము ందే చని పోయి ందని వి ననా ను .
तुमहारे पास कार ड है , मि स डी ए स . . . कया नाम है ?	ఐ డీ కార డ ఉ ందా , మి స డి టె క టి వ సా ర జ ంట . . . మీ పే రే ంటి ?
कि म मो बा इ ल	కి మ మొ బె ల
तुमहें ग ं भी र च ो ट ें ल गी हैं .	నీకు గా యం పెదద దే త గి లి న టటు ందే .
तो , हम चा हें गे कि तुम गा डि यों के न ं बर ों से सं बं धि त	కాబటటి , మీరు ఈ ఒకక ొ కక బ ండి నం బ రు ను పరి శ ీ లి ంచి
वह अ के ले ओ कम ू र में हुई च ो रि यों की जा ँच कर रहा है . है न , जि म ?	ఓ క మూ ర దొ ంగ త నా ల కే సు విషయం లో చచ చి పో తుననా డు . అవును కదా ?
कि तनी बडी मदद चाहिए ?	ఎంత పెదద సా య మే ంటి ?
ठीक है , तो सम स या को य हीं खतम करो . अपने ब ॉ स से बात करो .	అయితే , అది పె రగ క ము ందే పరి ష కరి ంచే సు కో . నీ మే నే జ రు తో మాటలాడు .
- हैलो ? - हैलो , जू न .	- హ లో ? - హాయ , జ ూ న .
मुझे बता ओ , जू न , कया तुमने पै थ रि पो र ट देख ी है ?	ఒక విషయం చెపపు , జ ూ న , నువవు ప యా థ ాల జీ రి పో ర ట చూశా వా ?
आपको सं दि ग ध से पूछ ता छ करने की अन ुम ति है .	అను మా ని తు డి ని నువవు ఇ ంట ర వయ ూ చేయ వచచు .
मैं वह म हि ला हूँ जिस से तुमने हा उन स लो में भर ती स पता हा ंत में अचछा बर ता व किया था . "	హ ౌ న స లో లో ఒక ని యా మ క వా రా ంత ం నా డు మీరు ఒక మ హి ళ ని పర ో త స హి ంచా రు కదా , అది నే నే , " అని చెపప నా ?
ले क सट री ट में . मो ड के पास .	లే క సట రీ ట . అది దగగర లో నే ఉంది .
स पो र ट टी म का इं त जार करो , ओ वर .	బ ృ ంద ం వచ చే దా కా ఆ గ ండి , ఓ వర .
. . . यह पु ष टि करने के लिए कि दोनों क ॉल एक ही म हि ला ने की थी या नहीं ?	. . . రెండు కాల స లో న ూ మాటలా డి ంది ఒక ే మ హి ళ నా , కా దా అని అ పపుడ ే మన కి తెలు సతుంది .
आप समय और सं सा धन बर बाद कर रहे हैं .	మీరు సమ యా నని , వ న రు లని వ ృ థా చేసతుననా రు .
आपके बे टे का कया ?	మీ కొ డు కు సం గ తే ంటి ?
हाँ . क ला इ व सि ल कॉ कस .	హా . క లె వ సి ల కా కస .
पर ड ो रि स ने कहा कि वह उसके परिवार को जान ती थी . थोडा - बहुत .	కానీ డ ో రి స కి వాళల కుటుం బం గురించి ఒక ర క ంగా తెలుసు .
यहाँ , यहाँ , यहाँ !	నాకు పా జ చేయ ! నాకు !
हे ज ले न क ॉल र ने भी बताया था कि उसके पार ट नर ने उसे चा कू से घ ों पा था .	హ య ీ స లే న నుండి కాల చేసిన వయకతి కూడా , తన ల వర త నని క త తి తో పొ డి చా డ ని చెపపి ంది .
तुमने अपनी पूरी कोशिश की .	నీ వం తు పర యత నం నువవు చేశా వు .
नहीं . म रि या डी सू जा , उसने क ॉल हैं ड ल र से कहा था , " हमने पहले बात की थी . . . "	అలా అని కాదు , మరి యా డి స ౌ జా , తను ఆ పరే ట రు తో చెపపి ంది , " మనం గ తం లో మాటలాడు కుననా ం . . . "
मु ख र होना कोई अ परा ध नहीं है .	న ొ క కి చెపప డం తపప ే మీ కా దే .
तुम इस के परिवार को जानते थे ?	అతని కుటుం బం మీకు తెలుసా ?
जिस से जू न मुझ पर इ ल जा म लगा स के या जा ँच में रु का व ट डा ल स के ,	నా మీద కి కానీ , నా వి చా రణ మీద కి కానీ జ ూ న వచ చే లా చేసే ది ఏద ెనా కానీ ,
उसे पता है न कि मैं भी मी टि ंग में र हूँ गी ?	నేను కూడా సమా వే శం లో ఉంటా నని అతనికి తెలుసు కదా ?
दो क ॉल र . चा कू से हुई मे ल खा ती हुई ं च ो ट ें .	ఇ దద రు కాల రలు . ఇ దద రూ క త తి పో ట లకు కూడా గుర య యా రు .
हाँ , पर मैं सु सत दि मा ग वा लों को समझ ा रहा हूँ . बु रा मत मान ना , रॉ य .	ఈ విష యా నని కా సత తెలి వి త కకువ వా రికి చె ప తుననాను అను కో . త పపు గా అను కో కు , రా య .
रो कि ए घ रे लू उ त पी ड न	గ ృ హ హి ం స ను ఆ ప ండి
इस की काफी कम सं भा व ना है ,	ఇకకడ అవ కా శం త కకు వే ఉ ంద ను కో ,
वे स मान आ कार की हैं . दोनों ला ति नी अ म री की हैं .	ఇ దద రి ఆ కా రం ఒక ే లా ఉంది . ఇ దద రూ హి స పా ని కే .
तुम मदद के लिए साम ने आई .	నువవు తన కి ధ ె ర యా నని ఇ చచా వు .
अगर मैंने किसी नर स के साथ बु रा बर ता व किया हो तो , पर मेरी दि मा गी हा ल त ठीक नहीं थी .	నేను ఒక న ర సు తో క టు వు గా మాటలా డి న ందుకు . కానీ అ పపుడు నా మన స సు మన స సు లా లేదు .
