पुलिस !	పోలీ స !
वह सही था . मैं गल त थी .	అత నే గె లి చా డు . నేను ఓ డి పోయా ను .
धत . मुझे इससे न फ रत है .	అబ బా . నాకు అది అస స లు న చచ ట లేదు .
तो मुझे जरूर बता ना .	అది ముందు గా నా కే తెలియ ాలి .
के स न ं बर ढूँढ ो और इस सू ची में डा लो .	వాటి కి సం బం ధి ంచిన కే సు నం బ రు ను ప కక న రా సి ఇవ వ ండి .
- तो मैं इस में शा मिल नहीं हूँ गी . - चलो भी , क लो ई .	- మ ధయ లో ననను ద ూ రచ కు . - అబ బా , క లో యి .
नहीं , रुको !	ఓ య , ఆ గు !
सा मान य ? सा मान य . यहाँ कुछ भी सा मान य नहीं हुआ . . .	మా మూ లే నా ? మా మూ లే అ ట . ఇకకడ మా మూ లు గా ఉనన టటు నాకు అనిపి ంచడం లేదు . . .
मैं नहीं बता सकती . यह गो प नी य है .	అది నేను చెపప లేను . అది చాలా గో ప య మెన సమా చా రం .
क सम खा ओ .	పర మా ణం చేయ .
जू न , है थ र वे टा वर स में	జ ూ న , హా తర వే ట వర స కే సు విషయం లో
कभी - कभी , एक ऑ फि सर एक के स को वि कृ त न ज रि ए से देख सकता है .	ఒక కో సారి పోలీ సు ఆ ఫీ స రు , కే సు గురించి తన ద ె న ద ృ క ప థా నని ము ందే ఏ ర పరి చేసు కుంటా రు .
जिस से उसकी माँ , उसका भा ई , उसके दो अ ना थ बच चे मु क द मे के झ ं झ ट से बच गए .	ఇలా మనం ఆమె తల లి కి , అ నన కి , ఇంకా తన ఇ దద రు అ నా థ పిలల లకు వి చా రణ ద వా రా ఎ దు ర యయ ే బా ధ ను ద ూ రం చేయ వచచు .
मैं वा दा करता हूँ .	మా టి సతుననాను .
कि तनी दू र है ?	ఎంత సే పు పడు తుంది ?
समय दे ने के लिए आप दोनों का धनयवाद . . .	మీ ఇ దద రూ సమయం వె చచి ంచి ఇ కకడికి వచచి న ందుకు థ యా ంక యూ . . .
हम इस . . . हम इस सं भा व ना को न कार नहीं सकते .	మనం . . . మనం దానని తో సి పు చచ లే ం .
माफ करना . हैलो , माफ करना .	ఏ వ ండి . హ లో , ఏ వ ండి .
पुलिस इस की त ला श में है .	పోలీ సు లు అతని కోసం గ ాలి సతుననా రు .
पुलिस को बु ला ओ .	పోలీ సు ల కి కాల చేయ ండి .
यही है .	ఇ త నే .
अ ग सत 2 00 9 में .	ఆ గ సట 2 0 0 9 .
सब ठीक है .	మ రే ం పర వాల ేదు .
सर . आप जानते हैं कि मैं घ ट ना स थ ल पर सबसे पहले पहु ँ ची थी ?	సర , ఈ సం ఘ ట నా సథ లి కి మొద ట గా వచచి ంది నే నే .
मु ख र होना ?	న ొ క కి చెపప డ మా ?
कयों नहीं ?	ఎందుకు రాల ే రు ?
वह मी टि ंग .	మరి ఆ సమా వే శం .
जी रो डे ल टा य ै ं की . त ु र ंत फा यर मै न भे जो .	జీ రో డె ల టా యా ం కీ . అత య వ సర ంగా అ గ ని మా ప క సి బబ ంది కావాలి .
को डी न 3 0 ए म जी जू न ल ें कर	కో డీ న 3 0 మి ల లీ గ రా ము లు జ ూ న లె ం కర
चार न ए सं देश - डी सी आई चे म बर स मि स ड क ॉल - लि यो	4 కొతత మె సే జ లు - డి టె క టి వ చ ీ ఫ ఇ నస పె క టర చా ం బర స మి స డ కాల - లి యో
कौन ? पी डि त . लै ब के ख र चे की बात ही छोड ो .	ఎవరు ? ఈ మె హ తు ర ాలు . ల యా బ కి అ యయ ే ఖ రచ ు లు కూడా ఎ కకు వే కదా .
सर . क मा ंड ए ंड क ंट रो ल ने खुद हे ज ले न क ॉल र की सू च ना दी थी .	సర . సర . హ య ీ స లే న కాల ర గురించి మన కు క మా ండ అ ండ క ంట రో ల ఫ లా గ చేశా రు కాబటటి వచచి ంది .
स ौ पर ति श त वही है .	ఖ చచితంగా చె ప తుననా , అత నే .
क ला इ व सि ल कॉ कस का इस पु रा नी ह त या से कोई सं बं ध नहीं है .	ఎపపుడ ో జరిగి న ఈ హ త య కి , క లె వ సి ల కా కస కి సం బం ధ ం ఉ ందని సూ చి ంచే ఆ ధా రం ఏ దీ లేదు .
यह सबसे बु रा फै सला होगा .	అది చే సతే నా బ తు కు బ సట ా ండ అయి న టట ే .
शा बा श , बे टे .	కా ని వ వు . కా ని వ వు .
पर एक आ पा त का ली न फोन क ॉल आया था .	కానీ ఒక రు అత య వ సర కాల చేసి విషయం చెపపా రు కదా .
वे जि तने ऊँ चे हो ते हैं . . .	ఎంత పెదద వా రె తే . . .
उसकी जिंदगी के आ खि री प लों में जो सला ह तुमने उसे दी थी .	తన ఆ ఖ రి కష ణ ాల లో నువవు ఇ చచి న స ల హా ఉ ందే ,
तो , मैंने अपने लिए नहीं ढूँढ ा था . माँ के लिए ढूँढ ा था .	నేను వె తి కి ంది నా కోసం కాదు . అమమ కోసం .
ठीक है . तुम गल त थी .	సరే . నువవు పప పు లో కాల ే శా వు .
जी , सर .	అవును , సర .
- पक का ? - हाँ .	- అంతే అ ంటా వా ? - హా .
आज कोई डॉ क टर यहाँ काम पर है ?	ఇ వాళ అస లు డా క టర లు ఎవర ెనా పని చేసతుననా రా ?
रु कि ए , तो . . .	ఒకక ని మి ష ం , ఆమె . . .
बे शक नहीं .	లేదు గా .
- एक ल ं बी स जा का ट रहा है ? - धनयवाद .	- జె లు శి కష అను భ వి సతుననా డ ని మీకు తెలుసా ? - థ యా ంక స .
भ ि न न ल ह जे . भ ि न न स वर ध व निया ँ .	మాటలా డే శ ె లు లు వే రు . ఉ చచా రణ లు కూడా వే రు .
मुझे लगता है मुझे क ला इ व सि ल कॉ कस मिल गया है .	ఇకకడ క లె వ సి ల కా కస ఉనన టటు ననా డు .
और यह मेरा फोन न ं बर है .	ఇది నా ఫోన నం బర .
- किस के साथ ? - क ला इ व सि ल कॉ कस के साथ .	- ఎవ రి తో ? - క లె వ సి ల కా కస .
आओ , आई ने में देखो .	వచచి అ దద ంలో ఒక సారి చూ సు కో .
हम इस आदमी को ढूँढ रहे हैं .	మేము ఈ వయకతి జా డ ని కను గొ నే పని లో ఉననా ం .
- अंदर कोई है ? - मदद करो ! हम यहाँ हैं !	- లో ప ల ఎవర ెనా ఉననా రా ? - కా పా డ ండి ! కా పా డ ండి ! మేము ఉననా ం .
अगर वह क ॉल र म रि या डी सू जा थी ,	ఒక వే ళ ఆ కాల చేసి ంది మరి యా డి స ౌ జా నే అయితే ,
चलो इस बात को अब य हीं खतम कर ें .	ఈ విష యా నని ఇంత టి తో శా శ వ తంగా ము గి ం పు ప లు కు దాం .
- नहीं . - ग ली चे पर प ें ट .	- బా బో య . - రగ గు పె పె యి ంట పడ ే సి ందని .
हम सभी यह करते हैं .	అంద రికీ అంతే .
मुझे इसका काफी अनु भ व है . मैं त ु र ंत झ ू ठ पक ड सकती हूँ .	నాకు ఇ ద ంతా కొతత కాదు . ఎ దు టి వాళలు అబ దధ ం ఆ డు తు ంటే నేను సు లు వు గా కని పెటట ే య గల ను .
चा हो तो , मैं जा कर आ इस करी म ला सकती हूँ .	కా వాల ంటే ఐ స క రీ మ తె చచి సతా .
जानते हो . . .	ఓ విషయం చెపప నా . . .
ख ै र , वह गल त ऑ फि सर से उ ल झ ा .	అతను పె టటు కు ంది మా మూ లు పోలీ సు తో నా మరి !
- तुम मुझे अपना नाम बता सकती हो ? - म रि या .	- నీ పేరు చెపప గల వా ? - మరి యా .
और उसके स ह कर मी .	ఇంకా అతని త ొ టటి గ యా ంగ .
मुझे नहीं मि ली .	మా దగ గ రికి అది రాల ేదు .
पि छ ले म ंग ल वार की .	పోయి న మ ంగ ళ వా రం వచచి న కాల .
- वाह . - हाँ , देखा ?	- వా వ . - చూశా వా ఎంత బాగు ందో ?
तो , तुमने न ै शन ल डे टा बे स में गा डि यों के न ं बर ों की जो खो ज की थी ं , हमने उसकी सू ची बना ई है .	నే షన ల డే టా బ ే స లో మీరు వె తి కి న వా హ నా ల నం బర ల జా బి తా ఇది గో ండి .
- जिस के बारे में मैंने आपको बु ध वार को बताया था . - अरे , हाँ .	- బు ధ వా రం మి మమ లని కలి శా కదా , ఆమె . - సరే .
नहीं , मैंने उनहें ब ल ॉ क कर दिया है .	లేదు , నేను బ లా క చేసే శా .
उसने कहा कि वह इतना बे व कू फ है और . . .	ప నికి మ ాలి న వా డ ట , ఇంకా . . .
उसने कहा कि वह इतना बे व कू फ है और . . .	ప నికి మ ాలి న వా డ ట , ఇంకా . . .
म रि या के श री र पर घ ों प ने के दो पु रा ने नि शान थे .	మరి యా కి రెండు క త తి పో టలు పడ డా యి .
- लग भ ग ढ ा ई ला ख . - हाँ . वाह , लग भ ग ढ ा ई ला ख .	- సు మా రు గా రెండు నన ర ల కష ల మంది . - హా . వా వ . రెండు నన ర ల కష ల మంది .
- यह सा मान य पर कर िया है . - ठीक है .	- అది మా మూ లే లే . - సరే .
कोई बात नहीं , जान .	బాగా నే ఉననా .
हाँ .	అవును .
और वे . . .	ఇంకా వాళలు . . .
हाँ ?	అవును .
छ ह मिन ट दू र हैं . ज हाँ हो व हीं र हो .	ఆ రు ని మి ష ాల లో వ సతుననా రు . ఎకకడ ఉననా రో , అకకడ ే ఉండ ండి .
जाओ !	పద ండి !
चलो .	ఇ దు గో .
हाँ .	అవును .
हाँ .	అవును .
उसने रि पो र ट छ ु पा ए रख ी .	రి పో ర ట లో ఏ ము ందో ఎవ రికీ చెపప లేదు .
हाँ .	అవును .
हाँ , ऐसा कुछ नहीं जिस से स जा हो .	హా , కానీ ఏ కే సు లో న ూ అతను ద ో షి గా ని రూ పి ంచ బ డ లేదు .
हम इस के स पर ला ख ों ड ॉल र ख र च कर चु के हैं .	ఇ పపటి కే మనం మన బ డ జె ట ని మి ంచి పోయా ం , ఆ మి ంచి పో వడం కూడా వే లల లో .
माफ करना . माफ करना . माफ करना .	ఏ వ ండి . సా రీ . ఏ వ ండి .
पुलिस ! दर वा जा खो लो .	నేను పొ లీ సు ని ! త లు పు తె ర వ ండి .
स ें ट जो से फ स . दो ह जार से जयादा बच चे थे .	సె యి ంట జో సె ఫ స స కూ ల కి . అందు లో 2 , 0 0 0 మంది వి ద యా రథ ు లు ననా రు .
ठीक है . चलो , खेल जा री रख ो .	సరే . ఇక ఆట ఆ డ ండి .
मैंने उसकी च ो ट ें देख ी थी ं .	నే నే స వయ ంగా చూశా .
च ौ बी स बी ले क सट री ट में .	2 4 బీ లే క సట రీ ట .
इसे जानते हो ?	ఇ తన ె వర ో మీకు తెలుసా ?
है गर टी ने रात ों - रात उन दो क ॉल की फ ॉर ें सि क रि पो र ट म ँ गवा ई थी .	హె గర టీ , ఆ రెండు కాల స లో ని గొ ం తు లను చె క చేయ ాల సింది గా రాత రికి రాత రే ఫ ొ రె న సి క పర ీ కష చే యి ంచా డు .
अ लग - अ लग क ला स ों में थे .	అ దీ గా క , రె ండ ే ళ ల తే డా ఉంది ఇ దద రికీ .
हाँ ! यह बढिया है .	అంతే ! సూ పర .
कया गो ल है !	గో ల సూ పర గా వే శా !
चलो दो बा रा खेल ें .	మ ళ లీ ఆ డ దాం .
कया मैं तुमहें आ कर ा म क लग ती हूँ ?	ననను చూ సతే నీకు బాగా ఆ వే శ ంగా ఉనన టటు అనిపి స తో ందా ?
उसके साथ अस प ष ट कार ण ों से अन या य हुआ है .	ఏ వ ో తెలియ ని కా రణ ాల వ లల అతని పె అంద రూ అ మా ను ష ంగా పర వర తి ంచా రని .
पयार में दर द नहीं होना चाहिए	పరే మ వ లల బా ధ తపప దు
तुम य ु द ध हा र गई , ब ू - ह ू .	నువవు యు దధ ంలో ఓ డి పోయా వు , అయితే ఏంటి !
- कयों ? - कयोंकि वह नि य म ों का स खत पा ल न करता है .	- ఎందుకు ? - వాడు రూ ల స పి చచ ో డు .
कया आपको लगता है कि वे एक - दूस रे को जानते थे ?	వాళ లి దద రికీ పరి చ యం ఉ ంద ంటా రా ?
ऐसा बे त ु का कार ण कभी सुना नहीं था .	అ యయ బా బో య , మ రీ దా రు ణం .
एक नि ष ि द ध स ंग ठ न की स द स य ता .	ని ష ే ధి త సం సథ తర ఫ ు న నే రాల కు ప ాల పడు తు ంటా డు .
ब रा य . मैंने सुना कि तुमहारे स मु दा य में एक ह त या हुई है .	బ రె . మీ పరా ంత ంలో హ త య జరిగి న టటు ంది .
या इसे जानते हों .	సం పర ది ంచే పర యత నం చేసతుననా ం .
वे मेरे बे टे को ले गए .	వాళలు నా కొ డు కు ను నాకు ద ూ రం చేశా రు .
सब ठीक है .	మ రే ం పర వాల ేదు లే .
मुझे नहीं पता . मुझे बस नहीं पता .	తె లీ దు . నాకు తె లీ దు .
ए र ॉल पर न ए इ ल जा म थो प सकती हो . . .	నా ఎ ర ర ొ ల మీద ఇంకా ఏ వె నా బ నా యి ంచ ాలని చూ సతుననా రే మో . . .
क सम खा ती हूँ .	పర మా ణం చేసి చె ప తుననా .
भ ि न न म हि ला एँ .	ఇ దద రూ వే ర వే రు మ హి ళ లు .
फिर भी तुम इस मु द दे के चल ते और परे शा निया ँ ख डी करना चाहती हो .	నీ మొ ండి త నం వీ ట నని ంటి కీ అ డ డు పడు తుంది .
थोडा - बहुत ? थोडा - बहुत मतलब ?	ఒక ర క ంగా నా ? అంటే ?
यह आदमी जो मैं बता द ूँ , म ूल रू प से प श चि मी अ फ री की है , हाँ ?	అతను ప శ చి మ ఆ ఫ రి కా కి చె ంది న వాడు కదా ?
ए डा ले इ ड बर ौ ज के . . .	ఏద ెనా అను మా నా స పద ంగా కనిపి సతే . . .
पर ड ो रि स ने म ना कर दिया , इसलिए . . .	కానీ డ ో రి స అలా ంటి వాటి విషయం లో క ఠ ి న ంగా ఉండే ది , కాబటటి . . .
हमें पता चला कि इस आदमी , सि ल कॉ कस पर	ఈ సి ల కా కస అ నే వయకతి పె
मुझे एक मदद चाहिए .	నువవు నా కొ క సా యం చేసి పెటట ాలి .
समझ गई , ओ वर .	స ందే శం అ ంది ంది , ఓ వర .
मेरी बात सुनो , अगर ह त या के इस दूस रे मा म ले के दा वे में कुछ सच चा ई है ,	ఒక విషయం చెపప నా , అ డి లె డ బ రో స హ త య విషయం లో
हाँ . दर अस ल , उस ी ने इसका सु झ ा व दिया .	తెలుసు . నిజ ం చెపప ాల ంటే , నువవు కూడా ఉండ ాలని సూ చి ంచి ంది అత నే .
मु ख य बात यह है कि तुम ठीक हो .	ముఖ య మెన విషయం ఏ ంట ంటే , నువవు సు ర కష ి తంగా బయట పడ డా వు .
- हाँ . - यह बेहद सु वि धा जन क है .	- అవును . - అది అను కు ంటే అంతా సు లు వు అయి పో తుంది కదా .
अगर तुमहें लगता है कि तुम यहाँ आ कर	మీరు ఇ కకడికి వచ చేసి ,
स न 2 0 1 1 . गया रह . यह ह त या का पु रा ना मा म ला है .	హా , 2 0 1 1 . పద కొ ండు అంటే అది బ ే సి సం ఖ య .
तो , मैं पूछ ने पर म जब ू र हूँ , तुमहें वह रि पो र ट कैसे मि ली ?	మరి , అది మీ దగ గ రికి ఎలా వచచి ంది ?
बै क अप आ रहा है .	పోలీ సు ల బ ృ ంద ం బయ లు దే రి ంది .
ठीक है .	సరే .
समझ गई .	సరే .
ठीक है .	సరే .
ठीक है .	సరే .
ठीक है .	సరే .
ठीक है .	సరే .
हाँ .	తెలుసు .
इसलिए हमें फ ॉर ें सि क वि शे ष ज ञ द वा रा वि श ले ष ण का आ देश देना चाहिए . . .	అందు కే మనం ఫో రె న సి క పర ీ కష జర ప ాలి . . .
दो बा रा कोशिश करो . यह बढिया है .	మ ళ లీ ఆ డ దాం . సూ పర .
चलो . हाँ , यह बढिया है .	కా ని వ వు , ననను అ డ డు కో , అ డ డు కో . హా , అంతే .
काम से फोन है .	ఆ ఫీ సు ప నికి సం బం ధి ంచిన ది .
माफ करना .	సా రీ .
जरूर .	తపప కుండా .
पी डि त , म रि या डी सू जा .	మరి యా డి స ౌ జా అ నే మ హి ళ చని పోయింది కదా .
- मुझसे ही सब सी ख ते हो . - माँ , यह फा उ ल है .	- ననను చూ సి ఎలా ఆ డ ాలో నే రచ ు కో ండి . - అమమ , అమ , అమమ . బ ాల ని చే తి తో ప టటు కో కూడ దు .
तुम ठीक हो ?	నువవు బాగా నే ఉననా వా ?
पता नहीं . आ ठ बार ?	సరి గ గా తె లీ దు . ఎ ని మి ది సా ర లే మో .
तुमहारे अनु रो ध के चल ते , डी सी आई है गर टी ने	నువవు కో రా వు కాబటటి , డి టె క టి వ చ ీ ఫ ఇ నస పె క టర , హె గర టీ స వయ ంగా చ ొ ర వ తీసు కొ ని ,
उसके पड ो सी , स ह कर मी , पू र व - पार ट नर हो सकते हैं .	అతనికి ప క కి ంట ో ళ ల నో , ఆ ఫీ సు లో ని స హ ో ద యో గు ల నో , మా జీ భా గ స వా ము ల నో మనం ప టటు కొ ని ఉండ వచచు .
धनयवाद , जाने मन . इस की बेहद जरूरत थी .	థ యా ంక స . బ తి కి ంచా వు .
मेरी बात सुनो , डी ए स ल ें कर ,	చెపప ే ది జా గర తత గా వి న ండి , డి టె క టి వ సా ర జె ంట లె ం కర .
डी ए स ल ें कर से यू नि ट वी 7 को .	వీ 7 యూ ని ట కి డి టె క టి వ సా ర జె ంట లె ం కర ని చె ప తుననాను .
स हम त हो ?	ఒ పపు కుంటుననా వా ?
शा बा श , जे की . चलो .	మ రే ం పర వాల ేదు , జ ే కీ . ని రా శ పడ కు .
तुमहारा सवा ग त है .	పర వాల ేదు .
हाँ . तो यह श वे त वि शे ष ा धि कार है .	అంటే , ఇది తె లల వా రికి మా తర మే ఉండే పర త యే క హ కకు అని అ ంటుననా వా ?
मतलब कष ु ब ध .	చి కా కు పడి పో తు నన టటు గా .
