ए यर क ॉर पस में मे जर , पर न ै वि गे टर नहीं हो .	ఎ యి ర కార ప లో మే జర , కానీ నా వి గే టర కాదు .
मा सू म मा रे जा ते हैं .	అ మా య కు లు చని పో తా రు .
आप से ता री फ सुन कर बेहद खुश ी हुई , मे जर .	మీ పర శం స లు మాకు చాలా బ లా నని సతా యి , మే జర .
कया गु फा वा सी सा इ के ट रि सट के पास गए थे ?	ఆ గు హ మని షి మా న సి క వె ద యం చే యి ంచు కుననా డా ?
मैं उन म हि ला ओ ं को घ ू र रहा हूँ , जब कि पै पी म ू ड बि गा ड ने की कोशिश कर रहा है .	నేను ఆ ఆ డ పిలల ల కి ఎ ర వే సతుననాను ఇంకా పా ప ీ ఇకకడ మా మూ డ చె డ గొ టట ాలని చూ సతుననా డు .
यह दो बा रा मत करना .	ఇం కో సారి అలా చేయ కు .
कृ पया , न ॉर फो क 7 3 2 2 .	నో ర ఫో క 7 3 2 2 , ప లీ జ .
- कया बे बी फ े स . . . - बे इ ली , मैं . . .	- బ ే బీ ఫ ే స . . . - బె యి లీ , నేను . . .
ठीक कर रहा हूँ , मे जर . जि तनी ते जी से हो स के , कर रहा हूँ .	అదే పని లో ఉననా , మే జర . సా ధయ మెన ంత వే గ ంగా పని చేసతుననా .
ऊ पर मिल ते हैं , बक .	అకకడ కలు దదాం , బ క .
तुमहें ड ो न ट चाहिए ?	నీకు డ ో న ట కా వ ాలా ?
मैंने कोशिश की थी .	నేను పర యత ని ంచా ను .
- यह लो . - धनयवाद .	- ఇది గో . - థా ంక స .
उसे बाहर निका लो .	దానని బయట కి తీ యి .
वह बेहद शान दार था . हम उससे और आगे कैसे जा सकते हैं ?	మన పరి చ యం గొ పప గా సా గి ంది . అంత క ననా ఇం కే ం ఉంటుంది ?
टे ले र मा , अ ल जी रि या 2 0 अ ग सत , 1 9 4 3	తె లె రగ మా , అ ల జీ రి యా ఆ గ సట ు 2 0 , 1 9 4 3
यहाँ आओ , मी ट ब ॉल .	ఇలా రా , మీ ట బ ాల .
मुझे वह अभी दो .	దానని నాకు ఇవ వు .
नहीं , पा य लट हूँ .	లేదు , పె లె ట ని .
एक अ म री की ही रो .	ఒక అ మె రిక న హ ీ రో .
तुमने देखा ब ले क ली और कर ॉ ज के फो र ट का कया हुआ ?	బ లే క లీ ఇంకా క రో జ విమా నా నికి ఏ మె ందో నువవు చూశా వా ?
डे ली हे रा लड ए ट थ ए यर फो र स ने ब रे मे न त बा ह किया	డె లీ హె రాల డ బ రె మన ని ధ వం సం చేసిన ఎ యి త ఎ యి ర ఫో ర స
मुझे पता नहीं वह कहाँ है , सर .	అది ఎకకడ ఉ ందో నాకు తెలియదు , సర .
ठीक है , मैं गल त था . चलो चल ें .	సరే , నేను పొ ర బ డ డా ను . వెళ దాం పద .
कयों ? तुमहें हमेशा ऐ सी चीज ें कयों बोल ते हो ?	ఎందుకు ? ఎపపుడూ ఇలా ంటి మాట లు మాటలాడ తా వు ఎందుకు ?
- नहीं , हम उसके बी च में से गु ज रे . - सक वा डर न ली ड मा रा गया .	- లేదు , మేము దాని గు ండా పర యా ణ ి ంచా ం . - స క వా డ ర న లీ డ నే ల కూ లి ంది .
मैं उसे बाहर नहीं निका ल स का .	నేను అతని ని పె కి లా గ లే క పోయా ను .
तुम मौ त के जि तने करी ब हो ते हो , उ तना ही जी व ंत मह सू स करते हो .	మనం చా వు కి ఎంత దగగర యి తే , అంత స జీ వ ంగా ఉనన టలు ఫీ ల అవు తా ం .
कया . . . नहीं , नहीं म री है !	తను . . . లేదు , తను చని పో లేదు !
वह ऐसा था मान ो हम ध मा को ं की ठ ो स दी वार से गु जर रहे थे .	మేము శ తరు విమా నా ల అ డ డు గో డ గు ండా వెళ తు నన టలు గా అనిపి ంచి ంది .
हम पर भी घ मा सान हम ला हुआ था .	మేము కూడా ఆ ఉ ధ ృ తి ని చూశా ం .
डॉ जर स से पहले , बे ब रू थ किस के लिए खेल ता था ?	డా డ జర స కి ముందు బ ే బ రూ త ఏ జ టటు లో ఆ డా డు ?
जाओ उनहें ध ूल च टा दो , लड को ं .	వాళల పని ప టట ండి , కు ర రా ళ లూ .
हे यर ऑ फ द डॉ ग .	మరి కా సత మ ద యం .
और सोच ता हूँ कया हम कभी बा की साथ ि यों से कभी मिल पा एँ गे .	కానీ మనం ఎ పపటి కె నా మన మి గ తా సె ని కు లని చూడ గల మో లే ద ో .
और उससे पहले रे ड स ॉ कस के लिए खेल ता था .	కానీ దా నికి ముందు , రె డ సా కస జ టటు కి ఆ డా డు .
मुझे पता नहीं था कि मैं कुछ ख री द रहा हूँ .	కానీ , నేను ఏద ెనా ఆ శి సతుననా నని అను కో ను .
तुमहें पता है कि मेरा द ल कहाँ उ तर रहा है ?	నా గర ూ పు ఎకకడ ది గు తుననా రో నీకు తెలుసా ?
कया तुम ल ंद न कभी नहीं गए ?	నువవు ఎపపుడూ ల ండ న వెళల లేదా ?
हर स थ ि ति से जि ं दा लौ टो गे .	ఎ నని కష ట ాల నె నా ఎ దు రి ంచ గల వు .
इसलिए मैं से ना में शा मिल हुआ था . पर ल हा र बर से पहले ही .	అందు కే నేను సె న యం లో చే రా ను . పె ర ల హా ర బర కంటే ముందు .
पर हमने सुना कि तुम क माल के पा य लट हो .	కానీ మీరు అ సా ధా రణ మెన పె లె టలు అని వి ననా ం .
परि स थ ि त िया ँ कै सी थी ं ? कया तुम ल कष य देख पा रहे थे ?	అకకడ పరి సథి తు లు ఎలా ఉననా యి ? మీరు ల కష యా నని చూడ గ లి గా రా ?
ठीक है , को च से क हो कि मैं खेल के समय तक पहु ँच जा ऊँ गा .	సరే , బయ లు దే రే సమ యా నికి నేను వ సతా నని కో చ కి చెపపు .
वह य ै ं की ज के लिए खेल ता था .	అతను యా ం కీ స తర పు న ఆ డా డు .
कै प ट न ग ले न डा ई और उन का द ल 2 5 मि श नों के करी ब पहु ँच ने वाले पहले थे .	కె ప టె న గ లె న డె ఇంకా ఆ యన సి బబ ంది మొద ట గా వి జ యా నికి చే రు వయ యా రు .
फिर यह सा बि त करने के लिए	తరువాత కొనని ఊ ళ లు తి రుగు త ూ
उसने कया कहा ?	ఆమె ఏం అ ంది ?
- शु भ काम ना एँ , दोसत . - हाँ .	- గు డ ల క , మి తర మా . - సరే .
अब वह ठीक हो जाना चाहिए .	ఇపపుడు బాగా నే పని చే సతుంది .
ते रह आए हैं .	అది గో పద మూ డు .
मैं ने त ृ त व करना चा हूँ गा .	నాకు ముఖ య మెన సథ ా నం కావాలి .
और मैं वह तुमहारे साथ करना चा हूँ गा .	అద ంతా నీ తో కలి సి చేయ ాలి అనుకుంటుననా ను .
अरे कया तुम देख सकते हो	ఓ య చెపపు నీకు కనిపి స తో ందా
स न 1 9 4 3 की श र द ऋ त ु में ,	1 9 4 3 నా టి ఆ కు ర ాలు కాల ంలో ,
लि ल , डा ई की चि ं ता मत करो . 2 5 मि शन . वह जल द ही यहाँ पहु ँच जाएगा .	లి ల , డె గురించి ఆ ందో ళ న పడ కు . ఇ ర వె మి షన లు . త వర లో వచ చేసతా డు .
अगर एक और पा य लट आ लू के खे त में स डा , तो मेरा दिल स ह नहीं पा ए गा .	మర ొ క పె లె ట ఆ లు గ డ డ ల పొ ల ంలో పని చేయ డా నని నా మన సు భ రి ంచ లేదు .
उसने बताया कि पा वे ल को पहले ह फ ते ही सि ले स िया के ऊ पर मार गि रा या गया .	మొద టి వా రం లో నే సి లే సి యా పరా ంత ంలో పా వె ల మీద కాల పు లు జ రి గా య ని అతను చెపపా డు .
हैलो , मे जर .	అది గో , మే జర .
- दूस रे श बद ों में , कुछ नहीं . - ख रा ब करने की .	- ఇం కో లా చెపప ాల ంటే , ఇకకడ ఏమీ జ రగ డం లేదు . - పా పం .
हम तुमहें स पे न ले जाएँ गे और फिर इ ंग लै ंड में तुमहारे घर .	మి మమ లని స పె యి న కి తీసుకు వెళలి అ కకడి నుండి ల ండ న కి చే రు సతా ము .
हमने बि डि क , क ले टर , व ै न न ॉ य और उनके द लों को खो दिया था .	మేము బి డ డి క , క లే టర , వ యా న నో య ఇంకా వాళల సి బబ ంది ని కో ల పోయా ము .
ब रे मे न पर ब म बा री करने का हमा रा पह ला पर या स वि फ ल रहा था .	బ రె మన మీద బా ం బు లు వే య ాల నన మా త ొ లి పర యత నం ఘ ో ర ంగా వి ఫ ల మ యి ంది .
- हम पहले न ं बर पर हैं . - लग भ ग हो गया , मे जर .	- మన దే మొద టి విమా నం . - దా దా పు అయి పోయింది , మే జర .
सोच ने का कोई फा य दा नहीं है , स जज नों .	ఆలోచి సతే ఉ ప యో గం లేదు , జె ంటి ల మెన .
तुम मेरी इ कल ौ ती परि य त मा हो और हमेशा र होगी .	నేను పరే మి ంచే ఒక ే ఒకక అమమా యి వి , ఎ పపటి కీ నువ వే .
व ॉर ब ॉ न ड पो सट र के लिए उ प य ु कत मह सू स कर रहा हूँ .	నాకు కూడా వా ర బా ండ పో సట ర లా గే అనిపి సతోంది .
पर हम उनहें हमेशा पक ड ले ते हैं .	కానీ మేము ఎపపుడూ వాళ లని ప సి గ డ తా ము .
अ ग ली बार मैं कोशिश ही नहीं कर ूँगा .	మ రో సారి నేను ఇలా ఇ బబ ంది పెటట ను .
- उसके साथ कॉ फी लो गे , ले फ टि न ें ट ? - कृ पया .	- దాని తో పా టు కా ఫీ కా వ ాలా , లె ఫ టె నె ంట ? - ప లీ జ .
तुमहारा प द ?	నీ ఉద యో గం ?
तुमसे गल ती हो सकती थी .	నువవు పొ ర బ డి ఉంటా వు .
अरे , नहीं . मैं उस तरफ जा रहा हूँ .	ఓహ , లేదు . నేను అ టు వెళ తుననాను .
हम य ु द ध में शा मिल हो कर बेहद खुश हैं , सर .	ఈ యు దధ ంలో ప ాల గొ ంటు నన ందుకు సంతో షి సతుననా ం , సర .
मेरी अभी - अभी डॉ क सट ो वर के साथ म ू ड - ख रा ब होने वाली बात ची त हुई .	ఇ పపుడ ే నేను ఉ త సా హా నని చం పే సే సం భా ష ణ డా క టర సట ో వర తో చేసి వ సతుననాను .
मुझे तुमसे कुछ पूछ ना है , क वि न .	నేను నినను ఒక విషయం అ డ గ ాలి , క వి న .
एक और मि शन .	మర ొ క మి షన .
पक का तुम ना श ता खा ने आ ने वाले हर सै निक को इ नहीं न जर ों से देख ती हो .	బ రే క ఫ ా సట కావాలి అను కు నే ఎవ రి నె నా నువవు ఏ వ గి ంచు కుంటా వు కదా .
कया कोई बाहर कू दा ? कया तुमहें पै रा श ू ट दि खे ?	ఎవర ెనా బయట పడ డా రా ? పా రా చూ టలు కనిపి ంచా యా ?
ठीक है , दोसत ों , चलो जलदी करो .	సరే , మి తరు లా రా , త వర గా త యా ర వు దాం .
वह रहा हमा रा अपना चार ली रॉ बर ट स न .	ఇది గో మన మని షి చా ర లీ రా బర ట స న .
सर , सर . मुझे आप की टि क ट देख नी है .	సర , సర . నేను మీ టి కె ట చూడ ాలి .
हमें अभी यहाँ से निकल ना होगा .	మనం వె ంట నే ఇ కకడి నుండి బయట పడ ాలి .
ये लड के तुमहें मु सी ब त ों से दू र रख रहे हैं ?	ఈ పిలల లు , నినను ఇ బబ ంది పెటట డం లేదు కదా ?
फिर मिल ेंगे , लड को ं .	మ ళ లీ కలు దదాం , పిలల లూ .
तुमहें छ ु ट टी चाहिए .	నీకు వి శ రా ం తి కావాలి .
परे शान मत हो ओ . जर मन तुमहारे हर ब म के ह क दार हैं .	బా ధ పడ దదు . మీరు చేసే పరతి బా ం బు దా డి కి జర మన లు అ ర హు లే .
- किसी ल कष य पर हम ला नहीं किया था . - हे भगवान , कर ै ं क .	- ఇంత కు ముందు ఎపపుడూ మన కి లేదు . - దేవుడా , క రా ంక .
- तुम सब ठीक हो ? - तुमहें वापस देख कर खुश ी हुई .	- మీ రం తా బాగా నే ఉననా రా ? - మీరు తిరిగి రా వడం సంతో ష ం .
यह ब ॉ ब है .	ఇ తను బా బ .
स टा र - स पै ंग लड बै नर .	సట ా ర స పా ంగ ె ల డ బ యా న ర .
चार ली ? चार ली कौन है ?	చా ర లీ ? చా ర లీ ఎవరు ?
चलो चल ें !	వెళ దాం పద !
टि क ट , सर !	టి కె ట , సర !
अपनी जे ब ों में देखो !	మీ జ ే బు లలో చూడ ండి !
वे वापस नहीं लौ टे .	వాళలు తిరిగి రాల ేదు .
नहीं . मैंने बस इतना कहा कि यह हमारे लिए अचछा सं के त नहीं है .	లేదు . నేను చెపపి ంద ల లా ఇ ద ంతా మంచి సం కే తం కా దని మా తర మే .
दूस रे गु फा वा सी पर हम ला करने गया था .	యు దధ ం ఆ వి ధ ంగా నే కొ న సా గు తో ందని చెపపా ను .
वह मु श कि ल से एक कि श ो री है .	ఆమె ఇంకా టీ నే జ వయ సు లో నే ఉంది .
कुछ लोगों का मान ना है कि य ु द ध और नि र र थ क ह त या के बी च अं तर है .	యు దధ ా ని కీ ఇంకా వి చ కష ణ ా ర హి త మెన హ త య ల కీ వయ త యా సం ఉ ందని కొ ంద రు న మ ము తా రు .
यह जान लो कि तुम हमेशा मेरे ख या लों में रह ती हो ,	నువవు ఎపపుడూ నా ఆలో చ న లలో ఉంటా వ ని తెలుసు కో ,
जि ं दा रह ने की कोशिश करना .	స జీ వ ంగా ఉండ టా నికి పర యత ని ంచు .
तुम पहले परि चि त चे ह रे हो जि से मैंने देखा .	నాకు పరి చ యం ఉనన వాళ లలో మొద ట గా ని న నే చూ సతుననాను .
दर अस ल , वे मुझे मु सी ब त में डा ल ते रह ते हैं , ज ॉ न .	లేదు , వాళలు ననను ఇ బబ ంది పె డు తుననా రు , జా న .
तुमहें फ लो रि डा से पहले घर जाने का मौ का मिले गा ?	ఫ లో రి డా వెళల డానికి ముందు స ొ ంత ూ రు వెళ తా వా ?
बे शक नहीं हुई थी , रे ड . हर य ु द ध की अपनी न वी न ता एँ होती हैं .	అవును , ఖ చచితంగా ఉండ దు , రె డ . పరతి యు దధ ంలో ఏదో ఒక కొతత ద నం ఉంటుంది .
सही कहा .	అది నిజ ం .
तुम दोनों को यह ख ट क नहीं रहा है ?	మీకు ఇ ద ంతా వి డ డ ూర ంగా అనిపి ంచడం లేదా ?
तुम सभी ?	మీ రం తా నా ?
कया तुमहारी आ त मा पर इसका बो झ है ?	అది మీ వి చ కష ణ మీద పర భా వం చూ పి సతు ందా ?
अरे , धत .	ఛ ీ , చెతత .
र न - अप के द ौ रा न वह बंद हो रहा है .	ఆ ఇం జ న ఆ న చే సతు ంటే మ ధయ లో ఆ గి పో తోంది .
हाँ , बे शक . पक का बे बी फ े स ने भी निकल ना का रा सता ढूँढ लिया होगा .	అవును , అది నిజ ం . బ ే బీ ఫ ే స ఎలా గో అలా తపప ి ంచు కు ని ఉంటా డు .
और फिर वे अ ग ले वाले को ढूँढ ेंगे और फिर उनके साथ भी वही करेंगे .	ఆ తరువాత మర ొ కరి ని ప టటు కు ని వాళ లని కూడా అలాగే చం పే సతా రు .
ग न री पर शि कष ण . ले फ टि न ें ट न ै श ने भी किया .	గ న పే ల చ డం గురించి శి కష ణ . లె ఫ టె నె ంట నా ష కూడా .
हम बस तुमहारे लिए खुश हैं , डा ई .	నీ విషయం లో మేము సంతో ష ంగా ఉననా ం , డె .
कया तुम मेरे साथ सो ना चाहते हो ?	నా తో శ ృ ంగా రం చేయ ాలని అనుకుంటుననా రా ?
पर तुमहें शा ंत और च ौ क न ना रह ना होगा .	కానీ మీరు తెలి వి గా వయ వ హ రి ంచాలి .
हम म ही नों से य ु द ध में शा मिल होने का अनु रो ध कर रहे हैं .	మేము కొ ద ది నె ల లు గా మమ మ లని యు దధ ంలో భా గ స వా మ యం చేయ మని కో రు తుననా ం .
ब ॉ ब , तुमहारे पास ला इ टर है ?	బా బ , నీ దగగర లె టర ఉ ందా ?
- मे जर . - ए , वहाँ देखो .	- మే జర . - హేయ . అ టు చూడ ండి .
यह सा रे पा य लट करते हैं .	అంద రు పె లె టలు అదే చేసతా రు .
- बस एक बचा है , ले मन स . - हम अब भी मि शन स थ गि त कर सकते हैं , बक .	- మన ముందు ఒకక విమా న మే ఉంది , లె మన స . - మనం ఇ పపుడ ెనా వా యి దా వే య చచు , బ క .
तुम . मेरे साथ आओ .	నువవు . నా తో రా .
अपने पे पर के ऊ पर आज की ता री ख लि खो .	ఆ కా గి తం పె న ఈ రోజు తే దీ రా యి .
1 6 सि त ं बर , 1 9 4 3	సె ప టె ం బర 1 6 , 1 9 4 3
उसका कया मतलब है ?	దాని అరథం ఏంటి ?
- चि यर स . - चि यर स .	- చ ీ ర స . - చ ీ ర స .
मुझे जाना होगा .	నేను ఇం క వెళల ాలి .
अगर जर म नों को यह मि ला ,	జర మన లు గ ను క ఇది చూశా ర ంటే ,
कै सा चल रहा है , ले मन स ?	పని ఎలా న డు సతోంది , లె మన స ?
रो जी स रि वे टर स . 4 1 8 वा ं .	రో సీ స రి వె టర స . 4 1 8 వ గర ూ ప .
हमारे लड के कहाँ हैं , चि क ?	మన కు ర రా ళ లు ఎకకడ , చి క ?
और मैंने सो चा था कि मैं पी ने के बाद थोडा ना ट की य हो गया था .	నేను తా గి న మె క ంలో నా ట కీ య ంగా పర వర తి ంచా ను అను కుననాను .
ख ै र , दे र आए पर दु रु सत आए , ह ँ ?	పో నీ లే , ఆ ల సయ ంగా అయి నా వచచా రు , హా ?
